index,published,keyword,domain,language,valid,title,description,url,image,archive,content,quote,de,en,la,added
734788833d4e5abd186a33665d1f1a29,2026-01-15T01:57:19Z,+fog weather,economictimes.indiatimes.com,en,0.8,"Delhi, Noida, Gurugram cold wave warning: IMD issues yellow alert for Delhi as winter tightens grip in capital; Gurgaon may freeze at 1 degree. See forecast","Delhi, Noida, Gurugram weather: The residents of Delhi woke up to yet another bitter winter morning as dense fog returned and the capital remained in the grip of a cold wave for the fifth straight day on Thursday. The IMD has issued a yellow alert for cold wa…",https://economictimes.indiatimes.com/news/new-updates/delhi-noida-gurugram-cold-wave-warning-imd-issues-yellow-alert-for-delhi-as-winter-tightens-grip-in-capital-gurgaon-may-freeze-at-1-degree-see-forecast/articleshow/126536784.cms,"https://img.etimg.com/thumb/msid-126536811,width-1200,height-630,imgsize-52866,overlay-economictimes/articleshow.jpg",http://web.archive.org/web/20260116014917/https://economictimes.indiatimes.com/news/new-updates/delhi-noida-gurugram-cold-wave-warning-imd-issues-yellow-alert-for-delhi-as-winter-tightens-grip-in-capital-gurgaon-may-freeze-at-1-degree-see-forecast/articleshow/126536784.cms,"Delhi weather: There was no respite from dense fog for Delhiites on Thursday as a dense layer of thick fog gripped the Delhi-NCR region today, severely reducing visibility and disrupting normal life … [+3703 chars]",,"Warnung vor Kältewelle in Delhi, Noida und Gurugram: IMD gibt für Delhi gelbe Warnung aus, da der Winter die Hauptstadt fester in den Griff bekommt; Gurgaon kann bei 1 Grad gefrieren. Siehe Prognose. Wetter in Delhi, Noida, Gurugram: Die Einwohner von Delhi erwachten zu einem weiteren bitteren Wintermorgen, als dichter Nebel zurückkehrte und die Hauptstadt am Donnerstag den fünften Tag in Folge von einer Kältewelle erfasst wurde. Das IMD hat eine gelbe Warnung für kaltes Wasser herausgegeben.","Delhi, Noida, Gurugram cold wave warning: IMD issues yellow alert for Delhi as winter tightens grip in capital; Gurgaon may freeze at 1 degree. See forecast. Delhi, Noida, Gurugram weather: The residents of Delhi woke up to yet another bitter winter morning as dense fog returned and the capital remained in the grip of a cold wave for the fifth straight day on Thursday. The IMD has issued a yellow alert for cold wa…","Delhi, Noida, Gurugram undam frigidam monens: IMD exit flavis intenti Delhi sicut hiems in caput constringit; Gurgaon potest ad 1 gradum durare. Vide Providemus. Delhi, Noida, Gurugram tempestas: Incolae Delhi experrecti sunt usque ad alteram hiemem amaram mane sicut densa nebula rediit et caput in manu frigidae undae manserunt propter lineam quintam diei Iovis. IMD est luteum intenti frigoris WA edita ...",2026-01-17 05:16:47+00:00
7578385e865ca626489a6b6c0a6a05b7,2026-01-16T02:26:54Z,+fog weather,economictimes.indiatimes.com,en,0.8,Delhi-NCR weather warning: IMD sounds yellow alert as capital freezes at 2.9 degrees; Noida to see very dense fog amid bone-chilling cold. Check forecast,"IMD Delhi NCR Weather Update: Delhi-NCR region has been in the grip of winter for the past few days and witnessing intense cold. For Friday, the IMD has sounded a yellow alert for Delhi and has warned of cold wave conditions are likely at isolated places. On …",https://economictimes.indiatimes.com/news/new-updates/delhi-weather-update-imd-delhi-ncr-weather-warning-imd-sounds-yellow-alert-as-capital-freezes-at-2-9-degrees-noida-to-see-very-dense-fog-check-forecast/articleshow/126555678.cms,"https://img.etimg.com/thumb/msid-126555709,width-1200,height-630,imgsize-17040,overlay-economictimes/articleshow.jpg",http://web.archive.org/web/20260116030552/https://economictimes.indiatimes.com/news/new-updates/delhi-weather-update-imd-delhi-ncr-weather-warning-imd-sounds-yellow-alert-as-capital-freezes-at-2-9-degrees-noida-to-see-very-dense-fog-check-forecast/articleshow/126555678.cms,"Investment Ideas
Grow your wealth with stock ideas &amp; sectoral trends.
Stock Reports Plus
Buy low &amp; sell high with access to Stock Score, Upside potential &amp; more. 
BigBull Portfolio
G… [+439 chars]",,"Wetterwarnung Delhi-NCR: IMD gibt Alarmstufe Gelb aus, da die Hauptstadt bei 2,9 Grad gefriert; Noida sieht sehr dichten Nebel inmitten klirrender Kälte. Prognose prüfen. IMD Delhi NCR Wetter-Update: Die Region Delhi-NCR war in den letzten Tagen im Griff des Winters und erlebte starke Kälte. Für Freitag hat das IMD eine gelbe Warnung für Delhi ausgelöst und davor gewarnt, dass an isolierten Orten Kältewellenbedingungen wahrscheinlich sind. An …","Delhi-NCR weather warning: IMD sounds yellow alert as capital freezes at 2.9 degrees; Noida to see very dense fog amid bone-chilling cold. Check forecast. IMD Delhi NCR Weather Update: Delhi-NCR region has been in the grip of winter for the past few days and witnessing intense cold. For Friday, the IMD has sounded a yellow alert for Delhi and has warned of cold wave conditions are likely at isolated places. On …","Tempestas Delhi-NCR monens: IMD sonat flavum erectum ut caput coit ad 2.9 gradus; Noida videre nebulam densissimam inter ossea frigida. Prospicere reprehendo. IMD Delhi NCR Tempestas Renovatio: Delhi-NCR regio hieme hos paucos dies in complexu et intensiorem frigoris spectans fuit. Veneris enim, IMD flavum intentum in Delhi sonavit et condiciones aquae frigidae monuit ut in locis solitariis verisimile sit. In ...",2026-01-17 05:16:47+00:00
1103c30c234d13d4d0627736bd95089d,2026-01-16T04:03:59Z,+fog weather,economictimes.indiatimes.com,en,0.8,Noida schools closed: Winter break in Delhi-NCR extended till January 17? Here's what the latest update says,"School Holiday News 16th 17th January: Due to the dense fog and intense cold weather, the schools in Noida upto class 8 will remain closed on January 16 and 17, an official order said. However, schools in Delhi will remain open today and tomorrow. The IMD has…",https://economictimes.indiatimes.com/news/new-updates/schools-winter-holidays-schools-in-delhi-noida-to-remain-closed-noida-schools-closed-winter-break-in-delhi-ncr-extended-till-january-17-heres-what-the-latest-update-says/articleshow/126556930.cms,"https://img.etimg.com/thumb/msid-126556953,width-1200,height-630,imgsize-32038,overlay-economictimes/articleshow.jpg",,"The schools in Gautam Buddh Nagar will remain shut on Friday and Saturday due to dense fog and extreme cold, an official order from the district administration revealed. Schools up to Class 8 across … [+3099 chars]",,"Noida-Schulen geschlossen: Winterpause in Delhi-NCR bis zum 17. Januar verlängert? Hier ist, was das neueste Update sagt. Schulferiennachrichten vom 16. bis 17. Januar: Aufgrund des dichten Nebels und der starken Kälte bleiben die Schulen in Noida bis zur 8. Klasse am 16. und 17. Januar geschlossen, heißt es in einer offiziellen Anordnung. Die Schulen in Delhi bleiben jedoch heute und morgen geöffnet. Das IMD hat…","Noida schools closed: Winter break in Delhi-NCR extended till January 17? Here's what the latest update says. School Holiday News 16th 17th January: Due to the dense fog and intense cold weather, the schools in Noida upto class 8 will remain closed on January 16 and 17, an official order said. However, schools in Delhi will remain open today and tomorrow. The IMD has…","Scholae Noidae clausae: Hiems confractus in Delhi-NCR usque ad diem 17 Ianuarii extenditur? Hic est quod dicit tardus renovatio. Scholae Holidays News 16th 17 Ianuarii: Ob caliginem densam et frigoris intensam, scholae in Noida usque ad 8 classem clausae manebunt die 16 Ianuarii et 17, ordo officialis dixit. Sed scholae in Delhi hodie et cras apertae erunt. IMD est…",2026-01-17 05:16:47+00:00
2b0d0b5aad2fd311049c5b72e17ec3bf,2026-01-15T21:01:17Z,+foggy conditions,www.makeuseof.com,en,0.3,My windows stopped fogging up after I tried these simple tricks,I stopped condensation from forming on the inside of my windows.,https://www.makeuseof.com/window-stop-fogging-tricks/,https://static0.makeuseofimages.com/wordpress/wp-content/uploads/wm/2026/01/fog-on-window.jpg?w=1600&h=900&fit=crop,http://web.archive.org/web/20260115234802/https://www.makeuseof.com/window-stop-fogging-tricks/,"My three-season room has these big, beautiful windows that turn into a foggy mess every winter. I'm talking condensation dripping down the glass before 7 AM, pooling on the sills. The room doesn't co… [+6667 chars]",,"Meine Scheiben beschlagen nicht mehr, nachdem ich diese einfachen Tricks ausprobiert habe. Ich habe verhindert, dass sich an der Innenseite meiner Fenster Kondenswasser bildet.",My windows stopped fogging up after I tried these simple tricks. I stopped condensation from forming on the inside of my windows.,"Fenestrae meae obstruxerunt, postquam has simplices praestigias temptavi. Substiti condensationem ab interioribus meis fenestras formare.",2026-01-18 01:19:29+00:00
98dc0ef0ae6e40bf9572aaae6c78292c,2026-01-09T05:00:00Z,+fog accident,science.nasa.gov,en,0.3,Ganges Delta Under a Winter Shroud of Fog,Low clouds blanketed the delta while parallel cloud bands rolled over the Bay of Bengal during a January cold wave.,https://science.nasa.gov/earth/earth-observatory/ganges-delta-under-a-winter-shroud-of-fog/,https://assets.science.nasa.gov/dynamicimage/assets/science/esd/eo/images/iotd/2026/ganges-delta-under-a-winter-shroud-of-fog/cloudstreets_tmo_20250106_th.jpg,http://web.archive.org/web/20260109175211/https://science.nasa.gov/earth/earth-observatory/ganges-delta-under-a-winter-shroud-of-fog/,"Winter weather took hold across the Indo-Gangetic Plain in early January 2026, bringing dense fog and cold temperatures to much of the flat, fertile lands that span from Pakistan and northern India t… [+2183 chars]",,"Gangesdelta unter einem winterlichen Nebelschleier. Niedrige Wolken bedeckten das Delta, während während einer Kältewelle im Januar parallele Wolkenbänder über den Golf von Bengalen rollten.",Ganges Delta Under a Winter Shroud of Fog. Low clouds blanketed the delta while parallel cloud bands rolled over the Bay of Bengal during a January cold wave.,"Ganges Delta sub hyemali Integumento Caligo. Nubes demissae straverunt Delta, dum vincula parallela volvebantur per Sinus Bengalam per Ianuarias frigidas undas.",2026-01-18 05:20:15+00:00
6ac9c59150b4b1a7aba5da1e40d6dd5b,2026-01-12T00:00:01Z,+fog accident,www.businessinsider.com,en,0.3,I flew drones on Ukraine's fiercest battlefield. The last few months laid bare the limits of today's drone warfare.,"Sgt. Dimko Zhluktenko, a commander of a drone team, told Business Insider what it was like flying in the heavy fog that Russia used to its advantage.",https://www.businessinsider.com/ukraine-drone-operator-flew-pokrovsk-russian-war-limitations-fpv-recon-2026-1,https://i.insider.com/6949675764858d02d2173ca1?width=1200&format=jpeg,,"Dimko Zhluktenko is a sergeant in the Unmanned Systems Forces of Ukraine.Dimko Zhluktenko
<ul><li>Dimko Zhluktenko is a drone operator who provides vital data to defend Ukraine's positions.</li><li>… [+7179 chars]",,"Ich habe Drohnen auf dem härtesten Schlachtfeld der Ukraine geflogen. Die letzten Monate haben die Grenzen der heutigen Drohnenkriegsführung offengelegt. Sgt. Dimko Zhluktenko, Kommandant eines Drohnenteams, erzählte Business Insider, wie es war, im dichten Nebel zu fliegen, den Russland zu seinem Vorteil nutzte.","I flew drones on Ukraine's fiercest battlefield. The last few months laid bare the limits of today's drone warfare.. Sgt. Dimko Zhluktenko, a commander of a drone team, told Business Insider what it was like flying in the heavy fog that Russia used to its advantage.","Fucos volavi in ​​pugna acerrima Ucrainae. Paucissimis mensibus limites fuci belli hodie detexerunt.. Centurio. Dimko Zhluktenko, praefectus turmae fuci, nuntiavit Insider Negotium qualis esset in nebula gravi volans quod Russia ad suum commodum usus est.",2026-01-18 05:20:15+00:00
adfabe73fe152ea96b8e045fe5f7e22b,2026-01-11T03:47:28Z,+fog warning system,economictimes.indiatimes.com,en,0.3,Delhi gripped by cold wave; IMD issues yellow alert as 'very poor' air quality persists,"Delhi experienced a chilly Sunday morning with temperatures dropping to 6.6 degrees Celsius amid ongoing cold wave conditions. While air quality saw a marginal improvement to the 'poor' category (AQI 298), smog persisted, affecting visibility. Despite this sl…",https://economictimes.indiatimes.com/news/india/delhi-ncr-noida-weather-today-jan-11-imd-weather-aaj-ka-mausam/articleshow/126461105.cms,"https://img.etimg.com/thumb/msid-126461113,width-1200,height-630,imgsize-3404,overlay-economictimes/articleshow.jpg",http://web.archive.org/web/20260112040720/https://economictimes.indiatimes.com/news/india/delhi-ncr-noida-weather-today-jan-11-imd-weather-aaj-ka-mausam/articleshow/126461105.cms,"A cold wave has tightened its grip on Delhi, with the India Meteorological Department (IMD) issuing a yellow alert for Sunday and Monday as temperatures are expected to remain low and dense fog to pe… [+2249 chars]",,"Kältewelle erfasst Delhi; Das IMD gibt eine gelbe Warnung aus, da die Luftqualität weiterhin „sehr schlecht“ ist. Delhi erlebte einen kühlen Sonntagmorgen mit Temperaturen, die aufgrund anhaltender Kältewellen auf 6,6 Grad Celsius sanken. Während sich die Luftqualität geringfügig auf die Kategorie „schlecht“ (AQI 298) verbesserte, blieb der Smog bestehen und beeinträchtigte die Sicht. Trotz dieses Sl…","Delhi gripped by cold wave; IMD issues yellow alert as 'very poor' air quality persists. Delhi experienced a chilly Sunday morning with temperatures dropping to 6.6 degrees Celsius amid ongoing cold wave conditions. While air quality saw a marginal improvement to the 'poor' category (AQI 298), smog persisted, affecting visibility. Despite this sl…","Dellium gelida corripit unda; IMD exit flavus erectus ut 'pauperrimus' qualitas aeris persistat. Delhi periti Solis dies frigidos mane cum temperaturis ad 6.6 gradus Celsius permittentes inter undas frigidas permanentes condiciones. Dum qualitas aeris vidit emendationem marginalem ad categoriam ""pauperum"" (AQI 298), perstitit smog, visibilitate afficiens. Quamvis haec sl…",2026-01-18 10:16:31+00:00
c5bb2f6966915dcfad48420d2e09b4c8,2026-01-17T11:49:20Z,+foggy conditions,www.channelnewsasia.com,en,0.3,Alpine skiing-Nicol Delago wins Tarvisio downhill as Vonn takes another podium,"TARVISIO, Italy, Jan 17 : Italy's Nicol Delago won a foggy women's World Cup downhill on home snow in Tarvisio on Saturday as age-defying U.S. Alpine ski great Lindsey Vonn powered to her fifth podium in five races.The victory, in a time of one minute and 46.…",https://www.channelnewsasia.com/sport/alpine-skiing-nicol-delago-wins-tarvisio-downhill-vonn-takes-another-podium-5865571,"https://dam.mediacorp.sg/image/upload/s--J91WswX8--/c_fill,g_auto,h_676,w_1200/f_auto,q_auto/v1/mediacorp/one-cms/images/2021-06/sport.png?itok=tWViTKI2",,"TARVISIO, Italy, Jan 17 : Italy's Nicol Delago won a foggy women's World Cup downhill on home snow in Tarvisio on Saturday as age-defying U.S. Alpine ski great Lindsey Vonn powered to her fifth podiu… [+1968 chars]",,"Im alpinen Skisport gewinnt Nicol Delago die Abfahrt in Tarvisio, während Vonn erneut auf dem Podium steht. TARVISIO, Italien, 17. Januar: Die Italienerin Nicol Delago gewann am Samstag eine neblige Damen-Weltcup-Abfahrt auf heimischem Schnee in Tarvisio, während die altersstarke US-Alpin-Skifahrerin Lindsey Vonn ihren fünften Podiumsplatz in fünf Rennen erreichte. Der Sieg in einer Zeit von einer Minute und 46.…","Alpine skiing-Nicol Delago wins Tarvisio downhill as Vonn takes another podium. TARVISIO, Italy, Jan 17 : Italy's Nicol Delago won a foggy women's World Cup downhill on home snow in Tarvisio on Saturday as age-defying U.S. Alpine ski great Lindsey Vonn powered to her fifth podium in five races.The victory, in a time of one minute and 46.…","Alpinus skiing-Nicola Delago Tarvisio proclivi vincit sicut Vonn aliud podium accipit. TARVISIO, Italia, Ian 17 : scriptor Nicole Delago Italiae nebulosos feminae World Cup declivi super domum nivis in Tarvisio lucratus est die Sabbati sicut vetustas contradicit US Alpini ski magna Lindsey Vonn ei podium quintum in quinque stadiis. Victoria, tempore unius minuti et 46.…",2026-01-18 15:15:12+00:00
072a93dd01029f64cde16b64956a59da,2026-01-12T04:18:05Z,+fog warning system,indianexpress.com,en,0.3,"Delhi shivers as temperature drops to 4 degrees Celsius, cold wave to persist","As per the Environmental Weather Service (EWS), the past 24 hours witnessed a partly cloudy sky with mist and haze during the night. Predominant surface winds blew from the west direction with speeds reaching up to 15 kilometres per hour.",https://indianexpress.com/article/weather/delhi-weather-temperature-winter-aqi-cold-wave-10468492/,https://images.indianexpress.com/2026/01/delhi-weather-winter-cold-wave.jpg,http://web.archive.org/web/20260112132540/https://indianexpress.com/article/weather/delhi-weather-temperature-winter-aqi-cold-wave-10468492/,"Delhi woke up to a freezing Monday morning as temperatures dipped to 4 degrees Celsius, with dense fog engulfing several parts of the national capital. Visuals from across the city showed poor visibi… [+3680 chars]",,"Delhi zittert, die Temperatur sinkt auf 4 Grad Celsius und die Kältewelle hält an. Nach Angaben des Environmental Weather Service (EWS) herrschte in den letzten 24 Stunden ein teilweise bewölkter Himmel mit Nebel und Dunst in der Nacht. Der vorherrschende Bodenwind wehte aus westlicher Richtung mit Geschwindigkeiten von bis zu 15 Kilometern pro Stunde.","Delhi shivers as temperature drops to 4 degrees Celsius, cold wave to persist. As per the Environmental Weather Service (EWS), the past 24 hours witnessed a partly cloudy sky with mist and haze during the night. Predominant surface winds blew from the west direction with speeds reaching up to 15 kilometres per hour.","Delhi tremiscit ut guttae ad 4 gradus temperatura Celsius, unda frigida perseverare. Tamquam per Tempestas Servitii Environmental (EWS), praeter 24 horas caelum nubilum caligo et nocte obducto conspexerunt. Venti superficies praevalentes ab occidente flaverunt cum velocitatibus usque ad XV chiliometra per horae attingentes.",2026-01-19 01:18:12+00:00
34c091a3f725c015e48906712c4ac6e5,2026-01-16T05:04:25Z,+fog warning system,indianexpress.com,en,0.3,"Schools in Noida up to Class 8 to remain closed on Jan 16, 17 due to cold",The basic education officer warned that action would be taken as per rules against any school found violating the order and reopening during the closure period.,https://indianexpress.com/article/education/up-schools-noida-till-class-8-to-remain-closed-on-jan-16-17-due-to-cold-wave-10477005/,https://images.indianexpress.com/2026/01/school-holiday-Express-photo-by-Ashish-Kale-1.jpg,,"Schools up to Class 8 across Gautam Buddh Nagar will remain closed on Friday and Saturday due to dense fog and extreme cold, the district administration said on Friday.
The order, issued by Basic Ed… [+1190 chars]",,"Schulen in Noida bis zur 8. Klasse bleiben am 16. und 17. Januar wegen der Kälte geschlossen. Der Grundbildungsbeauftragte warnte, dass gegen jede Schule, bei der festgestellt wird, dass sie gegen die Anordnung verstößt und während der Schließungszeit wiedereröffnet wird, gemäß den Regeln vorgegangen wird.","Schools in Noida up to Class 8 to remain closed on Jan 16, 17 due to cold. The basic education officer warned that action would be taken as per rules against any school found violating the order and reopening during the closure period.","Scholae Noida usque ad Classem VIII clausae maneant die 16 Ian, 17 ob frigus. Praefectus educationis fundamentalis monuit actionem per regulas contra quamlibet scholam inventam esse, violando ordinem et refricare per tempus clausurae.",2026-01-19 01:18:12+00:00
2d7d2ddd394ad7ef3c366e59c4564599,2026-01-08T16:34:29Z,+fog climate change,timesofindia.indiatimes.com,en,0.3,Daisy Shah on the fire incident in her residential complex: I was shaking all night,"Daisy Shah recounted a fire incident in a neighbouring building in Mumbai’s Bandra East, alleging it was triggered by firecrackers burst during an election campaign. She said the blaze escalated rapidly, gutting a flat in her residential compound, though no r…",https://timesofindia.indiatimes.com/entertainment/hindi/bollywood/news/daisy-shah-on-the-fire-incident-in-her-residential-complex-i-was-shaking-all-night/articleshow/126418844.cms,"https://static.toiimg.com/thumb/msid-126418878,width-1070,height-580,imgsize-55578,resizemode-75,overlay-toi_sw,pt-32,y_pad-500/photo.jpg",http://web.archive.org/web/20260109035533/https://timesofindia.indiatimes.com/entertainment/hindi/bollywood/news/daisy-shah-on-the-fire-incident-in-her-residential-complex-i-was-shaking-all-night/articleshow/126418844.cms,"Follow Us On Social Media
Whats todays weather: IMD forecast cold wave and fog for Delhi-NCR, and heavy rain alert for Tamil Nadu and KeralaIm just dating around: Alix Earle gets newfound attention … [+1746 chars]",,"Daisy Shah über den Brandvorfall in ihrer Wohnanlage: Ich habe die ganze Nacht gezittert. Daisy Shah berichtete von einem Brandvorfall in einem benachbarten Gebäude in Mumbais Stadtteil Bandra East und behauptete, dieser sei durch die Explosion von Feuerwerkskörpern während eines Wahlkampfs ausgelöst worden. Sie sagte, das Feuer sei schnell eskaliert und habe eine Wohnung in ihrem Wohnkomplex zerstört, obwohl keine …","Daisy Shah on the fire incident in her residential complex: I was shaking all night. Daisy Shah recounted a fire incident in a neighbouring building in Mumbai’s Bandra East, alleging it was triggered by firecrackers burst during an election campaign. She said the blaze escalated rapidly, gutting a flat in her residential compound, though no r…","Prima Shah ignis incident in complexu residentiali: tota nocte quatiebam. Daisy Shah ignis incidentes in vicini aedificii in Mumbai Bandra East narravit, quod in comitiis in expeditione urguebant crepidines eruperunt. Dixit rapide ardentem escalatum, in compositis residentialibus torto guttis, quamquam non r…",2026-01-19 05:27:57+00:00
60351c6fa593c94738e471c4c1c7d219,2026-01-09T03:30:25Z,+fog alert,timesofindia.indiatimes.com,en,0.3,BMC polls row: Maharastra SEC seeks report on poll officer's action in Colaba,"The State Election Commission is reviewing the Colaba returning officer's decision to reject two nomination forms. While initially deeming the action legally sound, the SEC has requested an observer's report. The rejected candidates alleged Speaker Rahul Narw…",https://timesofindia.indiatimes.com/city/mumbai/bmc-polls-row-maharastra-sec-seeks-report-on-poll-officers-action-in-colaba/articleshow/126426407.cms,"https://static.toiimg.com/thumb/msid-126426443,width-1070,height-580,imgsize-897748,resizemode-75,overlay-toi_sw,pt-32,y_pad-500/photo.jpg",http://web.archive.org/web/20260110051016/https://timesofindia.indiatimes.com/city/mumbai/bmc-polls-row-maharastra-sec-seeks-report-on-poll-officers-action-in-colaba/articleshow/126426407.cms,"<ul><li>News</li>
<li>BMC polls row: Maharastra SEC seeks report on poll officer's action in Colaba</li></ul>
Follow Us On Social Media
Whats todays weather: IMD forecast cold wave and fog for Del… [+1858 chars]",,"BMC-Umfragestreit: Maharastra SEC fordert Bericht über die Aktion des Wahlbeamten in Colaba. Die staatliche Wahlkommission prüft die Entscheidung des Wahlleiters von Colaba, zwei Nominierungsformulare abzulehnen. Obwohl die SEC die Maßnahme zunächst für rechtlich einwandfrei hielt, hat sie einen Beobachterbericht angefordert. Die abgelehnten Kandidaten behaupteten, Sprecher Rahul Narw…","BMC polls row: Maharastra SEC seeks report on poll officer's action in Colaba. The State Election Commission is reviewing the Colaba returning officer's decision to reject two nomination forms. While initially deeming the action legally sound, the SEC has requested an observer's report. The rejected candidates alleged Speaker Rahul Narw…","BMC capitum ordo: Maharastra SEC famam quaerit de actione polli in Colaba. Commissio Civitatis Electionis Colaba reddens consilium praefectorum recenset ut duas nominationis formas reiciat. Cum initio actionem legitime sanam aestimans, SEC famam spectatoris postulavit. Candidati reiecti allegarunt Oratorem Rahul Narw…",2026-01-19 05:27:57+00:00
