index,published,keyword,domain,language,valid,title,description,url,image,archive,content,quote,de,en,la,added
03bd4a40e0bba16246ac3495ebe8ce35,2026-04-13T06:00:00Z,+fog climate change,www.naturalnews.com,en,0.3,From brain fog to palpitations: The six warning signs you’re taking too many vitamins,Experts warn routine over-supplementation can cause serious harm like nerve and heart damage. The natural-equals-harmless mindset ignores the body’s limited capacity to process excess. Key risks include fatigue from vitamin D overload and potentially irrevers…,https://www.naturalnews.com/2026-04-13-warning-signs-youre-taking-too-many-vitamins.html,https://www.naturalnews.com/,,<ul><li>Experts warn routine over-supplementation can cause serious harm like nerve and heart damage.</li><li>The natural-equals-harmless mindset ignores the body's limited capacity to process excess… [+5082 chars],,"Von Gehirnnebel bis Herzklopfen: Die sechs Warnsignale dafür, dass Sie zu viele Vitamine einnehmen. Experten warnen davor, dass eine routinemäßige Überdosierung ernsthafte Schäden wie Nerven- und Herzschäden verursachen kann. Die Denkweise „Natürlich ist gleich harmlos“ ignoriert die begrenzte Fähigkeit des Körpers, Überschüsse zu verarbeiten. Zu den Hauptrisiken gehören Müdigkeit aufgrund einer Vitamin-D-Überladung und möglicherweise irreversible…",From brain fog to palpitations: The six warning signs you’re taking too many vitamins. Experts warn routine over-supplementation can cause serious harm like nerve and heart damage. The natural-equals-harmless mindset ignores the body’s limited capacity to process excess. Key risks include fatigue from vitamin D overload and potentially irrevers…,Ex nebula cerebri ad palpitationes: Sex signa praemonitoria nimis multos vitamins capis. Periti monent exercitationes super-supplementum grave damnum inferre sicut nervus et cor damnum inferre possunt. Naturalis-aequales-quaestae innoxiae facultatem limitatam corporis ignorat processus excessus. Key periculum includit lassitudinem Vitaminum D cultro et potentia irreversores…,2026-04-14 16:03:47+00:00
cc70d66814af36d5b7a98b073a584a02,2026-04-03T15:43:53Z,+fog warning system,github.com,en,0.8,Show HN: I built a PHP-to-native compiler (written in Rust); now it runs DOOM,"Because obviously the first logical step after compiling PHP to ARM64 was rendering DOOM with it.It renders DOOM E1M1 in real-time. BSP traversal, perspective projection, distance fog, sector lighting, collision detection, step climbing - all PHP, compiled to…",https://github.com/illegalstudio/elephc,https://opengraph.githubassets.com/17ea00ba1955090a7d3b53162a879a9846ac8b8f56c1bf6c1793bf7fab816019/illegalstudio/elephc,,"A PHP-to-native compiler. Takes a subset of PHP and compiles it directly to ARM64 assembly, producing standalone macOS binaries. No interpreter, no VM, no runtime dependencies.
If you like the idea … [+17534 chars]",,"Show HN: Ich habe einen PHP-zu-native-Compiler erstellt (geschrieben in Rust); Jetzt läuft DOOM. Denn offensichtlich war der erste logische Schritt nach dem Kompilieren von PHP zu ARM64 das Rendern von DOOM damit. Es rendert DOOM E1M1 in Echtzeit. BSP-Durchquerung, perspektivische Projektion, Distanznebel, Sektorbeleuchtung, Kollisionserkennung, Stufenklettern – alles PHP, kompiliert nach…","Show HN: I built a PHP-to-native compiler (written in Rust); now it runs DOOM. Because obviously the first logical step after compiling PHP to ARM64 was rendering DOOM with it.It renders DOOM E1M1 in real-time. BSP traversal, perspective projection, distance fog, sector lighting, collision detection, step climbing - all PHP, compiled to…","Ostende HN: aedificavi compilator PHP-ad-nativum (scriptum Rust); nunc decurrit exitio. Quia nimirum primus gressus logicus postquam PHP ad ARM4 componens cum eo FATUM reddebat. FATUM E1M1 in real-time reddit. BSP traversal, prospectus proiectio, distantia nebula, sector illuminationis, deprehensio collisio, gradus ascensus - omnia PHP, compilata sunt…",2026-04-14 20:46:20+00:00
5738d7a3b636006002ab5f3038f658b8,2026-04-07T02:45:00Z,+fog slow down,www.drive.com.au,en,0.3,The crucial road rules Aussie drivers keep ignoring,"While most instructors teach you the basic road rules in Australia, these are some of the lesser-known laws that could get you in trouble.",https://www.drive.com.au/caradvice/the-crucial-road-rules-aussie-drivers-keep-ignoring/,"https://media.drive.com.au/obj/tx_q:70,rs:auto:1920:1080:1/driveau/upload/cms/uploads/9173ff01-cbf3-59ca-aaff-1ed01fa50000",,"Daytime running lights are cool. Fog lights are not. Sorry, but they really arent. Unless, of course, its actually foggy, but when theyre on during non-foggy weather, their downward projection means … [+73 chars]",,"Die entscheidenden Verkehrsregeln, die australische Autofahrer immer wieder ignorieren. Während die meisten Lehrer Ihnen die grundlegenden Verkehrsregeln in Australien beibringen, sind dies einige der weniger bekannten Gesetze, die Sie in Schwierigkeiten bringen könnten.","The crucial road rules Aussie drivers keep ignoring. While most instructors teach you the basic road rules in Australia, these are some of the lesser-known laws that could get you in trouble.","Via publica regulae Aussie rectoribus atrox neglectis custodiunt. Dum plerique praeceptores te docent regulas fundamentales in Australia via, hae sunt quaedam de legibus minoribus notis quae te in tribulatione consequi possent.",2026-04-15 06:30:16+00:00
7042aec941112ce2519a42a9d7ee40ef,2026-04-07T08:40:29Z,+fog slow down,www.defenseone.com,en,0.3,"As aircraft losses mount, Pentagon wants a software fix to see through the fog of war",The Defense Department is looking to update how older planes see each other and absorb data.,https://www.defenseone.com/technology/2026/04/aircraft-losses-mount-pentagon-wants-software-fix-see-through-fog-war/412667/,https://cdn.defenseone.com/media/img/cd/2026/04/07/9559209/open-graph.jpg,http://web.archive.org/web/20260408065030/https://www.defenseone.com/technology/2026/04/aircraft-losses-mount-pentagon-wants-software-fix-see-through-fog-war/412667/,The U.S. planes that have gone down in the Middle East since the launch of Operation Epic Fury all lacked the same thing: a common operating picture that includes relevant intelligence and data. The … [+3208 chars],,"Da die Flugzeugverluste zunehmen, möchte das Pentagon eine Softwarekorrektur durchführen, um den Nebel des Krieges zu durchschauen. Das Verteidigungsministerium möchte die Art und Weise aktualisieren, wie ältere Flugzeuge sich gegenseitig sehen und Daten absorbieren.","As aircraft losses mount, Pentagon wants a software fix to see through the fog of war. The Defense Department is looking to update how older planes see each other and absorb data.","Cum damna aircraft conscendunt, Pentagonum vult programmatum figere per nebulam belli videre. Defensionis Department quaerit renovare quomodo plana maiora se mutuo videant et data trahant.",2026-04-15 06:30:16+00:00
f779998bef840bfbb282ae87aefa76c5,2026-04-10T05:55:23Z,+fog weather,www.israelnationalnews.com,en,0.8,"Cool, rainy weekend followed by shift to hot and dry weather","Today will be rainy in the north with strong winds and fog. At the start of the week temperatures will drop, followed by a sharp rise and warmer-than-usual conditions.",https://www.israelnationalnews.com/news/425282,https://2.a7.org/files/pictures/000/1214745.jpg,,"The weather in the coming days will be changeable, with rain in the north and a drop in temperatures at the beginning of the week, followed by significant warming and even hotter and drier conditions… [+1185 chars]",,"Kühles, regnerisches Wochenende, gefolgt von einem Übergang zu heißem und trockenem Wetter. Heute wird es im Norden regnerisch mit starkem Wind und Nebel. Zu Beginn der Woche werden die Temperaturen sinken, gefolgt von einem starken Anstieg und wärmeren Bedingungen als üblich.","Cool, rainy weekend followed by shift to hot and dry weather. Today will be rainy in the north with strong winds and fog. At the start of the week temperatures will drop, followed by a sharp rise and warmer-than-usual conditions.","Frigus, volutpat pluviosum sequitur mutationem in calidum et siccitatem. Hodie pluviæ in aquilone erunt cum ventis validis et nebula. Initio hebdomadis temperaturae stillabunt, post ortum acrem et calidiores condiciones usitatas.",2026-04-15 06:30:16+00:00
61c3cff11577aeba2ee42869ca61fc60,2026-04-04T17:50:07Z,+fog light,bringatrailer.com,en,0.8,2006 Maserati GranSport Coupe,"This 2006 Maserati GranSport coupe is a Blu Nettuno Metallizzato over Blu Navy leather example and is powered by a 4.2-liter V8 connected to a Cambiocorsa six-speed automated transaxle. The car is equipped with xenon headlights with washers, fog lights, 19"" F…",https://bringatrailer.com/listing/2006-maserati-gransport-coupe-18/,https://bringatrailer.com/wp-content/uploads/2026/03/2006_maserati_gransport-coupe_8u1a7639-06604.jpg,,This 2006 Maserati GranSport coupe is a Blu Nettuno Metallizzato over Blu Navy leather example and is powered by a 4.2-liter V8 connected to a Cambiocorsa six-speed automated transaxle. The car is eq… [+1886 chars],,"2006 Maserati GranSport Coupé. Dieses Maserati GranSport-Coupé aus dem Jahr 2006 ist ein Exemplar mit Blu Nettuno Metallizzato über Blu Navy-Leder und wird von einem 4,2-Liter-V8 angetrieben, der mit einem Cambiocorsa-Sechsgang-Automatikgetriebe verbunden ist. Das Auto ist mit Xenon-Scheinwerfern mit Scheibenwaschanlage, Nebelscheinwerfern, 19-Zoll-F… ausgestattet.","2006 Maserati GranSport Coupe. This 2006 Maserati GranSport coupe is a Blu Nettuno Metallizzato over Blu Navy leather example and is powered by a 4.2-liter V8 connected to a Cambiocorsa six-speed automated transaxle. The car is equipped with xenon headlights with washers, fog lights, 19"" F…","MMVI Maserati GranSport Coupe. Hoc MMVI Maserati GranSport coufe est exemplum coriarii Blu Nettuno Metallizzato super Blu Navy et potens est 4.2-liter V8 cum Cambiocorsa sex velocitate transaxo automated coniuncta. Raeda instructa xenonis ornamentis cum washers, lumina nebula, 19 ""F...",2026-04-15 10:55:15+00:00
4563e80fb3fa6c810cb440be7e5bcff9,2026-04-06T17:50:06Z,+fog climate change,bringatrailer.com,en,0.8,48k-Mile 2018 Subaru WRX STi at No Reserve,"This 2018 Subaru WRX STi has 48k miles following history in Oregon, and it was acquired by the seller in 2018. The Pure Red exterior was modified with a Seibon carbon-fiber splitter and grille, Morimoto fog lights, STi side skirts, a rear diffuser, and wing s…",https://bringatrailer.com/listing/2018-subaru-wrx-sti-26/,https://bringatrailer.com/wp-content/uploads/2026/03/2018_subaru_wrx-sti_f52a2f8b-611a-4575-87d4-d8bedd190b2c_1_105_c-80066.jpeg,,"This 2018 Subaru WRX STi has 48k miles following history in Oregon, and it was acquired by the seller in 2018. The Pure Red exterior was modified with a Seibon carbon-fiber splitter and grille, Morim… [+3674 chars]",,"48.000-Meilen-2018-Subaru-WRX-STi ohne Reserve. Dieser 2018 Subaru WRX STi hat eine Laufleistung von 48.000 Meilen in Oregon und wurde 2018 vom Verkäufer erworben. Das Pure Red-Äußere wurde mit einem Seibon-Carbonfaser-Splitter und -Kühlergrill, Morimoto-Nebelscheinwerfern, STi-Seitenschwellern, einem Heckdiffusor und Kotflügeln modifiziert.","48k-Mile 2018 Subaru WRX STi at No Reserve. This 2018 Subaru WRX STi has 48k miles following history in Oregon, and it was acquired by the seller in 2018. The Pure Red exterior was modified with a Seibon carbon-fiber splitter and grille, Morimoto fog lights, STi side skirts, a rear diffuser, and wing s…","48k-Mile 2018 Subaru WRX STi ad No Subsidium. Hoc 2018 Subaru WRX STi habet 48k milia passuum sequentem historiam in Oregon, et a venditore acquisita est anno 2018. Murum rubrum exterius mutatum est cum Seibon carbon-fibra phistae et crate, nebula Morimoto luminum, STi fimbriarum lateralium, posterioris diffundentis, et cornu s…",2026-04-15 20:42:18+00:00
e693b72c4c7801cd20bffa6cce99f225,2026-04-05T18:04:25Z,+fog warning system,gothamist.com,en,0.2,NYC’s Easter Bonnet Festival draws huge crowd despite a drizzly weather,"Tiffany Rae Knight (right), and her mother Ellen Rose.
 

Thousands descended on Fifth Avenue near St. Patrick’s Cathedral for the annual event. [ more › ]",https://gothamist.com/news/nycs-easter-bonnet-festival-draws-huge-crowd-despite-a-drizzly-weather,https://api-prod.gothamist.com/images/356300/fill-1200x650|format-webp|webpquality-85/,,"Fog and rain didnt stop the fancy hats from descending on Fifth Avenue this Easter Sunday..
Despite the less-than-ideal weather, thousands of New Yorkers and visitors participated in the annual East… [+2170 chars]",,"Das Easter Bonnet Festival in New York zieht trotz nieseligem Wetter große Menschenmengen an. Tiffany Rae Knight (rechts) und ihre Mutter Ellen Rose.
 

Tausende strömten zur jährlichen Veranstaltung auf die Fifth Avenue in der Nähe der St. Patrick’s Cathedral. [ mehr > ]","NYC’s Easter Bonnet Festival draws huge crowd despite a drizzly weather. Tiffany Rae Knight (right), and her mother Ellen Rose.
 

Thousands descended on Fifth Avenue near St. Patrick’s Cathedral for the annual event. [ more › ]","NYC Paschae Bonnet Festivitas ingentem turbam trahit obstantibus tempestatibus. Tiffany Rae Knight(ius), et Mater Ellen Rose.
 

Milia Quinto Avenue prope annuum casum descenderunt in cathedralem Sancti Patricii. [ magis ]",2026-04-16 10:57:42+00:00
62b8e6d023a916fd7069c90ad8641373,2026-04-15T02:00:00Z,+foggy conditions,www.techradar.com,en,0.2,Daredevil: Born Again season 2 episode 5 confirms a long-standing rumor about Vanessa Fisk — and brings Foggy back to life in the only way that the Marvel TV show could,Daredevil: Born Again's latest episode brings two people back from the dead — and adds another to its death counter.,https://www.techradar.com/streaming/disney-plus/daredevil-born-again-season-2-episode-5-confirms-a-long-standing-rumor-about-vanessa-fisk-and-brings-foggy-back-to-life-in-the-only-way-that-the-marvel-tv-show-could-do-so,https://cdn.mos.cms.futurecdn.net/HU7CCAT2D8J8beg7mp4JLN-1920-80.jpg,,"Daredevil: Born Again season 2 episode 5 has made its Disney+ debut — and there are two big talking points that we need to address.
Titled 'The Grand Design', the Marvel TV show's latest chapter uns… [+5563 chars]",,"Daredevil: Born Again Staffel 2, Folge 5 bestätigt ein seit langem bestehendes Gerücht über Vanessa Fisk – und erweckt Foggy auf die einzige Art und Weise wieder zum Leben, die die Marvel-TV-Show konnte. Die neueste Folge von Daredevil: Born Again bringt zwei Menschen von den Toten zurück – und fügt ihrem Todeszähler einen weiteren hinzu.",Daredevil: Born Again season 2 episode 5 confirms a long-standing rumor about Vanessa Fisk — and brings Foggy back to life in the only way that the Marvel TV show could. Daredevil: Born Again's latest episode brings two people back from the dead — and adds another to its death counter.,Daredevil: Born again season 2 episode 5 confirmat diuturnum rumorem de Vanessa Fisk — et Foggy ad vitam reducit uno modo quo spectaculum mirabile TV potuit. Daredevil: Novissima res nata duos homines a mortuis revocat — alium ad eius morti occurro addit.,2026-04-17 01:59:03+00:00
14113321feb25c9fa65ec190fc3d5cec,2026-04-15T02:11:03Z,+foggy conditions,www.cinemablend.com,en,0.2,"As Daredevil: Born Again Kills Off A Major Character, I'm Smiling About The Sweet Way Foggy Reappears",Fans of the OG Daredevil show may appreciate this.,https://www.cinemablend.com/superheroes/marvel-cinematic-universe/daredevil-born-again-kills-off-vanessa-fisk-foggy-returns-flashbacks,https://cdn.mos.cms.futurecdn.net/7KEWFiC3gkZScCdrusfcKg-1280-80.jpg,,"Major spoilers for the latest episode of Daredevil: Born Again, “The Grand Design,” lie ahead.
The second season of Daredevil: Born Again is past its halfway point amid the 2026 TV schedule, and the… [+3692 chars]",,"Als Daredevil: Born Again einen Hauptcharakter tötet, lächle ich über die süße Art und Weise, wie Foggy wieder auftaucht. Fans der OG Daredevil-Show werden das vielleicht zu schätzen wissen.","As Daredevil: Born Again Kills Off A Major Character, I'm Smiling About The Sweet Way Foggy Reappears. Fans of the OG Daredevil show may appreciate this.","As Daredevil: Born Again necat maiorem characterem, Smiling About The Sweet Way Foggy Reappears. Fans of the OG Daredevil show may appreciate this.",2026-04-17 01:59:03+00:00
2cc0d7643c36a2d756466035f7c2e441,2026-04-06T10:13:52Z,+foggy conditions,economictimes.indiatimes.com,en,0.3,The 2-Minute Mirror Trick Grandmothers Swore By And Why It Still Beats Modern Cleaners,"Grandmothers' mirror cleaning secrets are making a comeback. Simple vinegar solutions and careful wiping techniques prove highly effective. Modern cleaners can also work well, but application matters most. Avoiding common mistakes like circular wiping and liq…",https://economictimes.indiatimes.com/news/international/us/the-2-minute-mirror-trick-grandmothers-swore-by-and-why-it-still-beats-modern-cleaners/articleshow/130057698.cms,"https://img.etimg.com/thumb/msid-130057698,width-1200,height-630,imgsize-1192182,overlay-economictimes/articleshow.jpg",http://web.archive.org/web/20260407015611/https://economictimes.indiatimes.com/news/international/us/the-2-minute-mirror-trick-grandmothers-swore-by-and-why-it-still-beats-modern-cleaners/articleshow/130057698.cms,"For most families, cleaning mirrors appears to be an easy task; however, they often notice the presence of streaks or foggy areas despite the application of high-end solutions. Such an approach only … [+5454 chars]",,"Der 2-Minuten-Spiegel-Trick, auf den Großmütter schworen, und warum er moderne Reinigungskräfte immer noch übertrifft. Die Spiegelreinigungsgeheimnisse der Großmütter erleben ein Comeback. Einfache Essiglösungen und sorgfältige Wischtechniken erweisen sich als äußerst wirksam. Moderne Reinigungsmittel können ebenfalls gut funktionieren, aber die Anwendung ist am wichtigsten. Vermeiden Sie häufige Fehler wie kreisendes Wischen und Flüssigwaschen.","The 2-Minute Mirror Trick Grandmothers Swore By And Why It Still Beats Modern Cleaners. Grandmothers' mirror cleaning secrets are making a comeback. Simple vinegar solutions and careful wiping techniques prove highly effective. Modern cleaners can also work well, but application matters most. Avoiding common mistakes like circular wiping and liq…","The 2-minute Mirror Furta Grandmothers iuravit per et cur adhuc verberat moderni Cleaners. Speculum aviarum purgatio secreta facit cavea. Simplex aceti solutiones et exquisita abstergendae technicae artes plurimum valent. Puratores moderni etiam bene operari possunt, sed applicationes in rebus maxime. Communes errores vitantes, sicut circulares, abstergendi et liq...",2026-04-17 01:59:03+00:00
ff9eb90fb4d50b88cf9b6c0a3e1584f2,2026-04-13T16:36:58Z,+fog flights,www.nybooks.com,en,0.8,‘Go Out and Sue a Polluter’,"Shortly before Christmas in 1969 a dense fog rolled in across the bayous of the Texas Gulf Coast. For more than four days it blanketed a vast region, as far west as San Antonio and as far east as Port Arthur. Flights were grounded, cars crashed, and all traff…",https://www.nybooks.com/online/2026/04/13/go-out-and-sue-a-polluter/,https://www.nybooks.com/wp-content/uploads/2026/04/Stern202604_6.jpeg,,"Shortly before Christmas in 1969 a dense fog rolled in across the bayous of the Texas Gulf Coast. For more than four days it blanketed a vast region, as far west as San Antonio and as far east as Por… [+31057 chars]",,"„Gehen Sie raus und verklagen Sie einen Umweltverschmutzer“. Kurz vor Weihnachten 1969 rollte dichter Nebel über die Bayous der texanischen Golfküste. Mehr als vier Tage lang bedeckte es ein riesiges Gebiet, im Westen bis nach San Antonio und im Osten bis nach Port Arthur. Flüge wurden eingestellt, Autos verunglückten und der gesamte Verkehr …","‘Go Out and Sue a Polluter’. Shortly before Christmas in 1969 a dense fog rolled in across the bayous of the Texas Gulf Coast. For more than four days it blanketed a vast region, as far west as San Antonio and as far east as Port Arthur. Flights were grounded, cars crashed, and all traff…","'Exire et Sue Polluter'. Paulo ante Nativitatem Domini anno MCMLXIX densa nebula trans sinus Texas sinus Coast involutus est. Per quattuor enim dies regionem vastissimam stravit usque ad occidentem San Antonio et usque ad orientem Portus Arthur. Volatus fundatae sunt, cars concrepuerunt, et omnia negotiatio…",2026-04-17 15:54:55+00:00
40fb158256a15f5cc4562bd4978331fe,2026-04-02T03:25:15Z,+fog slow down,www.royalsreview.com,en,0.3,"Royal bats shine on a dreary night, beat Minnesota 13-9",Neither fog nor rain nor gloom of night stays these Royals from the swift completion of their bases rounded,https://www.royalsreview.com/kansas-city-royals-game-information/96093/royal-bats-shine-on-a-dreary-night-beat-minnesota-13-9,https://s.yimg.com/ny/api/res/1.2/iDMe1YzQj8MRcjOnnm4Djw--/YXBwaWQ9aGlnaGxhbmRlcjt3PTEyMDA7aD0xNzEwO2NmPXdlYnA-/https://media.zenfs.com/en/sb_nation_articles_115/424eb1835da5e4cd7d23ea3a4825a011,,"The bottom third of the Kansas City lineup has taken care of business for the second consecutive game, but in much more spectacular fashion tonight. Scoring started in the second with two out and no … [+2742 chars]",,Die Royal Bats glänzen in einer trostlosen Nacht und schlagen Minnesota mit 13:9. Weder Nebel noch Regen noch die Dunkelheit der Nacht halten diese Royals von der schnellen Fertigstellung ihrer Stützpunkte ab,"Royal bats shine on a dreary night, beat Minnesota 13-9. Neither fog nor rain nor gloom of night stays these Royals from the swift completion of their bases rounded","Nocte atrox lucent noctuae regiae, Minnesota pulsant 13-9. Non nebula, non pluviae neque noctis opacae Regalia fixa stant celeris consummata basium",2026-04-17 20:39:12+00:00
29530c5ef12d0b62c3e66aa9aa06df4c,2026-04-15T17:01:24Z,+fog light,bringatrailer.com,en,0.8,2015 Nissan Frontier SV King Cab V6 6-Speed at No Reserve,"This 2015 Nissan Frontier SV King Cab spent time in California and Oregon before the seller's acquisition in 2025, and it is powered by a 4.0-liter VQ40DE V6 paired with a six-speed manual transmission. The Night Armor exterior has LED headlight and fog light…",https://bringatrailer.com/listing/2015-nissan-frontier-3/,https://bringatrailer.com/wp-content/uploads/2026/02/2015_nissan_frontier_20260410_160938-93363.jpg,,"This 2015 Nissan Frontier SV King Cab spent time in California and Oregon before the seller’s acquisition in 2025, and it is powered by a 4.0-liter VQ40DE V6 paired with a six-speed manual transmissi… [+2989 chars]",,"2015 Nissan Frontier SV King Cab V6 6-Gang ohne Reserve. Dieser 2015 Nissan Frontier SV King Cab verbrachte vor der Übernahme durch den Verkäufer im Jahr 2025 einige Zeit in Kalifornien und Oregon und wird von einem 4,0-Liter-VQ40DE-V6 in Kombination mit einem Sechsgang-Schaltgetriebe angetrieben. Das Äußere des Night Armor verfügt über LED-Scheinwerfer und Nebelscheinwerfer …","2015 Nissan Frontier SV King Cab V6 6-Speed at No Reserve. This 2015 Nissan Frontier SV King Cab spent time in California and Oregon before the seller's acquisition in 2025, and it is powered by a 4.0-liter VQ40DE V6 paired with a six-speed manual transmission. The Night Armor exterior has LED headlight and fog light…","2015 Nissan Fines SV Regis Cab V6 Celeritas ad No Subsidium. Hoc 2015 Nissan Fines SV Regis Cab tempus in California et Oregon egit antequam vendit acquisitio in 2025, et per 4.0-sextarius VQ40DE V6 par cum sex velocitate manuali tradenda est. Armor nox exterior lucem emisit et nebulam.",2026-04-18 06:10:12+00:00
3c896c842fcff49b7e0c9e9749fce7bb,2026-04-08T18:36:04Z,+fog light,bringatrailer.com,en,0.8,2006 BMW 530xi Sports Wagon 6-Speed at No Reserve,"This 2006 BMW 530xi is a black-over-black Sports Wagon powered by a 3.0-liter inline-six that drives all four wheels through a six-speed manual transmission. It features a sunroof, xenon headlights, fog lights, rear air suspension, and 18” Motegi Racing wheel…",https://bringatrailer.com/listing/2006-bmw-530xi-sports-wagon-21/,https://bringatrailer.com/wp-content/uploads/2026/03/2006_bmw_530xi-sports-wagon_img_4753-62829.jpg,,"This 2006 BMW 530xi is a black-over-black Sports Wagon powered by a 3.0-liter inline-six that drives all four wheels through a six-speed manual transmission. It features a sunroof, xenon headlights, … [+2762 chars]",,"2006 BMW 530xi Sports Wagon 6-Gang ohne Reserve. Dieser BMW 530xi aus dem Jahr 2006 ist ein schwarz-schwarzer Sportwagen mit 3,0-Liter-Reihensechszylinder, der über ein Sechsgang-Schaltgetriebe alle vier Räder antreibt. Es verfügt über ein Schiebedach, Xenon-Scheinwerfer, Nebelscheinwerfer, eine Luftfederung hinten und ein 18-Zoll-Motegi-Rennrad …","2006 BMW 530xi Sports Wagon 6-Speed at No Reserve. This 2006 BMW 530xi is a black-over-black Sports Wagon powered by a 3.0-liter inline-six that drives all four wheels through a six-speed manual transmission. It features a sunroof, xenon headlights, fog lights, rear air suspension, and 18” Motegi Racing wheel…","2006 BMW 530xi Sports Plaustrum 6-Speed ​​at No Subsidium. Hoc MMVI BMW 530xi est ludis plaustri nigri-super-nigris, 3.0 sextarius inline-sex, qui omnes quattuor rotas agit per transmissionem manualem velocitatem. Solroof, xenon headlights, nebula lumina, aere suspensio tergo, et 18"" Motegi rota Racing…",2026-04-19 20:31:15+00:00
