index,published,keyword,domain,language,valid,title,description,url,image,archive,content,quote,de,en,la,added
76ffca0b5c238d9c846ba3090de8271f,2025-12-16T07:20:38Z,+fog alert,economictimes.indiatimes.com,en,0.8,Flying from Bengaluru today? Airport issues advisory as dense fog triggers delay fears. Check IMD's weather alert,"Bengaluru Airport has issued an advisory warning of potential flight delays and road traffic congestion due to dense fog and low visibility. Passengers are urged to arrive early and stay updated with airlines. Despite early morning fog, daytime weather is exp…",https://economictimes.indiatimes.com/news/new-updates/flying-from-bengaluru-today-airport-issues-advisory-as-dense-fog-triggers-delay-fears-check-imds-weather-alert/articleshow/125998277.cms,"https://img.etimg.com/thumb/msid-125998370,width-1200,height-630,imgsize-181520,overlay-economictimes/articleshow.jpg",,"Investment Ideas
Grow your wealth with stock ideas &amp; sectoral trends.
Stock Reports Plus
Buy low &amp; sell high with access to Stock Score, Upside potential &amp; more. 
BigBull Portfolio
G… [+439 chars]",,"Fliegen Sie heute von Bengaluru aus? Der Flughafen gibt eine Warnung heraus, da dichter Nebel Verspätungen befürchten lässt. Überprüfen Sie die Wetterwarnung von IMD. Der Flughafen Bengaluru hat eine Warnwarnung vor möglichen Flugverspätungen und Verkehrsstaus aufgrund von dichtem Nebel und schlechter Sicht herausgegeben. Passagiere werden dringend gebeten, früh anzureisen und sich über die Fluggesellschaften auf dem Laufenden zu halten. Trotz frühmorgendlichem Nebel ist das Wetter am Tag exp…","Flying from Bengaluru today? Airport issues advisory as dense fog triggers delay fears. Check IMD's weather alert. Bengaluru Airport has issued an advisory warning of potential flight delays and road traffic congestion due to dense fog and low visibility. Passengers are urged to arrive early and stay updated with airlines. Despite early morning fog, daytime weather is exp…","Bengaluru hodie volantes? Aeroportus consultorio exit ut densae nebulae timet moram triggers. Reprehendo IMD est tempestas esto. Bengaluru Airport consilium fugae potentialis moras et obstructiones advisorias viarum negotiationis edidit ob densam nebulam et visibilitatem humilem. Viatores hortantur ut mane perveniant et cum airlines maneant updated. Quamvis mane nebula, interdiu tempestas exp…",2025-12-22 10:18:03+00:00
3e6fda2d99c6e0841f0bd2782c3d0259,2025-12-19T02:47:39Z,+fog alert,economictimes.indiatimes.com,en,0.8,"Weather update: IMD warns of dense fog in UP, Punjab, Bihar, puts Delhi on yellow alert for today. Check forecast of all states here","IMD Weather update: Delhi has been put on a yellow alert by the India Meteorological Department (IMD) today. The IMD has predicted  partly cloudy sky with moderate to shallow fog in the national capital. Very dense fog is likely to prevail in Uttar Pradesh, B…",https://economictimes.indiatimes.com/news/new-updates/weather-update-imd-warns-of-dense-fog-in-up-punjab-bihar-puts-delhi-on-yellow-alert-for-today-check-forecast-of-all-states-here/articleshow/126068031.cms,"https://img.etimg.com/thumb/msid-126068128,width-1200,height-630,imgsize-29168,overlay-economictimes/articleshow.jpg",,"As Delhi continues to witness the winter mornings, the India Meteorological Department (IMD) has issued a 'yellow' alert for the national capital on December 19. The weather office has predicted that… [+3106 chars]",,"Wetter-Update: IMD warnt vor dichtem Nebel in UP, Punjab, Bihar, setzt Delhi für heute in Alarmbereitschaft. Sehen Sie sich hier die Prognose aller Bundesstaaten an. IMD-Wetter-Update: Delhi wurde heute vom India Meteorological Department (IMD) in Alarmstufe Gelb versetzt. Das IMD hat einen teilweise bewölkten Himmel mit mäßigem bis flachem Nebel in der Landeshauptstadt vorhergesagt. In Uttar Pradesh, B, wird wahrscheinlich sehr dichter Nebel herrschen.","Weather update: IMD warns of dense fog in UP, Punjab, Bihar, puts Delhi on yellow alert for today. Check forecast of all states here. IMD Weather update: Delhi has been put on a yellow alert by the India Meteorological Department (IMD) today. The IMD has predicted  partly cloudy sky with moderate to shallow fog in the national capital. Very dense fog is likely to prevail in Uttar Pradesh, B…","Tempestas renovatio: IMD monet nebula densa in UP, Punjab, Bihar, Delhi in fulvis hodie vigilare ponit. Praesagium omnium civitatum perscribe hic. IMD Tempestas renovatio: Delhi in fulva erecta est a Departmento Meteorologico Indiae (IMD) hodie. IMD partim nubilum caelum cum mediocritate ad levem nebulam in capite nationali praedixerit. Nebula densissima in Uttar Pradesh, B... praevalere verisimile est.",2025-12-22 10:18:03+00:00
cc4c0e7d52887c51271997553946ea93,2025-12-15T08:58:44Z,+fog flights,www.thehindubusinessline.com,en,0.8,Dense fog disrupts ops at Delhi airport; over 60 flights cancelled,"Dense fog at Delhi airport causes over 60 flight cancellations and significant delays, impacting operations and passenger travel.",https://www.thehindubusinessline.com/economy/logistics/dense-fog-disrupts-ops-at-delhi-airport-over-60-flights-cancelled/article70398366.ece,https://bl-i.thgim.com/public/incoming/exljdv/article70398418.ece/alternates/LANDSCAPE_1200/BVR_8514.JPG,,"Over 60 flights were cancelled and 5 diverted at Delhi airport on Monday due to poor visibility conditions, according to an official.
 Delhi airport operator DIAL said in a post on X shortly after 1… [+1287 chars]",,"Dichter Nebel stört den Betrieb am Flughafen Delhi; über 60 Flüge gestrichen. Dichter Nebel am Flughafen Delhi führt zu über 60 Flugausfällen und erheblichen Verspätungen, was sich auf den Betrieb und den Passagierverkehr auswirkt.","Dense fog disrupts ops at Delhi airport; over 60 flights cancelled. Dense fog at Delhi airport causes over 60 flight cancellations and significant delays, impacting operations and passenger travel.","Nebula densa Opis disrupts ad aeriportum Delhi; super LX volatus instat. Nebula densa apud Delhi aeroportus causat super 60 fugam cancellations et moras significantes, impacting operationes et peregrinationes transeuntes.",2025-12-22 15:17:17+00:00
3f2d892b2f113515fd8d2ee80e091675,2025-12-15T15:18:51Z,+fog flights,www.thehindubusinessline.com,en,0.8,Dense fog cripples flight operations at Delhi airport,As many as 68 flights were cancelled and five others diverted resulting in network-wide delays.,https://www.thehindubusinessline.com/news/dense-fog-cripples-flight-operations-at-delhi-airport/article70399869.ece,https://bl-i.thgim.com/public/incoming/xebx7r/article70399970.ece/alternates/LANDSCAPE_1200/20251214182L.jpg,,"Passengers were stuck inside aircraft some upto nine hours as denser-than-expected fog crippled flight operations at Delhi airport on Monday.
As many as 68 flights were cancelled and five others div… [+2108 chars]",,"Dichter Nebel legt den Flugbetrieb am Flughafen Delhi lahm. Bis zu 68 Flüge wurden gestrichen und fünf weitere umgeleitet, was zu Verspätungen im gesamten Streckennetz führte.",Dense fog cripples flight operations at Delhi airport. As many as 68 flights were cancelled and five others diverted resulting in network-wide delays.,Nebula densa claudicat operationes fugae in aeroportus Delhi. Quotquot 68 volatui sublati sunt et quinque alii in moras retis latas inde diverterunt.,2025-12-22 15:17:17+00:00
0465062ce6e5c919f30f356568aaf5f1,2025-12-16T09:37:08Z,+fog light,www.thehindubusinessline.com,en,0.8,Over 100 flights affected at Delhi airport due to low visibility,"Low visibility due to dense fog at Delhi airport affects 126 flights, causing significant delays and cancellations.",https://www.thehindubusinessline.com/economy/logistics/over-100-flights-affected-at-delhi-airport-due-to-low-visibility/article70402383.ece,https://bl-i.thgim.com/public/incoming/2qk000/article70402405.ece/alternates/LANDSCAPE_1200/20251214182L.jpg,,"Low visibility at Delhi's Indira Gandhi International Airport has disrupted aviation operations, leading to cancellations and delays for a significant number of flights on Tuesday. 
According to off… [+2054 chars]",,Über 100 Flüge am Flughafen Delhi aufgrund schlechter Sicht betroffen. Schlechte Sicht aufgrund dichter Nebel am Flughafen Delhi beeinträchtigt 126 Flüge und führt zu erheblichen Verspätungen und Annullierungen.,"Over 100 flights affected at Delhi airport due to low visibility. Low visibility due to dense fog at Delhi airport affects 126 flights, causing significant delays and cancellations.","Plus 100 volatus in aeroportus Delhi affectus propter visibilitatem humilis. Humilis visio ob densam nebulam in Delhi aeroportus 126 volatus afficit, moras et cancellationes significans causans.",2025-12-22 15:17:17+00:00
865acfddecbf0c6b085af01bd2a83a03,2025-12-18T11:10:00Z,+fog light,www.yahoo.com,en,0.8,Schools told to keep children inside as polluted fog envelops Bosnian capital,"SARAJEVO, Bosnia-Herzegovina (AP) — Flights were cancelled, children were told to stay indoors and outdoors construction work was banned in Sarajevo Thursday...",https://www.yahoo.com/news/articles/schools-told-keep-children-inside-111000982.html,https://s.yimg.com/ny/api/res/1.2/FeRQ5_RC32jxRbFlpyuxZw--/YXBwaWQ9aGlnaGxhbmRlcjt3PTEyMDA7aD04MDA7Y2Y9d2VicA--/https://media.zenfs.com/en/ap.org/04e2ae210e9294dbe92b4673ee71611a,,"SARAJEVO, Bosnia-Herzegovina (AP) Flights were cancelled, children were told to stay indoors and outdoors construction work was banned in Sarajevo Thursday as a thick layer of fog enveloped the Bosni… [+1624 chars]",,"Schulen werden aufgefordert, Kinder im Haus zu lassen, da verschmutzter Nebel die bosnische Hauptstadt einhüllt. SARAJEVO, Bosnien-Herzegowina (AP) – Flüge wurden gestrichen, Kinder mussten drinnen bleiben und Bauarbeiten im Freien wurden am Donnerstag in Sarajevo verboten …","Schools told to keep children inside as polluted fog envelops Bosnian capital. SARAJEVO, Bosnia-Herzegovina (AP) — Flights were cancelled, children were told to stay indoors and outdoors construction work was banned in Sarajevo Thursday...","Schools nuntiavit filios intus servare sicut nebula polluta capitalia Bosniaca circumvolvitur. SARAJEVO, Bosnia-Herzegovina (AP) - Fuga abolita sunt, pueri nuntiaverunt domos manere et operis constructionis foris in Sarajevo Iovis interdictum esse.",2025-12-22 15:17:17+00:00
e8c2066d3aed1f63fd60932808cbf4d3,2025-12-18T11:57:49Z,+fog light,abcnews.go.com,en,0.8,Schools told to keep children inside as polluted fog envelops Bosnian capital,"A thick layer of fog has enveloped Sarajevo, leading to flight cancellations and restrictions on outdoor activities",https://abcnews.go.com/International/wireStory/schools-told-children-inside-polluted-fog-envelops-bosnian-128513518,https://i.abcnewsfe.com/a/545e6136-52d2-4536-bbbc-ee6e03a6cb8e/wirestory_803604a2d833a9a0853ed35a68823e5b_16x9.jpg?w=1600,,"SARAJEVO, Bosnia-Herzegovina -- Flights were cancelled, children were told to stay indoors and outdoors construction work was banned in Sarajevo Thursday as a thick layer of fog enveloped the Bosnian… [+1625 chars]",,"Schulen werden aufgefordert, Kinder im Haus zu lassen, da verschmutzter Nebel die bosnische Hauptstadt einhüllt. Eine dichte Nebelschicht hat Sarajevo eingehüllt, was zu Flugausfällen und Einschränkungen bei Outdoor-Aktivitäten geführt hat","Schools told to keep children inside as polluted fog envelops Bosnian capital. A thick layer of fog has enveloped Sarajevo, leading to flight cancellations and restrictions on outdoor activities","Schools nuntiavit filios intus servare sicut nebula polluta capitalia Bosniaca circumvolvitur. Caligo nebulae crassam Sarajevo involvit, ducens fugam cancellorum et restrictiones in actionibus foris",2025-12-22 15:17:17+00:00
bd6e51ceb35e31ee977d28f8ea93a14d,2025-12-21T04:39:49Z,+fog light,indianexpress.com,en,0.8,"Dense fog, cold wave conditions continue to prevail over parts of North India; flight ops impacted","The airlines have issued advisories for travellers, requesting them to check respective flight status on their official websites, and allow extra travel time while heading to the airports.",https://indianexpress.com/article/india/dense-fog-cold-wave-north-india-delhi-up-weather-flight-trains-affected-10431184/,https://images.indianexpress.com/2025/12/delhi-fog-3.jpg,,"Dense fog and cold wave conditions disrupted normal life in parts of North India, including Delhi and Uttar Pradesh early Sunday, causing delays in flight and rail services because of low visibility … [+7845 chars]",,"In Teilen Nordindiens herrschen weiterhin dichte Nebel- und Kältewellenbedingungen. Flugbetrieb betroffen. Die Fluggesellschaften haben Reisende darauf hingewiesen, den jeweiligen Flugstatus auf ihren offiziellen Websites zu überprüfen und auf dem Weg zu den Flughäfen zusätzliche Reisezeit einzuplanen.","Dense fog, cold wave conditions continue to prevail over parts of North India; flight ops impacted. The airlines have issued advisories for travellers, requesting them to check respective flight status on their official websites, and allow extra travel time while heading to the airports.","Nebula densa, undae frigidae conditiones pergunt praevalere per partes Indiae septentrionalis; Impingente fuga Opis. In porttitor viatores consilia ediderunt, rogantes ut utriusque status fugae statum in suis officialibus websites compescerent, et tempus extra peregrinationem ad aliquet nisl petenti permitterent.",2025-12-22 15:17:17+00:00
483325888f9b921e7b0fd506bcfeca61,2025-12-20T05:50:30Z,+fog light,indianexpress.com,en,0.8,"Dense fog, cold wave conditions persist in parts of North India; flight ops likely to be affected","The Airports Authority of India (AAI) has informed that reduced visibility due to fog across parts of northern India may affect flight operations at select airports, leading to possible delays or disruptions.",https://indianexpress.com/article/india/dense-fog-cold-wave-delhi-dehradun-uttar-pradesh-bihar-north-india-10429914/,https://images.indianexpress.com/2025/12/Fog-2.png,,"Dense fog and severe cold wave conditions prevailed across eight Indian states early Saturday, including Uttar Pradesh, Bihar, Chhattisgarh and Madhya Pradesh.The India Meteorological Department (IMD… [+4269 chars]",,"In Teilen Nordindiens herrscht weiterhin dichter Nebel und Kältewellen; Flugbetrieb dürfte betroffen sein. Die Airports Authority of India (AAI) hat mitgeteilt, dass eine eingeschränkte Sicht aufgrund von Nebel in Teilen Nordindiens den Flugbetrieb an ausgewählten Flughäfen beeinträchtigen und zu möglichen Verspätungen oder Störungen führen kann.","Dense fog, cold wave conditions persist in parts of North India; flight ops likely to be affected. The Airports Authority of India (AAI) has informed that reduced visibility due to fog across parts of northern India may affect flight operations at select airports, leading to possible delays or disruptions.","Nebula densa, undae frigidae conditiones persistunt in partibus Indiae septentrionalis; Opis fuga verisimile est affectus. Auctoritas aeroportorum Indiae (AAI) certior factus est visibilitatem ob nebulas trans partes Indiae septentrionalis reductas operationes fugas in nisl selectis afficere posse, moras vel distractiones fieri posse.",2025-12-23 01:11:32+00:00
227d924655e1c7ac3fc2ad82df8088b9,2025-12-19T05:33:18Z,+fog light,www.thehindubusinessline.com,en,0.8,‘Airport operations may be impacted’: says Civil Aviation Ministry as fog disrupts flights in North India,"“Passengers are requested to remain in contact with their airlines, check official platforms for updates, and allow extra time for travel,” the ministry posted on X",https://www.thehindubusinessline.com/economy/logistics/airport-operations-may-be-impacted-says-civil-aviation-ministry-as-fog-disrupts-flights-in-north-india/article70414542.ece,https://bl-i.thgim.com/public/incoming/1ls55d/article70414610.ece/alternates/LANDSCAPE_1200/05Fog.jpg,,"Owing to cold weather in Northern India, the Ministry of Civil Aviation announced on Friday that airport operations across the country may be affected.
Passengers are requested to remain in contact … [+3214 chars]",,"„Der Flughafenbetrieb könnte beeinträchtigt sein“, sagt das Zivilluftfahrtministerium, da Nebel Flüge in Nordindien stört. „Passagiere werden gebeten, mit ihren Fluggesellschaften in Kontakt zu bleiben, auf offiziellen Plattformen nach Aktualisierungen zu suchen und zusätzliche Zeit für die Reise einzuplanen“, veröffentlichte das Ministerium auf X","‘Airport operations may be impacted’: says Civil Aviation Ministry as fog disrupts flights in North India. “Passengers are requested to remain in contact with their airlines, check official platforms for updates, and allow extra time for travel,” the ministry posted on X","'Aeriportus operationes possunt impacti': dicit Ministerium Civile Aviation ut nebula volatus in India septentrionali disrumpat. ""Viatores rogantur ut in contactu cum suis airlines utantur, tabulata officialia pro updates reprime et extra tempus peregrinatione permitte"", ministerium missae in X.",2025-12-23 10:18:05+00:00
e96cbd138e2b7ab7811e7328d2836bf2,2025-12-21T04:41:24Z,+fog flights,www.thehindubusinessline.com,en,0.8,"IndiGo issues travel advisory, dense fog likely to disrupt flights in North India","IndiGo issued a travel advisory on Saturday, warning passengers of possible flight disruptions due to early-morning fog expected across Delhi and several parts of northern India on Sunday.",https://www.thehindubusinessline.com/economy/logistics/indigo-issues-travel-advisory-dense-fog-likely-to-disrupt-flights-in-north-india/article70422031.ece,https://bl-i.thgim.com/public/incoming/1s1ygs/article70422043.ece/alternates/LANDSCAPE_1200/PTI12_08_2025_000515A.jpg,,"IndiGo issued a travel advisory on Saturday, warning passengers of possible flight disruptions due to early-morning fog expected across Delhi and several parts of northern India on Sunday. The airlin… [+2037 chars]",,"IndiGo gibt Reisewarnung heraus, da dichter Nebel die Flüge in Nordindien wahrscheinlich behindern wird. IndiGo gab am Samstag eine Reisewarnung heraus und warnte Passagiere vor möglichen Flugunterbrechungen aufgrund des Frühnebels, der am Sonntag in Delhi und mehreren Teilen Nordindiens erwartet wird.","IndiGo issues travel advisory, dense fog likely to disrupt flights in North India. IndiGo issued a travel advisory on Saturday, warning passengers of possible flight disruptions due to early-morning fog expected across Delhi and several parts of northern India on Sunday.","Indicus quaestiones adierunt consilium, nebula densa, verisimile volatus in India septentrionali perturbare. Indicum consilium iter Saturni die denuntiavit, viatores commonitionem possibilium perturbationum fugarum ob nebulam matutinam trans Delhi expectatam et plures partes Indiae septentrionalis die Dominico.",2025-12-23 10:18:05+00:00
2871a98a1ef34ed341157600571af14b,2025-12-14T21:25:00Z,+fog light,www.jalopnik.com,en,0.8,Is Driving Without Headlights In The Fog Illegal? It All Comes Down To Visibility,"All states' laws dictate that if visibility is poor, headlights are mandatory. Since fog brings poor visibility, you're legally required to turn headlights on.",https://www.jalopnik.com/2047321/driving-without-headlights-in-fog-illegal-us-states/,https://www.jalopnik.com/img/gallery/is-driving-without-headlights-in-the-fog-illegal-it-all-comes-down-to-visibility/l-intro-1765292443.jpg,http://web.archive.org/web/20251217082346/https://www.jalopnik.com/2047321/driving-without-headlights-in-fog-illegal-us-states/,"Some features like video games in a Tesla or gesture controls in a BMW aren't essential for on-road safety. Others, such as your lights, very much are. That's exactly why they are so regulated. For e… [+1202 chars]",,"Ist das Fahren ohne Scheinwerfer im Nebel illegal? Auf die Sicht kommt es an. Die Gesetze aller Bundesstaaten schreiben vor, dass bei schlechter Sicht Scheinwerfer vorgeschrieben sind. Da Nebel die Sicht beeinträchtigt, sind Sie gesetzlich dazu verpflichtet, die Scheinwerfer einzuschalten.","Is Driving Without Headlights In The Fog Illegal? It All Comes Down To Visibility. All states' laws dictate that if visibility is poor, headlights are mandatory. Since fog brings poor visibility, you're legally required to turn headlights on.","Is Driving Without Headlights in The Fog Illegal? Omnia ad Visibilitatem descendit. Omnes leges civitatum dictant ut, si pauper visibilitas est, praecepta sint facienda. Cum nebula pauperem visibilitatem adfert, iure postulatur ut headlights in vertere.",2025-12-23 15:17:19+00:00
2aa867accad210b1c28bc264d8e8c2aa,2025-12-05T11:00:00Z,+fog accident,www.activistpost.com,en,0.2,"Memory Lapses and Brain Fog Skyrocket in Young Adults, Nearly Doubling in 10 Years","A study published in Neurology found that cognitive problems in young adults nearly doubled from 2013 to 2023, while rates in older adults stayed flat or declined. Researchers say chronic conditions like diabetes and high blood pressure — made worse by modern…",https://www.activistpost.com/memory-lapses-and-brain-fog-skyrocket-in-young-adults-nearly-doubling-in-10-years/,https://www.activistpost.com/wp-content/uploads/2025/11/memory-brain-fog-young-adults-1024x534-1.jpg,,"A study published in Neurology found that cognitive problems in young adults nearly doubled from 2013 to 2023, while rates in older adults stayed flat or declined. Researchers say chronic conditions … [+15455 chars]",,"Gedächtnislücken und Brain Fog nehmen bei jungen Erwachsenen sprunghaft zu und verdoppeln sich in 10 Jahren fast. Eine in Neurology veröffentlichte Studie ergab, dass sich die kognitiven Probleme bei jungen Erwachsenen von 2013 bis 2023 fast verdoppelt haben, während die Raten bei älteren Erwachsenen gleich blieben oder zurückgingen. Forscher sagen, dass chronische Erkrankungen wie Diabetes und Bluthochdruck durch die moderne… verschlimmert werden.","Memory Lapses and Brain Fog Skyrocket in Young Adults, Nearly Doubling in 10 Years. A study published in Neurology found that cognitive problems in young adults nearly doubled from 2013 to 2023, while rates in older adults stayed flat or declined. Researchers say chronic conditions like diabetes and high blood pressure — made worse by modern…","Memoria lapsuum et Brain Caligo Skyrocket in Adultis adultis, fere duplicatis in 10 annis. Studium in Neurologia editum invenit problemata cognitiva in adulescentibus adultis fere ab 2013 ad 2023 duplicata, cum rates in adultis maioribus funditus manserunt aut declinaverunt. Investigatores dicunt condiciones chronicas sicut diabetes et pressuras sanguinis altae - a modernis deteriores factas.",2025-12-23 20:17:04+00:00
690e0fdacbb27fc621bd075c136cbad2,2025-12-17T15:08:00Z,+fog accident,news.sky.com,en,0.3,'Prolonged' heavy rain to cause flooding and travel disruptions,"The Met Office says it is too soon to confirm if Britain will see a white Christmas though cold weather looks ""less likely"", as more heavy rain approaches.",https://news.sky.com/story/uk-weather-warning-of-prolonged-heavy-rain-bringing-travel-disruption-and-flooding-13484745,https://e3.365dm.com/25/12/1600x900/skynews-uk-winter-weather-fog_7113010.jpg?20251217131736,http://web.archive.org/web/20251217153401/https://news.sky.com/story/uk-weather-warning-of-prolonged-heavy-rain-bringing-travel-disruption-and-flooding-13484745,"Britons have been warned to prepare for additional heavy rainfall following a severe weather system that led to dense fog and flight cancellations.
Forecasters said a low-pressure system had brought… [+2600 chars]",,"„Anhaltender“ starker Regen führt zu Überschwemmungen und Verkehrsbehinderungen. Das Met Office sagt, es sei noch zu früh, um zu bestätigen, ob es in Großbritannien weiße Weihnachten geben wird, obwohl kaltes Wetter „weniger wahrscheinlich“ sei, da stärkerer Regen bevorstehe.","'Prolonged' heavy rain to cause flooding and travel disruptions. The Met Office says it is too soon to confirm if Britain will see a white Christmas though cold weather looks ""less likely"", as more heavy rain approaches.","'Prolonga' est pluvia gravis inundationem et peregrinationes causant. Met Officium dicit nimis cito ad confirmandum si Britannia albam Nativitatem Domini videbit, quamquam frigus ""minus probabile"" spectat, sicut pluviae graviores appropinquant.",2025-12-23 20:17:04+00:00
