index,published,keyword,domain,language,valid,title,description,url,image,archive,content,quote,de,en,la,added
af2c51f1ba23fbf24071848629d8bf4f,2026-01-13T06:26:43Z,+fog climate change,economictimes.indiatimes.com,en,0.3,"Jammu temperature drops to 3.8 degrees as J&K winter capital sees nail-biting cold, to see rainfall soon. Check full IMD forecast","Jammu temperature: Jammu and Kashmir is witnessing severe cold as temperatures have dropped across the Valley. In Jammu, the minimum temperature was recorded at 3.8 degrees Celsius and dense fog was witnessed during early morning hours on Tuesday. On January …",https://economictimes.indiatimes.com/news/new-updates/jammu-temperature-drops-to-3-8-degrees-as-jk-winter-capital-sees-nail-biting-cold-to-see-rainfall-soon-check-full-imd-forecast/articleshow/126498582.cms,"https://img.etimg.com/thumb/msid-126498675,width-1200,height-630,imgsize-26758,overlay-economictimes/articleshow.jpg",http://web.archive.org/web/20260114071442/https://economictimes.indiatimes.com/news/new-updates/jammu-temperature-drops-to-3-8-degrees-as-jk-winter-capital-sees-nail-biting-cold-to-see-rainfall-soon-check-full-imd-forecast/articleshow/126498582.cms,"Jammu and Kashmir continues to reel under nail-biting cold as temperatures dipped below freezing points across several parts of the Valley, the India Meteorological Department said (IMD). In Jammu ci… [+5068 chars]",,"Die Temperatur in Jammu sinkt auf 3,8 Grad, da in der Winterhauptstadt J&K klirrende Kälte herrscht und es bald regnen wird. Sehen Sie sich die vollständige IMD-Prognose an. Temperatur in Jammu: In Jammu und Kaschmir herrscht starke Kälte, da die Temperaturen im gesamten Tal gesunken sind. In Jammu wurde die Tiefsttemperatur bei 3,8 Grad Celsius gemessen und am Dienstag war in den frühen Morgenstunden dichter Nebel zu beobachten. Im Januar …","Jammu temperature drops to 3.8 degrees as J&K winter capital sees nail-biting cold, to see rainfall soon. Check full IMD forecast. Jammu temperature: Jammu and Kashmir is witnessing severe cold as temperatures have dropped across the Valley. In Jammu, the minimum temperature was recorded at 3.8 degrees Celsius and dense fog was witnessed during early morning hours on Tuesday. On January …","Jammu temperatura guttae ad 3.8 gradus sicut capitis hiemalis J&K videt clavum frigus mordens, ut mox pluviam videat. Reprehendo plenam IMD praenuntientur. Jammu temperies: Jammu et Kashmir testantur frigora gravia sicut temperaturas trans Vallem deciderunt. In Jammu, temperatura minima in 3.8 gradibus Celsius notata et densa nebula testabatur horis matutinis die Martis. Kalendis Ianuariis …",2026-01-19 05:27:57+00:00
9f0ef81abb56bf0be984a1f61c0aac01,2026-01-14T04:01:22Z,+fog light,www.thehindubusinessline.com,en,0.8,"Bhogi bonfires disrupt flights at Chennai airport, visibility drops sharply","Bhogi bonfires caused dense fog near Chennai airport, forcing flight cancellations and rescheduling as visibility and air quality deteriorated.",https://www.thehindubusinessline.com/economy/logistics/bhogi-bonfires-disrupt-flights-at-chennai-airport-visibility-drops-sharply/article70508049.ece,https://bl-i.thgim.com/public/incoming/tiwce7/article70508057.ece/alternates/LANDSCAPE_1200/SAT_6921.JPG,http://web.archive.org/web/20260114072046/https://www.thehindubusinessline.com/economy/logistics/bhogi-bonfires-disrupt-flights-at-chennai-airport-visibility-drops-sharply/article70508049.ece,"Bhogi bonfires caused dense fog, affecting flight operations at the Chennai airport and reducing visibility for aircraft.
As a precaution, four incoming and four outgoing early morning flights were … [+835 chars]",,"Bhogi-Lagerfeuer stören Flüge am Flughafen Chennai, die Sicht nimmt stark ab. Bhogi-Lagerfeuer verursachten dichten Nebel in der Nähe des Flughafens Chennai, was zu Flugausfällen und Umplanungen führte, da sich die Sicht und die Luftqualität verschlechterten.","Bhogi bonfires disrupt flights at Chennai airport, visibility drops sharply. Bhogi bonfires caused dense fog near Chennai airport, forcing flight cancellations and rescheduling as visibility and air quality deteriorated.","Bhogi ignes in Chennai aeroportus volatus perturbare, visibilitas acriter cadit. Bhogi ignes densam nebulam prope Chennai aeriportum effecit, ut cancellationes fugae cogerent et rescheduling ut visibilitas et qualitas aeris debilitarentur.",2026-01-19 15:21:23+00:00
1911cba60eae238e87af87d851f060cc,2026-01-15T04:29:22Z,+fog flights,indianexpress.com,en,0.8,"Dense fog hits operations at Chandigarh airport, 12 arrival, 9 departure flights cancelled","Flight movements resumed only after a marginal improvement in visibility. The first arrival landed at Chandigarh airport at 10:57 am, while the first departure took off at 12:50 pm.",https://indianexpress.com/article/cities/chandigarh/dense-fog-chandigarh-airport-12-arrival-9-departure-flights-cancelled-10474420/,https://images.indianexpress.com/2026/01/Chandigarh-Fog.jpg,,"Air traffic at Shaheed Bhagat Singh International Airport was severely disrupted on Wednesday due to dense fog, throwing flight schedules into disarray. While the airport normally begins operations a… [+1401 chars]",,"Dichter Nebel beeinträchtigt den Betrieb am Flughafen Chandigarh, 12 Ankunfts- und 9 Abflugflüge wurden gestrichen. Erst nach einer geringfügigen Verbesserung der Sicht konnten die Flugbewegungen wieder aufgenommen werden. Der erste Ankömmling landete um 10:57 Uhr am Flughafen Chandigarh, während der erste Abflug um 12:50 Uhr startete.","Dense fog hits operations at Chandigarh airport, 12 arrival, 9 departure flights cancelled. Flight movements resumed only after a marginal improvement in visibility. The first arrival landed at Chandigarh airport at 10:57 am, while the first departure took off at 12:50 pm.","Nebula densa operationes in Chandigarh aeroportus pervenit, adventus 12 9 fugae discessus instat. Fuga motus resumitur solum post emendationem marginalem visibilitatis. Primus adventus in aeroportus Chandigarh appulit ad aeriportum 10:57, cum prima discessus ad 12:50 pm discessit.",2026-01-19 15:21:23+00:00
7197e32d90531c76f8420167af53744b,2026-01-15T19:44:00Z,+fog flights,news.sky.com,en,0.8,Potential flight delays and cancellations after fog warning issued,"Current forecasts at both Manchester and Liverpool airports suggest a risk of fog, while forecasters have also issued advice to drivers, adding that bus and train services could be affected too.",https://news.sky.com/story/uk-weather-potential-flight-delays-and-cancellations-after-met-office-issues-fog-warning-13494775,https://e3.365dm.com/24/12/1600x900/skynews-gatwick-airport_6786360.jpg?20241227172359,http://web.archive.org/web/20260115222455/https://news.sky.com/story/uk-weather-potential-flight-delays-and-cancellations-after-met-office-issues-fog-warning-13494775,"A yellow warning for fog has been issued across parts of England and Wales which risks travel disruption, including to flights.
The warning continues until 7am on Friday across much of Wales, north … [+1722 chars]",,"Potenzielle Flugverspätungen und -ausfälle nach Ausgabe der Nebelwarnung. Aktuelle Prognosen an den Flughäfen Manchester und Liverpool deuten auf Nebelgefahr hin, während Meteorologen den Autofahrern auch Hinweise gegeben haben, dass auch der Bus- und Zugverkehr beeinträchtigt sein könnte.","Potential flight delays and cancellations after fog warning issued. Current forecasts at both Manchester and Liverpool airports suggest a risk of fog, while forecasters have also issued advice to drivers, adding that bus and train services could be affected too.","Potentia fugae moras et cancellationes post nebule monitionem edita. Praenuntiationes currentes apud aliquet nisl et Manchester et Liverpool periculum nebulae suggerunt, cum forecasters etiam consilium rectoribus ediderit, additis ut bus et servitiis instituendi nimium affici possent.",2026-01-19 15:21:23+00:00
52c2c5b9475387c736b6eec2fec75440,2026-01-17T02:50:09Z,+fog flights,economictimes.indiatimes.com,en,0.8,"Delhi chokes, shivers and slows: Dense fog delays flights as AQI stays ‘very poor’","The India Meteorological Department (IMD) reported a slight improvement in minimum temperature, which stood at 7 degrees Celsius on Saturday morning, compared to 4 degrees Celsius recorded on Friday. Despite the marginal rise in temperature, visibility remain…",https://economictimes.indiatimes.com/news/india/delhi-pollution-aqi-weather-flights-delay/articleshow/126600233.cms,"https://img.etimg.com/thumb/msid-126600322,width-1200,height-630,imgsize-18710,overlay-economictimes/articleshow.jpg",http://web.archive.org/web/20260117032155/https://economictimes.indiatimes.com/news/india/delhi-pollution-aqi-weather-flights-delay/articleshow/126600233.cms,"Delhi faced a triple hit of toxic air, biting cold and dense fog on Saturday morning, with poor visibility delaying several flights at Indira Gandhi International (IGI) Airport even as air quality re… [+2865 chars]",,"Delhi erstickt, zittert und wird langsamer: Dichter Nebel verzögert Flüge, da der AQI weiterhin „sehr schlecht“ ist. Das India Meteorological Department (IMD) meldete eine leichte Verbesserung der Tiefsttemperatur, die am Samstagmorgen bei 7 Grad Celsius lag, verglichen mit 4 Grad Celsius am Freitag. Trotz des geringfügigen Temperaturanstiegs bleibt die Sicht bestehen ...","Delhi chokes, shivers and slows: Dense fog delays flights as AQI stays ‘very poor’. The India Meteorological Department (IMD) reported a slight improvement in minimum temperature, which stood at 7 degrees Celsius on Saturday morning, compared to 4 degrees Celsius recorded on Friday. Despite the marginal rise in temperature, visibility remain…","Delhi suffocat, tremit et tardat: densa nebula moras volatus sicut AQI remanet ‘pauperrimus’. In India Meteorologica Department (IMD) nuntiavit levem emendationem temperaturae minimae, quae ante 7 gradus Celsius mane Sabbati stetit, comparatus ad 4 gradus Celsius die Veneris commemoratur. Quamvis marginalis ortus in caliditate, visibilitas manet…",2026-01-19 15:21:23+00:00
961566c2a71050371bfbffd9fd759a51,2026-01-07T09:24:37Z,+fog accident,www.thehindubusinessline.com,en,0.3,"Dense fog, cold wave to persist across north, central India for 5–7 days: IMD","Cold wave and cold day conditions were reported across large parts of north, central, east and north-east India in the past 24 hours, with severe cold day conditions in isolated areas of Rajasthan",https://www.thehindubusinessline.com/economy/agri-business/dense-fog-cold-wave-to-persist-across-north-central-india-for-57-days-imd/article70481543.ece,https://bl-i.thgim.com/public/incoming/a97rxa/article70481590.ece/alternates/LANDSCAPE_1200/20251222016L.jpg,http://web.archive.org/web/20260107102720/https://www.thehindubusinessline.com/economy/agri-business/dense-fog-cold-wave-to-persist-across-north-central-india-for-57-days-imd/article70481543.ece,"While predicting dense fog conditions very likely to continue during morning hours over north-west, central, and north-east India during the next 5-7 days, India Meteorological Department (IMD) on We… [+2367 chars]",,"Dichter Nebel, Kältewelle hält 5–7 Tage lang im Norden und in der Mitte Indiens an: IMD. In den letzten 24 Stunden wurden in weiten Teilen Nord-, Zentral-, Ost- und Nordostindiens Kältewellen und Kältetage gemeldet, wobei in abgelegenen Gebieten Rajasthans schwere Kältetage herrschten","Dense fog, cold wave to persist across north, central India for 5–7 days: IMD. Cold wave and cold day conditions were reported across large parts of north, central, east and north-east India in the past 24 hours, with severe cold day conditions in isolated areas of Rajasthan","Densa nebula, frigida unda persistere per septentrionem, India media pro 5-7 diebus: IMD. Condiciones frigidae et diei frigoris nuntiatae sunt per magnas partes septentrionis, centralis, orientalis et septentrionalis Indiae orientalis praeter 24 horas, cum condiciones frigoris graves in locis remotis Rajasthani",2026-01-20 10:22:17+00:00
70b1d72b4554e7fbd51bba1ad0bf1ecb,2026-01-08T03:32:51Z,+fog accident,economictimes.indiatimes.com,en,0.3,"Delhi, Noida and Gurugram weather: Delhi to see more chilly winters as temperatures set to plunge; IMD issues yellow alert as cold wave tightens grip","Delhi weather today: Delhi is likely to experience more chilly winters ahead as the minimum temperature is set to drop in the national capital in the upcoming days, the IMD warned in its weather bulletin. The IMD has issued a yellow alert for Delhi today as c…",https://economictimes.indiatimes.com/news/new-updates/delhi-noida-and-gurugram-weather-delhi-to-see-more-chilly-winters-as-temperatures-set-to-plunge-imd-issues-yellow-alert-as-cold-wave-tightens-grip/articleshow/126405944.cms,"https://img.etimg.com/thumb/msid-126406000,width-1200,height-630,imgsize-19408,overlay-economictimes/articleshow.jpg",http://web.archive.org/web/20260108110733/https://economictimes.indiatimes.com/news/new-updates/delhi-noida-and-gurugram-weather-delhi-to-see-more-chilly-winters-as-temperatures-set-to-plunge-imd-issues-yellow-alert-as-cold-wave-tightens-grip/articleshow/126405944.cms,"The India Meteorological Department (IMD) has sounded a yellow alert for Delhi for Thursday, January 8, and has forecast moderate fog at many places with dense fog at isolated places during morning h… [+4876 chars]",,"Wetter in Delhi, Noida und Gurugram: Delhi wird kühlere Winter erleben, da die Temperaturen sinken; IMD gibt gelbe Warnung aus, da die Kältewelle den Einfluss verstärkt. Delhi-Wetter heute: Delhi wird voraussichtlich noch kühlere Winter erleben, da die Tiefsttemperatur in der Landeshauptstadt in den kommenden Tagen sinken wird, warnte das IMD in seinem Wetterbulletin. Das IMD hat heute eine gelbe Warnung für Delhi herausgegeben, da …","Delhi, Noida and Gurugram weather: Delhi to see more chilly winters as temperatures set to plunge; IMD issues yellow alert as cold wave tightens grip. Delhi weather today: Delhi is likely to experience more chilly winters ahead as the minimum temperature is set to drop in the national capital in the upcoming days, the IMD warned in its weather bulletin. The IMD has issued a yellow alert for Delhi today as c…","Delhi, Noida et Gurugram tempestas: Delhi videre hiemes frigidas sicut temperaturas demergere; IMD exit flavus, alacer, ut gelidus unda Constringitur. Tempestas hodie Delhi: Delhi hiemes frigidas experiri verisimile est ante quam minimum temperamentum in venturis diebus in capitali nationali cadere positum est, IMD admonitus in bulletin tempestatis. IMD croceum erectum pro Delhi hodie edidit ut c…",2026-01-20 10:22:17+00:00
53017017ed770f4b48d2acde39767aa0,2026-01-09T03:59:48Z,+fog accident,economictimes.indiatimes.com,en,0.3,"Tamil Nadu rain: Why is the southern state receiving heavy showers in January? Check IMD forecast, reason and more","Tamil Nadu rain: Even as North India freezes due to dense fog conditions, Tamil Nadu is experiencing heavy rainfall from Thursday with widespread heavy rainfall across various coastal and adjoining districts till January 11. A deep depression over the Bay of …",https://economictimes.indiatimes.com/news/new-updates/tamil-nadu-rain-why-is-the-southern-state-receiving-heavy-showers-in-rare-january-weather-event-check-imd-forecast-reason-and-more/articleshow/126426680.cms,"https://img.etimg.com/thumb/msid-126426680,width-1200,height-630,imgsize-161112,overlay-economictimes/articleshow.jpg",http://web.archive.org/web/20260109113226/https://economictimes.indiatimes.com/news/new-updates/tamil-nadu-rain-why-is-the-southern-state-receiving-heavy-showers-in-rare-january-weather-event-check-imd-forecast-reason-and-more/articleshow/126426680.cms,"Tamil Nadu, Puducherry and Karaikal are likely to receive heavy rainfall from January 8 as a deep depression in the Bay of Bengal is likely to bring heavy showers to the south. A system over the Bay … [+5502 chars]",,"Regen in Tamil Nadu: Warum kommt es im Südstaat im Januar zu heftigen Regenfällen? Überprüfen Sie die IMD-Prognose, den Grund und mehr. Regen in Tamil Nadu: Auch wenn Nordindien aufgrund dichter Nebelbedingungen zufriert, kommt es in Tamil Nadu ab Donnerstag zu heftigen Regenfällen, die sich bis zum 11. Januar über verschiedene Küsten- und angrenzende Bezirke erstrecken. Ein tiefes Tiefdruckgebiet über der Bucht von …","Tamil Nadu rain: Why is the southern state receiving heavy showers in January? Check IMD forecast, reason and more. Tamil Nadu rain: Even as North India freezes due to dense fog conditions, Tamil Nadu is experiencing heavy rainfall from Thursday with widespread heavy rainfall across various coastal and adjoining districts till January 11. A deep depression over the Bay of …","Tamil Nadu pluvia: Cur status meridianus graves imbres mense Ianuario accipit? Orthographiam IMD Providemus, rationem et magis. Tamil Nadu pluvia: Sicut India Septentrionalis propter densas nebulas conditiones constringitur, Tamil Nadu pluvias gravissimas ab Iouis imbribus diffusas per varias maritimas regiones et regiones vicinas usque ad diem Ian.",2026-01-20 10:22:17+00:00
4f0ef7c503300eac5072ae6628f5a4bb,2026-01-08T19:03:38Z,+fog alert,timesofindia.indiatimes.com,en,0.8,Jharkhand Schools Closed: Cold Wave Alert Prompts Two-Day Shutdown in 13 Districts,"Jharkhand districts, including Ranchi, Jamshedpur, and Hazaribag, have ordered schools to close on Friday and Saturday due to a yellow alert for a cold wave. The Meteorological Department predicts north-westerly winds and morning fog, prompting the closure of…",https://timesofindia.indiatimes.com/city/ranchi/jharkhand-schools-closed-cold-wave-alert-prompts-two-day-shutdown-in-13-districts/articleshow/126421804.cms,"https://static.toiimg.com/thumb/msid-126421804,width-1070,height-580,imgsize-null,resizemode-75,overlay-toi_sw,pt-32,y_pad-500/photo.jpg",,"Follow Us On Social Media
Copyright © 2026 Bennett, Coleman &amp; Co. Ltd. All rights reserved. For reprint rights: Times Syndication Service",,"Jharkhand-Schulen geschlossen: Kältewellenwarnung führt zu zweitägiger Schließung in 13 Bezirken. Die Bezirke Jharkhand, darunter Ranchi, Jamshedpur und Hazaribag, haben angeordnet, dass die Schulen am Freitag und Samstag wegen einer gelben Kältewelle schließen müssen. Das Wetteramt prognostiziert Nordwestwinde und Morgennebel, was zur Schließung von… führen wird.","Jharkhand Schools Closed: Cold Wave Alert Prompts Two-Day Shutdown in 13 Districts. Jharkhand districts, including Ranchi, Jamshedpur, and Hazaribag, have ordered schools to close on Friday and Saturday due to a yellow alert for a cold wave. The Meteorological Department predicts north-westerly winds and morning fog, prompting the closure of…","Jharkhand Schools XXXIV: Frigidum Unda erecti Promptus Duo-Dies Shutdown in XIII Pagos. Districtus Jharkhand, incluso Ranchi, Jamshedpur, et Hazaribag, scholas claudere iussit die Veneris et Sabbati ob flavum intentum ad undam frigidam. Department meteorologicum ventos occidentales et nebulas matutinas praedicit, clausuram ...",2026-01-20 10:22:17+00:00
c9242f194dd7a08afbbaa8f1d404dffb,2026-01-17T19:50:07Z,+fog climate change,bringatrailer.com,en,0.8,2013 Land Rover LR4 HSE at No Reserve,"This 2013 Land Rover LR4 HSE is finished in Santorini Black Metallic over Ebony leather and is powered by a 5.0-liter V8 linked to a six-speed automatic transmission and a dual-range transfer case. Features include a locking center differential, fog lights, r…",https://bringatrailer.com/listing/2013-land-rover-lr4-25/,https://bringatrailer.com/wp-content/uploads/2026/01/2013_land-rover_lr4_img_1299-44538.jpg,,This 2013 Land Rover LR4 HSE is finished in Santorini Black Metallic over Ebony leather and is powered by a 5.0-liter V8 linked to a six-speed automatic transmission and a dual-range transfer case. F… [+1889 chars],,"2013 Land Rover LR4 HSE ohne Reserve. Dieser 2013 Land Rover LR4 HSE ist in Santorini Black Metallic über Ebony-Leder lackiert und wird von einem 5,0-Liter-V8 angetrieben, der mit einem Sechsgang-Automatikgetriebe und einem Dual-Range-Verteilergetriebe verbunden ist. Zur Ausstattung gehören ein Sperrdifferenzial, Nebelscheinwerfer, …","2013 Land Rover LR4 HSE at No Reserve. This 2013 Land Rover LR4 HSE is finished in Santorini Black Metallic over Ebony leather and is powered by a 5.0-liter V8 linked to a six-speed automatic transmission and a dual-range transfer case. Features include a locking center differential, fog lights, r…","2013 Land Rover LR4 HSE apud No Subsidium. Hoc 2013 Land Rover LR4 HSE in Santorini Black Metallicum super corium Ebony finitur et a 5.0-liter V8 coniungitur cum sex velocitate latae transmissionis et causa translationis dualis. Lineamenta includunt densis centrum differentiale, lumina nebula, r…",2026-01-22 01:15:59+00:00
c5e2a04c7f1fe5458173f870c469bded,2026-01-20T03:29:23Z,+fog weather,economictimes.indiatimes.com,en,0.8,"Weather today: Planning to keep your sweaters in? IMD says rainfall, thunderstorms likely in Delhi, Punjab, Uttar Pradesh, Himachal and more. Check full forecast","Weather alert today: Are you planning to keep your sweaters in? The IMD has warned of rainfall, thunderstorms likely in Punjab, Delhi, Uttar Pradesh and Himachal Pradesh in the coming few days. The weather agency has warned that dense to very dense fog condit…",https://economictimes.indiatimes.com/news/new-updates/weather-today-planning-to-keep-your-sweaters-in-imd-says-rainfall-thunderstorms-likely-in-delhi-punjab-uttar-pradesh-himachal-and-more-check-full-forecast/articleshow/126750097.cms,"https://img.etimg.com/thumb/msid-126750424,width-1200,height-630,imgsize-85662,overlay-economictimes/articleshow.jpg",,The India Meteorological Department (IMD) in its All India Weather Summary and Forecast bulletin has warned that the country is set to witness a dynamic and eventful weather pattern from January 19 t… [+5021 chars],,"Wetter heute: Planen Sie, Ihre Pullover anzuziehen? IMD sagt, dass Regenfälle und Gewitter in Delhi, Punjab, Uttar Pradesh, Himachal und mehr wahrscheinlich sind. Überprüfen Sie die vollständige Prognose. Wetteralarm heute: Planen Sie, Ihre Pullover anzuziehen? Das IMD hat in den kommenden Tagen vor Regenfällen und Gewittern in Punjab, Delhi, Uttar Pradesh und Himachal Pradesh gewarnt. Die Wetterbehörde warnte vor dichtem bis sehr dichtem Nebel.","Weather today: Planning to keep your sweaters in? IMD says rainfall, thunderstorms likely in Delhi, Punjab, Uttar Pradesh, Himachal and more. Check full forecast. Weather alert today: Are you planning to keep your sweaters in? The IMD has warned of rainfall, thunderstorms likely in Punjab, Delhi, Uttar Pradesh and Himachal Pradesh in the coming few days. The weather agency has warned that dense to very dense fog condit…","Tempestas hodie: congue ut luctus luctus in? IMD pluviam dicit, procellas in Delhi, Punjab, Uttar Pradesh, Himachal et plura. Plena prospicere reprehendo. Tempestas hodie vigilat: Cogitasne luctus tuos servare in? IMD pluvias, procellas in Punjab, Delhi, Uttar Pradesh et Himachal Pradesh in paucis diebus venientes monuit. Tempestas procurationis monuit densissimam nebulam ad densissimam condit…",2026-01-25 05:25:03+00:00
0e8380dad82cf478824539df6c9509e6,2026-01-21T11:56:12Z,+fog light,economictimes.indiatimes.com,en,0.8,"Delhi-NCR weather update: When will it rain in Delhi, Noida, Gurugram and Ghaziabad? IMD issues advisory for North India","Delhi Rain News: Delhi-NCR's winter continues with changing skies and rain expected mid-week. Dense fog will greet mornings, with cloud cover increasing. Light rain and gusty winds are forecast for January 23. Cold winds will persist from January 24. Meanwhil…",https://economictimes.indiatimes.com/news/new-updates/delhi-ncr-weather-update-when-will-it-rain-in-delhi-noida-gurugram-and-ghaziabad-imd-issues-advisory-for-north-india/articleshow/126980347.cms,"https://img.etimg.com/thumb/msid-126981753,width-1200,height-630,imgsize-1733421,overlay-economictimes/articleshow.jpg",http://web.archive.org/web/20260121170454/https://economictimes.indiatimes.com/news/new-updates/delhi-ncr-weather-update-when-will-it-rain-in-delhi-noida-gurugram-and-ghaziabad-imd-issues-advisory-for-north-india/articleshow/126980347.cms,"Delhi-NCRs winter spell is set to continue over the coming days, with changing skies, rising cloud cover and a brief spell of rain expected mid-week. According to the India Meteorological Department … [+4694 chars]",,"Delhi-NCR-Wetter-Update: Wann wird es in Delhi, Noida, Gurugram und Ghaziabad regnen? IMD gibt Empfehlung für Nordindien heraus. Delhi Rain News: Der Winter in Delhi-NCR geht mit wechselndem Himmel und Regen, der Mitte der Woche erwartet wird, weiter. Am Morgen erwartet Sie dichter Nebel, die Wolkendecke nimmt zu. Für den 23. Januar werden leichter Regen und böige Winde vorhergesagt. Ab dem 24. Januar wird es weiterhin kalte Winde geben. In der Zwischenzeit…","Delhi-NCR weather update: When will it rain in Delhi, Noida, Gurugram and Ghaziabad? IMD issues advisory for North India. Delhi Rain News: Delhi-NCR's winter continues with changing skies and rain expected mid-week. Dense fog will greet mornings, with cloud cover increasing. Light rain and gusty winds are forecast for January 23. Cold winds will persist from January 24. Meanwhil…","Delhi-NCR tempestas renovatio: Quando pluet in Delhi, Noida, Gurugram et Ghaziabad? IMD consultorium provenit pro India septentrionali. Delhi Pluvia Nova: Delhi-NCR hiemalis pergit cum mutationibus caeli et pluviae expectatae mediae septimanae. Nebula densa mane salutabit, cres- cente nube operiet. Luce pluviae et ventos procellae praenuntiant pro ianuario 23. Ventos frigores manebit a die 24 Ianuarii. Interea…",2026-01-25 05:25:03+00:00
