index,published,keyword,domain,language,valid,title,description,url,image,archive,content,quote,de,en,la,added
ef3060946135aea8e6bc5d6d83934ed9,2026-04-14T10:23:00Z,+fog light,www.mindbodygreen.com,en,0.3,This Common Nighttime Habit Can Make Your Brain Age 4 Years Faster,"If you’ve been brushing off sleepless nights, this study might change your mind",https://www.mindbodygreen.com/articles/this-common-sleep-problem-may-raise-dementia-risk-by-40-off-sleepless-nights,"https://mindbodygreen-res.cloudinary.com/image/upload/c_crop,x_108,y_495,w_2376,h_1335/c_fill,w_2000,h_1200,g_auto,fl_lossy,f_jpg/org/d6ava3e6fjuivq3kv.jpg",,"Most of us know how miserable a sleepless night feels the next morning. But beyond grogginess and brain fog, what does chronic insomnia actually mean for your long-term brain health? A new study sugg… [+3750 chars]",,"Diese häufige nächtliche Angewohnheit kann Ihr Gehirn um 4 Jahre schneller altern lassen. Wenn Sie schlaflose Nächte hinter sich haben, könnte diese Studie Ihre Meinung ändern","This Common Nighttime Habit Can Make Your Brain Age 4 Years Faster. If you’ve been brushing off sleepless nights, this study might change your mind","Hoc Commune Nighttime Consuetudo potest Fac Your Cerebri Age 4 Anni Velocius. Si noctes vigilias detergeres, hoc studium mentem tuam mutare posset",2026-04-20 02:04:08+00:00
2c9ae5f4c0947c0a6614532c4b9b084f,2026-04-14T16:30:16Z,+fog light,bringatrailer.com,en,0.8,1997 BMW 840Ci 6-Speed,"This 1997 BMW 840Ci is powered by a 4.4-liter V8, which is paired with a six-speed manual transmission that was installed under prior ownership. Finished in Alpine White, the car is further equipped with 19"" alloy wheels, a power-operated sunroof, fog lights,…",https://bringatrailer.com/listing/1997-bmw-840ci-67-2/,https://bringatrailer.com/wp-content/uploads/2026/04/DSC_2335-21394-scaled.jpg,,"This 1997 BMW 840Ci is powered by a 4.4-liter V8, which is paired with a six-speed manual transmission that was installed under prior ownership. Finished in Alpine White, the car is further equipped … [+2639 chars]",,"1997 BMW 840Ci 6-Gang. Dieser BMW 840Ci aus dem Jahr 1997 wird von einem 4,4-Liter-V8 angetrieben, der mit einem Sechsgang-Schaltgetriebe gepaart ist, das bei einem Vorbesitzer eingebaut wurde. Das in Alpinweiß lackierte Auto ist außerdem mit 19-Zoll-Leichtmetallfelgen, einem elektrisch betätigten Schiebedach, Nebelscheinwerfern usw. ausgestattet.","1997 BMW 840Ci 6-Speed. This 1997 BMW 840Ci is powered by a 4.4-liter V8, which is paired with a six-speed manual transmission that was installed under prior ownership. Finished in Alpine White, the car is further equipped with 19"" alloy wheels, a power-operated sunroof, fog lights,…","1997 BMW 840Ci 6-Speed. Hoc 1997 BMW 840Ci potens est per 4.4-liter V8, quae cum sex velocitate manuali tradenda, quae sub dominio praevia inaugurata est, par est. In Alba Alpina complevit, currus amplius instructus est cum 19"" mixturae rotis, sunroof potentiae, lumina nebulae,…",2026-04-20 11:16:43+00:00
fac6ec994fe7410c012dba8479025988,2026-04-17T23:30:15Z,+fog warning system,www.yankodesign.com,en,0.3,Lymow One Plus Review: The Tank Got an Engineering Degree,"Lymow One Plus Review: The Tank Got an Engineering DegreeWhen I reviewed the original Lymow One last August, I called it nimble, powerful, and reliable. It was the first robot mower I had tested...",https://www.yankodesign.com/2026/04/17/lymow-one-plus-review-the-tank-got-an-engineering-degree/,https://www.yankodesign.com/images/design_news/2026/04/lymow-one-plus-review-the-tank-got-an-engineering-degree/lymow-one-plus-yd-review-37.jpg,,"PROS:
<ul><li>LiFePO4 battery rated 2,000+ cycles outlasts all lithium-ion competitors</li><li>Heated cameras eliminate morning fog and dew navigation issues</li><li>1,785W motor handles thick, wet,… [+18188 chars]",,"Bewertung des Lymow One Plus: Der Panzer hat einen Abschluss als Ingenieur. Lymow One Plus im Test: Der Panzer hat einen Abschluss als Ingenieur. Als ich letzten August den ursprünglichen Lymow One testete, nannte ich ihn flink, leistungsstark und zuverlässig. Es war der erste Mähroboter, den ich getestet habe...","Lymow One Plus Review: The Tank Got an Engineering Degree. Lymow One Plus Review: The Tank Got an Engineering DegreeWhen I reviewed the original Lymow One last August, I called it nimble, powerful, and reliable. It was the first robot mower I had tested...","Lymow One Plus Review: The Tank Got an Engineering Degree. Lymow One Plus Review: The Tank Got an Engineering Degree Cum recensui originalem Lymow Unum ultimum Augustum, id agilem, potentem, et certum appellavi. Primus robot metit quem probavi...",2026-04-20 16:03:26+00:00
2cfe9d1487fb244c8223b93b6930b48c,2026-04-12T21:02:04Z,+fog light,bringatrailer.com,en,0.8,2002 Maserati Spyder GT 6-Speed at No Reserve,"This 2002 Maserati Spyder is finished in Grigio Touring Metallizzato over Blu Navy leather and is powered by a 4.2-liter V8 connected to a GT six-speed manual transaxle. Equipment includes a Blu retractable soft top, fog lights, 18"" multi-spoke alloy wheels, …",https://bringatrailer.com/listing/2002-maserati-spyder-33/,https://bringatrailer.com/wp-content/uploads/2026/04/2002_maserati_spyder_20260408_133625-23456.jpg,,This 2002 Maserati Spyder is finished in Grigio Touring Metallizzato over Blu Navy leather and is powered by a 4.2-liter V8 connected to a GT six-speed manual transaxle. Equipment includes a Blu retr… [+2300 chars],,"2002 Maserati Spyder GT 6-Gang ohne Reserve. Dieser Maserati Spyder aus dem Jahr 2002 ist mit Grigio Touring Metallizzato über Blu Navy-Leder lackiert und wird von einem 4,2-Liter-V8 angetrieben, der mit einem GT-Sechsgang-Schaltgetriebe verbunden ist. Zur Ausstattung gehören ein blaues versenkbares Verdeck, Nebelscheinwerfer, 18-Zoll-Leichtmetallräder im Vielspeichen-Design, …","2002 Maserati Spyder GT 6-Speed at No Reserve. This 2002 Maserati Spyder is finished in Grigio Touring Metallizzato over Blu Navy leather and is powered by a 4.2-liter V8 connected to a GT six-speed manual transaxle. Equipment includes a Blu retractable soft top, fog lights, 18"" multi-spoke alloy wheels, …","2002 Maserati Spyder GT 6-celeritate ad Subsidium No. Hoc 2002 Maserati Spyder in Grigio Touring Metallizzato super Blu Navy corium finitur et a 4.2 sextario V8 ad GT transaxlum manuale velocitate connexum est. Apparatu comprehendit Blu retractabilem verticem mollem, lumina nebulam, 18 ""rotis mixturae multi-fanti, ...",2026-04-21 01:59:52+00:00
469f6dd09d30f3d13f3d7dfca152939e,2026-04-20T19:00:29Z,+fog slow down,gizmodo.com,en,0.3,Fog Has Always Been Shrouded in Mystery. Our Window to Figure It Out May Be Closing,A new $3.65 million initiative is looking into why fog has declined 33% across California’s redwood forests.,https://gizmodo.com/fog-has-always-been-shrouded-in-mystery-our-window-to-figure-it-out-may-be-closing-2000747140,https://gizmodo.com/app/uploads/2026/04/California-woodland-fog-2018-1200x675.jpg,,"Clouds, fluffy clouds, have long bedeviled climate scientists trying to model our atmospheres response to rising greenhouse gases. But they know even less about fog, whichtrue to its literary connota… [+4031 chars]",,"Nebel war schon immer voller Geheimnisse. Unser Zeitfenster, es herauszufinden, schließt sich möglicherweise. Eine neue 3,65-Millionen-Dollar-Initiative untersucht, warum der Nebel in den kalifornischen Redwood-Wäldern um 33 % zurückgegangen ist.",Fog Has Always Been Shrouded in Mystery. Our Window to Figure It Out May Be Closing. A new $3.65 million initiative is looking into why fog has declined 33% across California’s redwood forests.,Caligo semper in mysterio occultata est. Fenestram in figura nostra claudatur. Novum inceptum $3.65 decies centena millia inquirit quare nebula 33% trans California silvas rufas neglexit.,2026-04-21 20:44:42+00:00
3b7a17e46275c992071ccf3849f83469,2026-04-16T20:44:34Z,+fog light,bringatrailer.com,en,0.8,2013 Land Rover LR4 HSE at No Reserve,"This 2013 Land Rover LR4 HSE is finished in black over Ebony leather and is powered by a 5.0-liter V8 linked to a six-speed automatic transmission and a dual-range transfer case. Equipment includes a locking center differential, xenon headlights, fog lights, …",https://bringatrailer.com/listing/2013-land-rover-lr4-31/,https://bringatrailer.com/wp-content/uploads/2026/04/2013_land-rover_lr4_dsc09110-10948.jpg,,This 2013 Land Rover LR4 HSE is finished in black over Ebony leather and is powered by a 5.0-liter V8 linked to a six-speed automatic transmission and a dual-range transfer case. Equipment includes a… [+2080 chars],,"2013 Land Rover LR4 HSE ohne Reserve. Dieser 2013 Land Rover LR4 HSE ist in Schwarz über Ebony-Leder gehalten und wird von einem 5,0-Liter-V8 angetrieben, der mit einem Sechsgang-Automatikgetriebe und einem Zweibereichs-Verteilergetriebe verbunden ist. Zur Ausstattung gehören ein Mittendifferenzial mit Sperrfunktion, Xenon-Scheinwerfer, Nebelscheinwerfer, …","2013 Land Rover LR4 HSE at No Reserve. This 2013 Land Rover LR4 HSE is finished in black over Ebony leather and is powered by a 5.0-liter V8 linked to a six-speed automatic transmission and a dual-range transfer case. Equipment includes a locking center differential, xenon headlights, fog lights, …","2013 Land Rover LR4 HSE apud No Subsidium. Hoc 2013 Land Rover LR4 HSE in nigro super ebenum corium consummatum est et a 5.0-liter V8 coniunctum cum sex velocitate automatic transmissione et casu translationis dual-range. Instrumentum densis includit centrum differentiale, xenon luces, nebula luminaria, …",2026-04-22 01:58:28+00:00
7ae378da072948f933a3c08e098ec21a,2026-04-22T18:20:12Z,+fog weather,bringatrailer.com,en,0.8,36k-Mile 2007 Porsche Cayman 5-Speed,"This 2007 Porsche Cayman is powered by a 2.7-liter flat-six paired with a five-speed manual transaxle and is finished in Guards Red over black leather. Equipment includes a deployable rear spoiler, aftermarket LED fog lights, 17"" Boxster III wheels, heated po…",https://bringatrailer.com/listing/2007-porsche-cayman-97/,https://bringatrailer.com/wp-content/uploads/2026/04/2007_porsche_cayman_photo1-18658.jpg,,"This 2007 Porsche Cayman is powered by a 2.7-liter flat-six paired with a five-speed manual transaxle and is finished in Guards Red over black leather. Equipment includes a deployable rear spoiler, a… [+2000 chars]",,"36.000 Meilen 2007 Porsche Cayman 5-Gang. Dieser Porsche Cayman aus dem Jahr 2007 wird von einem 2,7-Liter-Sechszylinder-Boxermotor gepaart mit einem Fünfgang-Schaltgetriebe angetrieben und ist in Guards Red über schwarzem Leder gehalten. Zur Ausstattung gehören ein ausfahrbarer Heckspoiler, Aftermarket-LED-Nebelscheinwerfer, 17-Zoll-Boxster-III-Räder, beheizter Po…","36k-Mile 2007 Porsche Cayman 5-Speed. This 2007 Porsche Cayman is powered by a 2.7-liter flat-six paired with a five-speed manual transaxle and is finished in Guards Red over black leather. Equipment includes a deployable rear spoiler, aftermarket LED fog lights, 17"" Boxster III wheels, heated po…","36k-Mile 2007 Porsche Cayman 5-Speed. Hoc 2007 Porsche Cayman potestate 2.7-literis planae sex paribus cum transaxlo manuali quinque velocitate confectum est et in custodiae rubri super corio nigro finitur. Apparatu includunt inexplicabilem praedonem tergo, aftermarket DUXERIT lumina nebulae, 17"" Boxster III rotae, po… calefacta.",2026-04-24 11:02:19+00:00
539af8e5e1c28c15c993f4b174d47c92,2026-04-23T21:38:42Z,+fog light,bringatrailer.com,en,0.8,2000 Jaguar XK8 Convertible at No Reserve,"This 2000 Jaguar XK8 convertible is powered by a 4.0-liter V8 paired with a five-speed automatic transmission and is finished in Topaz over Oatmeal leather. Equipment includes a beige convertible soft top, xenon headlights, 18"" Sport alloy wheels, fog lights,…",https://bringatrailer.com/listing/2000-jaguar-xk8-convertible-26/,https://bringatrailer.com/wp-content/uploads/2026/04/2000_jaguar_xk8-convertible_00-jag-002-96458.jpg,,This 2000 Jaguar XK8 convertible is powered by a 4.0-liter V8 paired with a five-speed automatic transmission and is finished in Topaz over Oatmeal leather. Equipment includes a beige convertible sof… [+1979 chars],,"2000 Jaguar XK8 Cabrio ohne Reserve. Dieses Jaguar XK8-Cabriolet aus dem Jahr 2000 wird von einem 4,0-Liter-V8-Motor mit Fünfgang-Automatikgetriebe angetrieben und ist in Topaz-Optik über Haferflockenleder gehalten. Zur Ausstattung gehören ein beiges Cabrio-Verdeck, Xenon-Scheinwerfer, 18-Zoll-Sport-Leichtmetallfelgen, Nebelscheinwerfer, …","2000 Jaguar XK8 Convertible at No Reserve. This 2000 Jaguar XK8 convertible is powered by a 4.0-liter V8 paired with a five-speed automatic transmission and is finished in Topaz over Oatmeal leather. Equipment includes a beige convertible soft top, xenon headlights, 18"" Sport alloy wheels, fog lights,…","2000 Onyx XK8 Convertibilis ad No Subsidium. Hoc 2000 Jaguar XK8 convertibile est a 4.0-liter V8 cum quinque-celeritate transmissionis latae paribus et in Topaz super corio Oatmeal finitur. Armorum grisio verticem mollem convertibilem includit, xenon ornamentorum, 18 ""Lusum mixturae rotae, lumina nebulae,…",2026-04-25 20:32:45+00:00
ad4024d828fb0505b9f8b28891bc9a28,2026-04-14T00:00:00Z,+fog climate change,articles.mercola.com,en,0.3,"Insulin Resistance Is Driving 12 Types of Cancer, Researchers Say","Insulin resistance — a metabolic condition characterized by fatigue, abdominal weight gain, brain fog, and unstable blood sugar — now sits at the center of cancer research. Unlike a single blood test result, insulin resistance reflects how your cells respond …",https://articles.mercola.com/sites/articles/archive/2026/04/14/insulin-resistance-cancer.aspx,https://media.mercola.com/ImageServer/Public/2026/April/FB/insulin-resistance-cancer-fb.jpg,,"Insulin resistance a metabolic condition characterized by fatigue, abdominal weight gain, brain fog, and unstable blood sugar now sits at the center of cancer research. Unlike a single blood test res… [+13564 chars]",,"Forscher sagen, dass Insulinresistenz die Ursache für zwölf Krebsarten ist. Insulinresistenz – eine Stoffwechselerkrankung, die durch Müdigkeit, Gewichtszunahme im Bauchraum, Gehirnnebel und instabilen Blutzucker gekennzeichnet ist – steht heute im Mittelpunkt der Krebsforschung. Im Gegensatz zu einem einzelnen Bluttestergebnis spiegelt die Insulinresistenz wider, wie Ihre Zellen reagieren …","Insulin Resistance Is Driving 12 Types of Cancer, Researchers Say. Insulin resistance — a metabolic condition characterized by fatigue, abdominal weight gain, brain fog, and unstable blood sugar — now sits at the center of cancer research. Unlike a single blood test result, insulin resistance reflects how your cells respond …","Insulin resistentia agit 12 Genera Cancri, Investigatores Dic. Insulina resistentia — conditio metabolicae labori propria, abdominis pondus lucrum, caligo cerebri, et saccharo sanguinis instabilis — nunc in centro investigationis cancer sedet. Dissimilis unus effectus sanguinis test, insulina resistentia ostendit quomodo cellae tuae respondent ...",2026-04-26 02:05:46+00:00
6af9f30855a00220698a3d1dfa4ae26b,2026-04-17T23:10:12Z,+fog light,bringatrailer.com,en,0.8,1991 Ford Taurus SHO at No Reserve,"This 1991 Ford Taurus SHO is powered by a 3.0-liter V6 paired with a five-speed manual transaxle and is finished in white over tan leather and cloth upholstery. Equipment includes four-wheel anti-lock disc brakes, 16"" ""Slicer"" cast aluminum wheels, fog lights…",https://bringatrailer.com/listing/1991-ford-taurus-sho-3/,https://bringatrailer.com/wp-content/uploads/2025/06/1991_ford_taurus-sho_1991_ford_taurus-sho_58f88d1f-e86d-42db-8a6e-519896e4da7a-wkv3ex-73986-74270.jpg,,This 1991 Ford Taurus SHO is powered by a 3.0-liter V6 paired with a five-speed manual transaxle and is finished in white over tan leather and cloth upholstery. Equipment includes four-wheel anti-loc… [+2180 chars],,"1991 Ford Taurus SHO ohne Reserve. Dieser Ford Taurus SHO aus dem Jahr 1991 wird von einem 3,0-Liter-V6-Motor mit Fünfgang-Schaltgetriebe angetrieben und ist mit weiß über hellbraunem Leder und Stoff bezogen. Zur Ausstattung gehören Allrad-Antiblockier-Scheibenbremsen, 16-Zoll-Aluminiumgussräder „Slicer“, Nebelscheinwerfer …","1991 Ford Taurus SHO at No Reserve. This 1991 Ford Taurus SHO is powered by a 3.0-liter V6 paired with a five-speed manual transaxle and is finished in white over tan leather and cloth upholstery. Equipment includes four-wheel anti-lock disc brakes, 16"" ""Slicer"" cast aluminum wheels, fog lights…","1991 Ford Taurus SHO apud No Subsidium. Hoc 1991 Ford Taurus SHO potestatem habet 3.0-liter V6 cum transaxlo manuali cum velocitate quinque paribus et in albo super tan corio et panno upholstery finitur. Instrumentum quattuor rotae includit scopuli discos anti-cincinnorum, 16"" ""Slicer"" rotae aluminii iacta, lumina nebula…",2026-04-26 15:37:37+00:00
e432cafff33dd2b40ad70a4d9832f1e8,2026-04-02T14:45:04Z,+fog light,bringatrailer.com,en,0.8,2004 BMW 325i Sedan at No Reserve,"This 2004 BMW 325i sedan has 58k miles and is finished in Silver Grey Metallic over black leather. Power comes from a 2.5-liter inline-six paired with a five-speed automatic transmission, and the car is equipped with 16"" alloy wheels, a sunroof, fog lights, t…",https://bringatrailer.com/listing/2004-bmw-325i-sedan-7/,https://bringatrailer.com/wp-content/uploads/2026/03/2004_bmw_325i-sedan_img_0871-50064.jpeg,,"This 2004 BMW 325i sedan has 58k miles and is finished in Silver Grey Metallic over black leather. Power comes from a 2.5-liter inline-six paired with a five-speed automatic transmission, and the car… [+1909 chars]",,"2004 BMW 325i Limousine ohne Reserve. Diese BMW 325i-Limousine aus dem Jahr 2004 hat eine Laufleistung von 58.000 Meilen und ist in Silbergrau-Metallic über schwarzem Leder lackiert. Die Kraft kommt von einem 2,5-Liter-Reihensechszylinder gepaart mit einem Fünfgang-Automatikgetriebe, und das Auto ist mit 16-Zoll-Leichtmetallfelgen, einem Schiebedach, Nebelscheinwerfern und … ausgestattet.","2004 BMW 325i Sedan at No Reserve. This 2004 BMW 325i sedan has 58k miles and is finished in Silver Grey Metallic over black leather. Power comes from a 2.5-liter inline-six paired with a five-speed automatic transmission, and the car is equipped with 16"" alloy wheels, a sunroof, fog lights, t…","2004 BMW 325i Sedan apud No Subsidium. Hoc 2004 BMW 325i sella 58k milia habet et in Argenteo Grey Metallico supra corium nigrum finitur. Potestas ex 2.5-sextro inlineato paribus cum quinque-celeritate transmissio latae sententiae venit, et currus cum 16"" mixturae rotis, solis rotis, solis nebulae luminibus instructus est, t…",2026-04-26 20:32:55+00:00
09d86ff42b78977e52d56c1b6655ef06,2026-04-22T16:50:36Z,+fog alert,bringatrailer.com,en,0.3,2023 Alfa Romeo Giulia Quadrifoglio,"This 2023 Alfa Romeo Giulia Quadrifoglio is finished in Verde Montreal Tri-Coat over Black leather and is powered by a twin-turbocharged 2.9-liter V6 paired with an eight-speed automatic transmission. Equipment includes the Active Assist Plus Package, 19"" fiv…",https://bringatrailer.com/listing/2023-alfa-romeo-giulia-quadrifoglio-3/,https://bringatrailer.com/wp-content/uploads/2026/01/2023_alfa-romeo_giulia-quadrifoglio_20260122_145415-27664.jpg,,This 2023 Alfa Romeo Giulia Quadrifoglio is finished in Verde Montreal Tri-Coat over Black leather and is powered by a twin-turbocharged 2.9-liter V6 paired with an eight-speed automatic transmission… [+3361 chars],,"2023 Alfa Romeo Giulia Quadrifoglio. Dieser Alfa Romeo Giulia Quadrifoglio aus dem Jahr 2023 ist in Verde Montreal Tri-Coat über schwarzem Leder lackiert und wird von einem 2,9-Liter-V6 mit zwei Turboladern und einem Achtgang-Automatikgetriebe angetrieben. Zur Ausstattung gehören das Active-Assist-Plus-Paket, 19-Zoll-Fünf…","2023 Alfa Romeo Giulia Quadrifoglio. This 2023 Alfa Romeo Giulia Quadrifoglio is finished in Verde Montreal Tri-Coat over Black leather and is powered by a twin-turbocharged 2.9-liter V6 paired with an eight-speed automatic transmission. Equipment includes the Active Assist Plus Package, 19"" fiv…","2023 Alfa Romeo Giulia Quadrifoglio. Hoc 2023 Alfa Romeo Giulia Quadrifoglio in Verde Montreal Tri-coat super corium nigrum consummatum est et a gemino turbocharge- tus est 2.9-sextarius V6 par cum octo velocitate automatic transmissione. Activa adminiculum plus sarcina, 19"" fiv…",2026-04-27 11:41:23+00:00
9373e7716aaf9db467c364c56ca2d883,2026-04-24T09:28:03Z,+fog light,www.homedsgn.com,en,0.7,FOG Architecture Designs a Light-Filled Shanghai Villa for Three Generations,"FOG Architecture renovates a Shanghai villa with curved transitions, tactile materials, and a flexible layout designed for multigenerational living.",https://www.homedsgn.com/fog-architecture-designs-a-light-filled-shanghai-villa-for-three-generations/,https://cdn.homedsgn.com/wp-content/uploads/2026/04/Xijiao-Residence-FOG-Architecture-2.jpg,,"Photography: Zhu Hai
FOG Architecture has designed the interiors of a 500-square-metre villa in Shanghai with a clear focus on how people actually share a homeespecially when its not just one genera… [+3052 chars]",,"FOG Architecture entwirft eine lichtdurchflutete Shanghai-Villa für drei Generationen. FOG Architecture renoviert eine Villa in Shanghai mit geschwungenen Übergängen, haptischen Materialien und einem flexiblen Grundriss, der für das Leben mit mehreren Generationen konzipiert ist.","FOG Architecture Designs a Light-Filled Shanghai Villa for Three Generations. FOG Architecture renovates a Shanghai villa with curved transitions, tactile materials, and a flexible layout designed for multigenerational living.","FOG Architectura excogitat Shanghai Villa levis repleta pro tribus generationibus. FOG Architectura renovat villam Shanghai curvis transitus, materias tangentes, et extensionem flexibilem ad multigenerationem vivendi destinatam.",2026-04-27 16:23:16+00:00
