index,published,keyword,domain,language,valid,title,description,url,image,archive,content,quote,de,en,la,added
03bd4a40e0bba16246ac3495ebe8ce35,2026-04-13T06:00:00Z,+fog climate change,www.naturalnews.com,en,0.3,From brain fog to palpitations: The six warning signs you’re taking too many vitamins,Experts warn routine over-supplementation can cause serious harm like nerve and heart damage. The natural-equals-harmless mindset ignores the body’s limited capacity to process excess. Key risks include fatigue from vitamin D overload and potentially irrevers…,https://www.naturalnews.com/2026-04-13-warning-signs-youre-taking-too-many-vitamins.html,https://www.naturalnews.com/,,<ul><li>Experts warn routine over-supplementation can cause serious harm like nerve and heart damage.</li><li>The natural-equals-harmless mindset ignores the body's limited capacity to process excess… [+5082 chars],,"Von Gehirnnebel bis Herzklopfen: Die sechs Warnsignale dafür, dass Sie zu viele Vitamine einnehmen. Experten warnen davor, dass eine routinemäßige Überdosierung ernsthafte Schäden wie Nerven- und Herzschäden verursachen kann. Die Denkweise „Natürlich ist gleich harmlos“ ignoriert die begrenzte Fähigkeit des Körpers, Überschüsse zu verarbeiten. Zu den Hauptrisiken gehören Müdigkeit aufgrund einer Vitamin-D-Überladung und möglicherweise irreversible…",From brain fog to palpitations: The six warning signs you’re taking too many vitamins. Experts warn routine over-supplementation can cause serious harm like nerve and heart damage. The natural-equals-harmless mindset ignores the body’s limited capacity to process excess. Key risks include fatigue from vitamin D overload and potentially irrevers…,Ex nebula cerebri ad palpitationes: Sex signa praemonitoria nimis multos vitamins capis. Periti monent exercitationes super-supplementum grave damnum inferre sicut nervus et cor damnum inferre possunt. Naturalis-aequales-quaestae innoxiae facultatem limitatam corporis ignorat processus excessus. Key periculum includit lassitudinem Vitaminum D cultro et potentia irreversores…,2026-04-14 16:03:47+00:00
cc70d66814af36d5b7a98b073a584a02,2026-04-03T15:43:53Z,+fog warning system,github.com,en,0.8,Show HN: I built a PHP-to-native compiler (written in Rust); now it runs DOOM,"Because obviously the first logical step after compiling PHP to ARM64 was rendering DOOM with it.It renders DOOM E1M1 in real-time. BSP traversal, perspective projection, distance fog, sector lighting, collision detection, step climbing - all PHP, compiled to…",https://github.com/illegalstudio/elephc,https://opengraph.githubassets.com/17ea00ba1955090a7d3b53162a879a9846ac8b8f56c1bf6c1793bf7fab816019/illegalstudio/elephc,,"A PHP-to-native compiler. Takes a subset of PHP and compiles it directly to ARM64 assembly, producing standalone macOS binaries. No interpreter, no VM, no runtime dependencies.
If you like the idea … [+17534 chars]",,"Show HN: Ich habe einen PHP-zu-native-Compiler erstellt (geschrieben in Rust); Jetzt läuft DOOM. Denn offensichtlich war der erste logische Schritt nach dem Kompilieren von PHP zu ARM64 das Rendern von DOOM damit. Es rendert DOOM E1M1 in Echtzeit. BSP-Durchquerung, perspektivische Projektion, Distanznebel, Sektorbeleuchtung, Kollisionserkennung, Stufenklettern – alles PHP, kompiliert nach…","Show HN: I built a PHP-to-native compiler (written in Rust); now it runs DOOM. Because obviously the first logical step after compiling PHP to ARM64 was rendering DOOM with it.It renders DOOM E1M1 in real-time. BSP traversal, perspective projection, distance fog, sector lighting, collision detection, step climbing - all PHP, compiled to…","Ostende HN: aedificavi compilator PHP-ad-nativum (scriptum Rust); nunc decurrit exitio. Quia nimirum primus gressus logicus postquam PHP ad ARM4 componens cum eo FATUM reddebat. FATUM E1M1 in real-time reddit. BSP traversal, prospectus proiectio, distantia nebula, sector illuminationis, deprehensio collisio, gradus ascensus - omnia PHP, compilata sunt…",2026-04-14 20:46:20+00:00
5738d7a3b636006002ab5f3038f658b8,2026-04-07T02:45:00Z,+fog slow down,www.drive.com.au,en,0.3,The crucial road rules Aussie drivers keep ignoring,"While most instructors teach you the basic road rules in Australia, these are some of the lesser-known laws that could get you in trouble.",https://www.drive.com.au/caradvice/the-crucial-road-rules-aussie-drivers-keep-ignoring/,"https://media.drive.com.au/obj/tx_q:70,rs:auto:1920:1080:1/driveau/upload/cms/uploads/9173ff01-cbf3-59ca-aaff-1ed01fa50000",,"Daytime running lights are cool. Fog lights are not. Sorry, but they really arent. Unless, of course, its actually foggy, but when theyre on during non-foggy weather, their downward projection means … [+73 chars]",,"Die entscheidenden Verkehrsregeln, die australische Autofahrer immer wieder ignorieren. Während die meisten Lehrer Ihnen die grundlegenden Verkehrsregeln in Australien beibringen, sind dies einige der weniger bekannten Gesetze, die Sie in Schwierigkeiten bringen könnten.","The crucial road rules Aussie drivers keep ignoring. While most instructors teach you the basic road rules in Australia, these are some of the lesser-known laws that could get you in trouble.","Via publica regulae Aussie rectoribus atrox neglectis custodiunt. Dum plerique praeceptores te docent regulas fundamentales in Australia via, hae sunt quaedam de legibus minoribus notis quae te in tribulatione consequi possent.",2026-04-15 06:30:16+00:00
7042aec941112ce2519a42a9d7ee40ef,2026-04-07T08:40:29Z,+fog slow down,www.defenseone.com,en,0.3,"As aircraft losses mount, Pentagon wants a software fix to see through the fog of war",The Defense Department is looking to update how older planes see each other and absorb data.,https://www.defenseone.com/technology/2026/04/aircraft-losses-mount-pentagon-wants-software-fix-see-through-fog-war/412667/,https://cdn.defenseone.com/media/img/cd/2026/04/07/9559209/open-graph.jpg,http://web.archive.org/web/20260408065030/https://www.defenseone.com/technology/2026/04/aircraft-losses-mount-pentagon-wants-software-fix-see-through-fog-war/412667/,The U.S. planes that have gone down in the Middle East since the launch of Operation Epic Fury all lacked the same thing: a common operating picture that includes relevant intelligence and data. The … [+3208 chars],,"Da die Flugzeugverluste zunehmen, möchte das Pentagon eine Softwarekorrektur durchführen, um den Nebel des Krieges zu durchschauen. Das Verteidigungsministerium möchte die Art und Weise aktualisieren, wie ältere Flugzeuge sich gegenseitig sehen und Daten absorbieren.","As aircraft losses mount, Pentagon wants a software fix to see through the fog of war. The Defense Department is looking to update how older planes see each other and absorb data.","Cum damna aircraft conscendunt, Pentagonum vult programmatum figere per nebulam belli videre. Defensionis Department quaerit renovare quomodo plana maiora se mutuo videant et data trahant.",2026-04-15 06:30:16+00:00
f779998bef840bfbb282ae87aefa76c5,2026-04-10T05:55:23Z,+fog weather,www.israelnationalnews.com,en,0.8,"Cool, rainy weekend followed by shift to hot and dry weather","Today will be rainy in the north with strong winds and fog. At the start of the week temperatures will drop, followed by a sharp rise and warmer-than-usual conditions.",https://www.israelnationalnews.com/news/425282,https://2.a7.org/files/pictures/000/1214745.jpg,,"The weather in the coming days will be changeable, with rain in the north and a drop in temperatures at the beginning of the week, followed by significant warming and even hotter and drier conditions… [+1185 chars]",,"Kühles, regnerisches Wochenende, gefolgt von einem Übergang zu heißem und trockenem Wetter. Heute wird es im Norden regnerisch mit starkem Wind und Nebel. Zu Beginn der Woche werden die Temperaturen sinken, gefolgt von einem starken Anstieg und wärmeren Bedingungen als üblich.","Cool, rainy weekend followed by shift to hot and dry weather. Today will be rainy in the north with strong winds and fog. At the start of the week temperatures will drop, followed by a sharp rise and warmer-than-usual conditions.","Frigus, volutpat pluviosum sequitur mutationem in calidum et siccitatem. Hodie pluviæ in aquilone erunt cum ventis validis et nebula. Initio hebdomadis temperaturae stillabunt, post ortum acrem et calidiores condiciones usitatas.",2026-04-15 06:30:16+00:00
61c3cff11577aeba2ee42869ca61fc60,2026-04-04T17:50:07Z,+fog light,bringatrailer.com,en,0.8,2006 Maserati GranSport Coupe,"This 2006 Maserati GranSport coupe is a Blu Nettuno Metallizzato over Blu Navy leather example and is powered by a 4.2-liter V8 connected to a Cambiocorsa six-speed automated transaxle. The car is equipped with xenon headlights with washers, fog lights, 19"" F…",https://bringatrailer.com/listing/2006-maserati-gransport-coupe-18/,https://bringatrailer.com/wp-content/uploads/2026/03/2006_maserati_gransport-coupe_8u1a7639-06604.jpg,,This 2006 Maserati GranSport coupe is a Blu Nettuno Metallizzato over Blu Navy leather example and is powered by a 4.2-liter V8 connected to a Cambiocorsa six-speed automated transaxle. The car is eq… [+1886 chars],,"2006 Maserati GranSport Coupé. Dieses Maserati GranSport-Coupé aus dem Jahr 2006 ist ein Exemplar mit Blu Nettuno Metallizzato über Blu Navy-Leder und wird von einem 4,2-Liter-V8 angetrieben, der mit einem Cambiocorsa-Sechsgang-Automatikgetriebe verbunden ist. Das Auto ist mit Xenon-Scheinwerfern mit Scheibenwaschanlage, Nebelscheinwerfern, 19-Zoll-F… ausgestattet.","2006 Maserati GranSport Coupe. This 2006 Maserati GranSport coupe is a Blu Nettuno Metallizzato over Blu Navy leather example and is powered by a 4.2-liter V8 connected to a Cambiocorsa six-speed automated transaxle. The car is equipped with xenon headlights with washers, fog lights, 19"" F…","MMVI Maserati GranSport Coupe. Hoc MMVI Maserati GranSport coufe est exemplum coriarii Blu Nettuno Metallizzato super Blu Navy et potens est 4.2-liter V8 cum Cambiocorsa sex velocitate transaxo automated coniuncta. Raeda instructa xenonis ornamentis cum washers, lumina nebula, 19 ""F...",2026-04-15 10:55:15+00:00
4563e80fb3fa6c810cb440be7e5bcff9,2026-04-06T17:50:06Z,+fog climate change,bringatrailer.com,en,0.8,48k-Mile 2018 Subaru WRX STi at No Reserve,"This 2018 Subaru WRX STi has 48k miles following history in Oregon, and it was acquired by the seller in 2018. The Pure Red exterior was modified with a Seibon carbon-fiber splitter and grille, Morimoto fog lights, STi side skirts, a rear diffuser, and wing s…",https://bringatrailer.com/listing/2018-subaru-wrx-sti-26/,https://bringatrailer.com/wp-content/uploads/2026/03/2018_subaru_wrx-sti_f52a2f8b-611a-4575-87d4-d8bedd190b2c_1_105_c-80066.jpeg,,"This 2018 Subaru WRX STi has 48k miles following history in Oregon, and it was acquired by the seller in 2018. The Pure Red exterior was modified with a Seibon carbon-fiber splitter and grille, Morim… [+3674 chars]",,"48.000-Meilen-2018-Subaru-WRX-STi ohne Reserve. Dieser 2018 Subaru WRX STi hat eine Laufleistung von 48.000 Meilen in Oregon und wurde 2018 vom Verkäufer erworben. Das Pure Red-Äußere wurde mit einem Seibon-Carbonfaser-Splitter und -Kühlergrill, Morimoto-Nebelscheinwerfern, STi-Seitenschwellern, einem Heckdiffusor und Kotflügeln modifiziert.","48k-Mile 2018 Subaru WRX STi at No Reserve. This 2018 Subaru WRX STi has 48k miles following history in Oregon, and it was acquired by the seller in 2018. The Pure Red exterior was modified with a Seibon carbon-fiber splitter and grille, Morimoto fog lights, STi side skirts, a rear diffuser, and wing s…","48k-Mile 2018 Subaru WRX STi ad No Subsidium. Hoc 2018 Subaru WRX STi habet 48k milia passuum sequentem historiam in Oregon, et a venditore acquisita est anno 2018. Murum rubrum exterius mutatum est cum Seibon carbon-fibra phistae et crate, nebula Morimoto luminum, STi fimbriarum lateralium, posterioris diffundentis, et cornu s…",2026-04-15 20:42:18+00:00
