index,published,keyword,domain,language,valid,title,description,url,image,archive,content,quote,de,en,la,added
a2cb32a026d997aecacbc8e662a379af,2025-12-01T19:49:28Z,+fog weather,abcnews.go.com,en,0.8,Heavy snow predicted for Northeast as Midwest still struggles with Thanksgiving weather snarls,"Black ice, snow showers and fog are pestering post-holiday travelers in the Midwest, while the Northeast is gearing up for its first major snowstorm of the season",https://abcnews.go.com/US/wireStory/heavy-snow-predicted-northeast-midwest-struggles-thanksgiving-weather-128007501,https://i.abcnewsfe.com/a/cf3ce126-0740-4e17-84d6-12897102c52c/wirestory_24679420305b7bd6b15cae1423219992_16x9.jpg?w=1600,,"PORTLAND, Maine -- Black ice, snow showers and fog pestered post-holiday travelers in the Midwest on Monday while the Northeast geared up for its first major snowstorm of the season.
More than 8 inc… [+4411 chars]",,"Für den Nordosten wird heftiger Schneefall vorhergesagt, während der Mittlere Westen immer noch mit den Wetterproblemen an Thanksgiving zu kämpfen hat. Glatteis, Schneeschauer und Nebel plagen Reisende nach dem Urlaub im Mittleren Westen, während sich der Nordosten auf den ersten großen Schneesturm der Saison vorbereitet","Heavy snow predicted for Northeast as Midwest still struggles with Thanksgiving weather snarls. Black ice, snow showers and fog are pestering post-holiday travelers in the Midwest, while the Northeast is gearing up for its first major snowstorm of the season","Gravis nix praenuntiata ad Orientem orientis sicut Midwest adhuc cum Gratiarum actione tempestatum obtrectat. Glacies nigra, imbres nivis et nebula post ferias viatores in Midwest infestant, dum Orientem brumalem ad primam maiorem nivem temporis anni machinatur.",2025-12-03 20:18:52+00:00
748bae7b22f15835c73f3af135405c89,2025-12-01T04:57:41Z,+fog weather,economictimes.indiatimes.com,en,0.8,"Weather update: IMD warns of cold conditions in Punjab, Maharashtra; dense fog predictions in Odisha and Manipur. Check full prediction","Weather Update today: Cold wave conditions are likely to grip Punjab and Maharashtra and dense fog conditions are likely to prevail in Odisha, Manipur on December 1, the IMD has said in its latest weather bulletin. Due to the cyclonic storm Ditwah, Tamil Nadu…",https://economictimes.indiatimes.com/news/new-updates/weather-today-imd-warns-of-cold-conditions-in-punjab-maharashtra-dense-fog-predictions-in-odisha-and-manipur-check-full-prediction/articleshow/125685635.cms,"https://img.etimg.com/thumb/msid-125685687,width-1200,height-630,imgsize-63040,overlay-economictimes/articleshow.jpg",,The India Meteorological Department (IMD) has predicted dense fog conditions during early hours in Manipur and Odisha on Monday. Cold wave conditions are also likely to grip Madhya Maharashtra and Pu… [+2764 chars],,"Wetter-Update: IMD warnt vor kalten Bedingungen in Punjab, Maharashtra; Vorhersagen für dichten Nebel in Odisha und Manipur. Überprüfen Sie die vollständige Vorhersage. Wetter-Update heute: Kältewellen werden wahrscheinlich Punjab und Maharashtra heimsuchen und am 1. Dezember dürfte in Odisha, Manipur, dichter Nebel vorherrschen, teilte das IMD in seinem neuesten Wetterbulletin mit. Aufgrund des Zyklons Ditwah, Tamil Nadu…","Weather update: IMD warns of cold conditions in Punjab, Maharashtra; dense fog predictions in Odisha and Manipur. Check full prediction. Weather Update today: Cold wave conditions are likely to grip Punjab and Maharashtra and dense fog conditions are likely to prevail in Odisha, Manipur on December 1, the IMD has said in its latest weather bulletin. Due to the cyclonic storm Ditwah, Tamil Nadu…","Tempestas renovatio: IMD condiciones frigidas in Punjab, Maharashtra monet; densa nebula praedictiones in Odisha et Manipur. Compesce plenum vaticinium. Tempestas Renovatio hodie: condiciones frigidae fluctus Punjab et Maharashtra et densae nebulae condiciones verisimile sunt in Odisha, Manipur die 1 Decembris, IMD dixit in sua novissima tempestate bulletin. Ob tempestatem cyclonicae Ditwah, Tamil Nadu ...",2025-12-05 20:17:36+00:00
f7a8d36e051e53cbe0480e875c0827bd,2025-12-02T08:11:06Z,+fog alert,economictimes.indiatimes.com,en,0.8,"NHAI, Reliance Jio join hands for highway safety alert system","The National Highways Authority of India is partnering with Reliance Jio. They will introduce a new safety alert system for national highways. Travelers will receive mobile warnings about accident zones, fog, and diversions. This aims to improve road safety b…",https://economictimes.indiatimes.com/industry/telecom/telecom-news/nhai-reliance-jio-join-hands-for-highway-safety-alert-system/articleshow/125713699.cms,"https://img.etimg.com/thumb/msid-125713689,width-1200,height-630,imgsize-36994,overlay-economictimes/articleshow.jpg",,The National Highways Authority of India (NHAI) has signed a Memorandum of Understanding (MoU) with Reliance Jio to introduce a telecom-based safety alert system across the national highway network. … [+1917 chars],,"NHAI und Reliance Jio arbeiten gemeinsam an einem Warnsystem für die Verkehrssicherheit. Die National Highways Authority of India arbeitet mit Reliance Jio zusammen. Sie werden ein neues Sicherheitswarnsystem für Nationalstraßen einführen. Reisende werden mobil vor Unfallstellen, Nebel und Umleitungen gewarnt. Ziel ist die Verbesserung der Verkehrssicherheit durch …","NHAI, Reliance Jio join hands for highway safety alert system. The National Highways Authority of India is partnering with Reliance Jio. They will introduce a new safety alert system for national highways. Travelers will receive mobile warnings about accident zones, fog, and diversions. This aims to improve road safety b…","NHAI, Fiducia Jio iungere manus ad salutem viarum ratio intenti. Auctoritas Nationalis Highways Indiae cum Reliance Jio communicat. Novam salutis rationem in viis nationalibus intentam inducent. Viatores mobiles admonitiones circa zonas casus, nebulas et diversoria recipient. Hoc tendit ad meliorem viam salutem b ...",2025-12-06 01:05:58+00:00
3cd77ea0e41e76220e3b8aa0a9eb7253,2025-12-02T09:47:21Z,+fog accident,economictimes.indiatimes.com,en,0.8,NHAI signs MoU with Reliance Jio to send safety alerts to its users,"Under the telecom-based safety alert system, Jio users traveling on national highways will receive advance warnings on their mobile phones as they approach identified risk locations such as accident-prone stretches, stray-cattle zones, fog-affected areas and …",https://economictimes.indiatimes.com/industry/telecom/telecom-news/nhai-signs-mou-with-reliance-jio-to-send-safety-alerts-to-its-users/articleshow/125715398.cms,"https://img.etimg.com/thumb/msid-125715498,width-1200,height-630,imgsize-26724,overlay-economictimes/articleshow.jpg",,The National Highways Authority of India (NHAI) has signed a memorandum of understanding (MoU) with Reliance Jio to introduce a telecom-based safety alert system across the countrys national highway … [+1584 chars],,"NHAI unterzeichnet Absichtserklärung mit Reliance Jio, um Sicherheitswarnungen an seine Benutzer zu senden. Im Rahmen des telekommunikationsbasierten Sicherheitswarnsystems erhalten Jio-Benutzer, die auf Nationalstraßen unterwegs sind, Vorwarnungen auf ihren Mobiltelefonen, wenn sie sich identifizierten Risikoorten wie unfallgefährdeten Strecken, Streuviehzonen, Nebelgebieten usw. nähern.","NHAI signs MoU with Reliance Jio to send safety alerts to its users. Under the telecom-based safety alert system, Jio users traveling on national highways will receive advance warnings on their mobile phones as they approach identified risk locations such as accident-prone stretches, stray-cattle zones, fog-affected areas and …","NHAI signa MoU cum Reliance Jio mittere salutem summis suis utentibus. Sub telecom-substructio securitatis ratio intenti, Jio utentes iter in viis nationalibus accipient admonitiones in telephoniis mobiles accedunt, quae periculum locorum accedunt, qualia sunt extensiones casus-proni, zonae errantium, regiones nebulae affectae et ...",2025-12-06 01:05:58+00:00
8b6523677e445cdf936fba48a4b91787,2025-12-02T18:20:18Z,+fog alert,economictimes.indiatimes.com,en,0.8,NHAI ties up with Jio for road safety alerts,"National Highways Authority of India and Reliance Jio are partnering to launch a new safety alert system. Jio users on national highways will receive advance warnings on their phones. These alerts will cover accident-prone areas, stray cattle zones, fog-affec…",https://economictimes.indiatimes.com/industry/telecom/telecom-news/nhai-ties-uup-with-jio-for-road-safety-alerts/articleshow/125725444.cms,"https://img.etimg.com/thumb/msid-125725590,width-1200,height-630,imgsize-40050,overlay-economictimes/articleshow.jpg",,"Investment Ideas
Grow your wealth with stock ideas &amp; sectoral trends.
Stock Reports Plus
Buy low &amp; sell high with access to Stock Score, Upside potential &amp; more. 
BigBull Portfolio
G… [+439 chars]",,"NHAI arbeitet mit Jio für Verkehrssicherheitswarnungen zusammen. Die National Highways Authority of India und Reliance Jio arbeiten gemeinsam an der Einführung eines neuen Sicherheitswarnsystems. Jio-Benutzer auf Nationalstraßen erhalten Vorwarnungen auf ihren Telefonen. Diese Warnungen decken unfallgefährdete Gebiete, Gebiete mit streunenden Rindern, Nebelgebiete usw. ab.","NHAI ties up with Jio for road safety alerts. National Highways Authority of India and Reliance Jio are partnering to launch a new safety alert system. Jio users on national highways will receive advance warnings on their phones. These alerts will cover accident-prone areas, stray cattle zones, fog-affec…","NHAI alligat cum Jio ad iter salutis summis. Patriae Highways Auctoritati Indiae et Fiduciae Jio Socii sunt ut novam rationem salutis intenti exerceant. Jio utentes in viis nationalibus monita in suis telephoniis antecessum accipient. Hae arcus fortuito prono operient regiones, zonas iumentorum errant, nebulas affligunt...",2025-12-06 01:05:58+00:00
b5fae6ca227146d26d4b875f40f68d88,2025-12-01T20:30:14Z,+fog climate change,bringatrailer.com,en,0.8,2007 Lexus SC430 at No Reserve,"This 2007 Lexus SC430 is finished in Obsidian over Camel leather and is powered by a 4.3-liter V8 linked to a six-speed automatic transmission. Equipment includes a power-retractable hardtop, a rear spoiler, HID headlights, fog lights, 18"" five-spoke alloy wh…",https://bringatrailer.com/listing/2007-lexus-sc430-21/,https://bringatrailer.com/wp-content/uploads/2025/11/2007_lexus_sc430_sc430-7-96497.jpg,,"This 2007 Lexus SC430 is finished in Obsidian over Camel leather and is powered by a 4.3-liter V8 linked to a six-speed automatic transmission. Equipment includes a power-retractable hardtop, a rear … [+2418 chars]",,"2007 Lexus SC430 ohne Reserve. Dieser Lexus SC430 von 2007 ist in Obsidian über Kamelleder gehalten und wird von einem 4,3-Liter-V8 angetrieben, der mit einem Sechsgang-Automatikgetriebe verbunden ist. Zur Ausstattung gehören ein elektrisch versenkbares Hardtop, ein Heckspoiler, HID-Scheinwerfer, Nebelscheinwerfer, 18-Zoll-Fünfspeichen-Leichtmetallfelgen …","2007 Lexus SC430 at No Reserve. This 2007 Lexus SC430 is finished in Obsidian over Camel leather and is powered by a 4.3-liter V8 linked to a six-speed automatic transmission. Equipment includes a power-retractable hardtop, a rear spoiler, HID headlights, fog lights, 18"" five-spoke alloy wh…","2007 Lexus SC430 apud No Subsidium. Lexus SC430 hoc 2007 in Obsidian super Camel corium finitur et per 4.3 sextarium V8 coniungitur cum sex velocitate latae transmissionis. Apparatus vim retractabilem hardtop includit, posterior vastator, latebra capita lucis, nebula lumina, 18 ""quinque-aminus wh…",2025-12-08 20:18:05+00:00
5d83e42919300dd2d226e597d504aaa7,2025-12-04T23:25:13Z,+fog accident,bringatrailer.com,en,0.8,38k-Mile 2001 Lotus Esprit V8,"This 2001 Lotus Esprit V8 is finished in Mustard Yellow over black leather upholstery and is powered by a twin-turbocharged 3.5-liter V8 paired with a five-speed manual transaxle. Equipment includes 18"" multi-piece HRE wheels, pop-up headlights, fog lights, a…",https://bringatrailer.com/listing/2001-lotus-esprit-v8-6/,https://bringatrailer.com/wp-content/uploads/2025/11/DSC04249-02036-scaled.jpg,,This 2001 Lotus Esprit V8 is finished in Mustard Yellow over black leather upholstery and is powered by a twin-turbocharged 3.5-liter V8 paired with a five-speed manual transaxle. Equipment includes … [+1605 chars],,"38.000 Meilen 2001 Lotus Esprit V8. Dieser Lotus Esprit V8 von 2001 ist in Senfgelb lackiert und hat eine schwarze Lederpolsterung. Angetrieben wird er von einem 3,5-Liter-V8 mit zwei Turboladern und einem Fünfgang-Schaltgetriebe. Zur Ausstattung gehören mehrteilige 18-Zoll-HRE-Räder, Klappscheinwerfer, Nebelscheinwerfer, ein…","38k-Mile 2001 Lotus Esprit V8. This 2001 Lotus Esprit V8 is finished in Mustard Yellow over black leather upholstery and is powered by a twin-turbocharged 3.5-liter V8 paired with a five-speed manual transaxle. Equipment includes 18"" multi-piece HRE wheels, pop-up headlights, fog lights, a…","38k-Mile 2001 Lotus Esprit V8. Hoc 2001 Lotus Esprit V8 in Sinapi Crocus supra upholstery corium nigrum finitur et per 3.5-liter V8 geminatum cum transaxlo manuali velocitate concluditur. Apparatu comprehendit 18"" rotae multi-partii HRE, pop- sursum luces, lumina nebula, a ...",2025-12-09 01:08:57+00:00
7e10149017fc65160f3939ec933551dd,2025-12-01T18:06:32Z,+fog weather,www.bostonherald.com,en,0.8,Heavy snow predicted for Northeast as Midwest still struggles with Thanksgiving weather snarls,"Black ice, snow showers and fog are pestering post-holiday travelers in the Midwest.",https://www.bostonherald.com/2025/12/01/weather-post-thanksgiving-travel/,https://www.bostonherald.com/wp-content/uploads/2025/12/Extreme_Weather_Chicago_74102-1.jpg?w=1024&h=768,,"By PATRICK WHITTLE and ADAM SCHRECK
PORTLAND, Maine (AP) Black ice, snow showers and fog pestered post-holiday travelers in the Midwest on Monday while the Northeast geared up for its first major sn… [+4434 chars]",,"Für den Nordosten wird heftiger Schneefall vorhergesagt, während der Mittlere Westen immer noch mit den Wetterproblemen an Thanksgiving zu kämpfen hat. Glatteis, Schneeschauer und Nebel machen Urlaubsreisenden im Mittleren Westen zu schaffen.","Heavy snow predicted for Northeast as Midwest still struggles with Thanksgiving weather snarls. Black ice, snow showers and fog are pestering post-holiday travelers in the Midwest.","Gravis nix praenuntiata ad Orientem orientis sicut Midwest adhuc cum Gratiarum actione tempestatum obtrectat. Glacies nigra, imbres et nebulae nives post ferias viatores in Midwest infestant.",2025-12-11 01:11:40+00:00
75e33a28102bc13e7592de51729ff8aa,2025-12-08T03:21:36Z,+fog flights,economictimes.indiatimes.com,en,0.8,"IndiGo operations hit for second week, with large-scale cancellations at Hyderabad, Mumbai and Delhi","IndiGo faced significant flight disruptions in Hyderabad, impacting 77 flights, with ongoing issues in Mumbai and Delhi. The DGCA urged pilot cooperation amid rising operational pressures from weather and demand. As the fog and holiday season approach, the re…",https://economictimes.indiatimes.com/industry/transportation/airlines-/-aviation/indigo-operations-hit-for-second-week-with-large-scale-cancellations-at-hyderabad-mumbai-and-delhi/articleshow/125825308.cms,"https://img.etimg.com/thumb/msid-125825290,width-1200,height-630,imgsize-86392,overlay-economictimes/articleshow.jpg",,IndiGo operations at Hyderabad faced major disruption on Monday with 77 flights affected 38 arrivals and 39 departures according to airport authorities. The impact of cancellations and delays continu… [+2650 chars],,"Der Betrieb von IndiGo ist in der zweiten Woche beeinträchtigt, mit großflächigen Annullierungen in Hyderabad, Mumbai und Delhi. IndiGo war in Hyderabad mit erheblichen Flugstörungen konfrontiert, die sich auf 77 Flüge auswirkten, mit anhaltenden Problemen in Mumbai und Delhi. Die DGCA drängte auf die Zusammenarbeit der Piloten angesichts des steigenden Betriebsdrucks aufgrund von Wetter und Nachfrage. Wenn der Nebel und die Ferienzeit näher rückt, wird die …","IndiGo operations hit for second week, with large-scale cancellations at Hyderabad, Mumbai and Delhi. IndiGo faced significant flight disruptions in Hyderabad, impacting 77 flights, with ongoing issues in Mumbai and Delhi. The DGCA urged pilot cooperation amid rising operational pressures from weather and demand. As the fog and holiday season approach, the re…","Indicum operationes septimana secundae percussae, magnis cancellationibus Hyderabad, Mumbai et Delhi percussi. Indicum versis perturbationibus fugae significantibus in Hyderabad, 77 volatus impacto, cum permanentibus quaestionibus in Mumbai et Delhi. DGCA gubernatorem cooperationem inter pressuras operationales a tempestate et postulatione surgentes suasit. Ut nebula et tempus feriatum accedunt, re...",2025-12-11 10:18:43+00:00
79ecea41f6c05e1b5493e7d6b395c0ca,2025-12-09T18:09:38Z,+fog light,economictimes.indiatimes.com,en,0.8,"Air India to deploy specialised crew, aircraft to mitigate fog-related flight disruptions","Aviation regulator DGCA has announced December 10 to February 10 next year as the official fog window during this winter. The northern parts of India, including Air India's primary hub, Delhi, experience low visibility due to dense fog, with a potential to ha…",https://economictimes.indiatimes.com/industry/transportation/airlines-/-aviation/air-india-to-deploy-specialised-crew-aircraft-to-mitigate-fog-related-flight-disruptions/articleshow/125875462.cms,"https://img.etimg.com/thumb/msid-125875487,width-1200,height-630,imgsize-36250,overlay-economictimes/articleshow.jpg",,"To mitigate flight disruptions during the impending fog season, Tata Group-owned Air India on Tuesday said it has taken various measures, including rostering crew trained to operate in low-visibility… [+2849 chars]",,"Air India wird spezialisierte Besatzungsmitglieder und Flugzeuge einsetzen, um nebelbedingte Flugunterbrechungen abzumildern. Die Luftfahrtaufsichtsbehörde DGCA hat den 10. Dezember bis 10. Februar nächsten Jahres als offizielles Nebelfenster für diesen Winter angekündigt. In den nördlichen Teilen Indiens, einschließlich des Hauptdrehkreuzes von Air India, Delhi, ist die Sicht aufgrund des dichten Nebels schlecht und es besteht die Gefahr, dass es zu …","Air India to deploy specialised crew, aircraft to mitigate fog-related flight disruptions. Aviation regulator DGCA has announced December 10 to February 10 next year as the official fog window during this winter. The northern parts of India, including Air India's primary hub, Delhi, experience low visibility due to dense fog, with a potential to ha…","Aeris India ad turbas specialitas explicandas, aircraft disruptiones fugae relatas ad levandas nebulas. Aviation moderator DGCA denuntiavit Decembrem 10 ad diem 10 Februarii anni proximi sicut fenestra nebula officialis hac hieme. Septentrionales Indiae partes, inter centrum primarium Aeris Indiae, Delhi, ob densam nebulam visibilitatem inferiorem sentiunt, cum potentia ad ha…",2025-12-11 10:18:43+00:00
028a2746f9822ba43443c13664e26273,2025-12-08T16:53:17Z,+fog flights,www.wsbtv.com,en,0.8,"Delta customers, including a Braves legend, express frustrations over delays",Hundreds of Delta Air Lines flights experienced significant delays or cancellations on Sunday as Hartsfield-Jackson Atlanta International Airport experienced heavy fog conditions.,https://www.wsbtv.com/news/local/delta-customers-express-frustrations-over-delays-including-braves-legend/FISO4IJO4VCNBBWU2SRGKBTFNA/,https://cmg-cmg-tv-10010-prod.cdn.arcpublishing.com/resizer/v2/https%3A%2F%2Fcloudfront-us-east-1.images.arcpublishing.com%2Fcmg%2FZ5DWGPTMKZA5BOMGBLGY4RW5CE.jpeg?auth=854053d2e5a753f0fe99be178862f6d8eecab8cb9da95717f3f12b0f6d530274&width=1200&height=630&smart=true,,"ATLANTA — Hundreds of Delta Air Lines flights experienced significant delays or cancellations on Sunday as Hartsfield-Jackson Atlanta International Airport experienced heavy fog conditions.
One of t… [+1666 chars]",,"Delta-Kunden, darunter eine Braves-Legende, äußern ihre Frustration über Verzögerungen. Bei Hunderten von Flügen der Delta Air Lines kam es am Sonntag zu erheblichen Verspätungen oder Annullierungen, da am Hartsfield-Jackson Atlanta International Airport starker Nebel herrschte.","Delta customers, including a Braves legend, express frustrations over delays. Hundreds of Delta Air Lines flights experienced significant delays or cancellations on Sunday as Hartsfield-Jackson Atlanta International Airport experienced heavy fog conditions.","Delta clientium, incluso legenda Braves, frustrationes per moras exprimunt. Volatus Centum Delta Airlines periti significant moras vel cancellationes die Dominico, sicut Hartsfield-Jackson Atlanta International Airport condiciones nebulas graves expertus est.",2025-12-14 15:14:57+00:00
7546ef604d9f427caaeec5af64c57539,2025-12-11T23:25:09Z,+fog weather,bringatrailer.com,en,0.8,2024 Toyota 4Runner SR5,"This 2024 Toyota 4Runner SR5 is finished in Underground over black and gray upholstery, and it is powered by a 4.0-liter V6 paired with a five-speed automatic transmission and a limited-slip differential. Equipment includes 17"" alloy wheels, LED lighting, fog…",https://bringatrailer.com/listing/2024-toyota-4runner-3/,https://bringatrailer.com/wp-content/uploads/2025/11/2024_toyota_4runner_img_0838-14449.jpeg,,"This 2024 Toyota 4Runner SR5 is finished in Underground over black and gray upholstery, and it is powered by a 4.0-liter V6 paired with a five-speed automatic transmission and a limited-slip differen… [+2001 chars]",,"2024 Toyota 4Runner SR5. Dieser Toyota 4Runner SR5 aus dem Jahr 2024 ist in Underground mit schwarzen und grauen Polstern lackiert und wird von einem 4,0-Liter-V6 angetrieben, gepaart mit einem Fünfgang-Automatikgetriebe und einem Sperrdifferenzial. Zur Ausstattung gehören 17-Zoll-Leichtmetallfelgen, LED-Beleuchtung, Nebelscheinwerfer …","2024 Toyota 4Runner SR5. This 2024 Toyota 4Runner SR5 is finished in Underground over black and gray upholstery, and it is powered by a 4.0-liter V6 paired with a five-speed automatic transmission and a limited-slip differential. Equipment includes 17"" alloy wheels, LED lighting, fog…","2024 Toyota 4Runner SR5. Hoc 2024 Toyota 4Runner SR5 in subterraneis super upholstery nigrum et griseum finitur, et 4.0-liter V6 paribus cum quinque-celeritate transmissionis differentiali et limitato-labii potestatum est. Apparatu continet 17"" rotae mixturae, DUCTUS lucendi, nebulae…",2025-12-15 10:20:28+00:00
ce674fcc33aeab3c95d21f4f76d7d08b,2025-12-15T02:51:11Z,+fog alert,indianexpress.com,en,0.8,Low visibility in Delhi as thick smog engulfs city; AQI breaches 450-mark,"The India Meteorological Department (IMD) also issued an orange alert for fog in several parts of Uttar Pradesh, including Noida and Ghaziabad and urged residents to exercise caution.",https://indianexpress.com/article/cities/delhi/delhi-pollution-air-quality-index-10420696/,https://images.indianexpress.com/2025/12/Opinion-card-5.jpg,,"AQI Delhi Today: Delhi woke up to a thick blanket of smog as the air quality worsened in the national capital on Monday (Dec 15). The Air Quality Index (AQI) stood at 454 at 7 am, reducing the visibi… [+3697 chars]",,"Schlechte Sicht in Delhi, da dichter Smog die Stadt verschlingt; AQI durchbricht die 450er-Marke. Das India Meteorological Department (IMD) gab außerdem in mehreren Teilen von Uttar Pradesh, darunter Noida und Ghaziabad, eine orangefarbene Nebelwarnung heraus und forderte die Bewohner auf, Vorsicht walten zu lassen.","Low visibility in Delhi as thick smog engulfs city; AQI breaches 450-mark. The India Meteorological Department (IMD) also issued an orange alert for fog in several parts of Uttar Pradesh, including Noida and Ghaziabad and urged residents to exercise caution.","Humilis visio in Delhi, quam densissima smog inundat urbem; AQI diruta 450-mark. Indiae Department Meteorologicum (IMD) etiam in pluribus partibus Uttar Pradesh, Noida et Ghaziabad, incolas ad cautelam exercendam hortatus est et intentum nebulae aureum edidit.",2025-12-16 20:19:01+00:00
