index,published,keyword,domain,language,valid,title,description,url,image,archive,content,quote,de,en,la,added
2e406a4fb686e3ceba4fd3380bd02044,2026-05-01T23:30:14Z,+fog light,bringatrailer.com,en,0.8,2007 Ford Mustang Roush Stage 2 5-Speed at No Reserve,"This 2007 Ford Mustang Roush Stage 2 coupe is powered by a 4.6-liter V8 linked to a five-speed manual transmission and is finished in Redfire Metallic over red and black leather upholstery. Equipment includes fog lights, Roush-specific bodywork, white racing …",https://bringatrailer.com/listing/2007-ford-mustang-roush-stage-2-3/,https://bringatrailer.com/wp-content/uploads/2026/04/2007_ford_mustang-roush-stage-2_img_6176-71831.jpeg,,This 2007 Ford Mustang Roush Stage 2 coupe is powered by a 4.6-liter V8 linked to a five-speed manual transmission and is finished in Redfire Metallic over red and black leather upholstery. Equipment… [+2711 chars],,"2007 Ford Mustang Roush Stufe 2 5-Gang ohne Reserve. Dieses 2007er Ford Mustang Roush Stage 2 Coupé wird von einem 4,6-Liter-V8 angetrieben, der mit einem Fünfgang-Schaltgetriebe verbunden ist, und ist in Redfire Metallic lackiert und mit roten und schwarzen Lederpolstern versehen. Zur Ausstattung gehören Nebelscheinwerfer, Roush-spezifische Karosserie, weißes Racing …","2007 Ford Mustang Roush Stage 2 5-Speed at No Reserve. This 2007 Ford Mustang Roush Stage 2 coupe is powered by a 4.6-liter V8 linked to a five-speed manual transmission and is finished in Redfire Metallic over red and black leather upholstery. Equipment includes fog lights, Roush-specific bodywork, white racing …","2007 Ford Mustang Roush Stage 2 5-Mobilitate ad No Subsidium. This 2007 Ford Mustang Roush Stage 2 coupe is powered by a 4.6-liter V8 coniunctum with a five-speed manual transmission and is finished in Redfire Metallic over red and black corium upholstery. Apparatu nebulae lumina includit, corpus specificae rush, racing album ...",2026-05-03 15:41:26+00:00
cd93ef66521b63533b56d084bf925806,2026-05-03T19:08:25Z,+fog weather,gizmodo.com,en,0.3,"Ask.com Is Dead, and I’m Begging Its Owners Not to Bring AskJeeves Back as a Chatbot",Let AskJeeves recede into the fog of millennial nostalgia. Permanently.,https://gizmodo.com/ask-com-is-dead-and-im-begging-its-owners-not-to-bring-askjeeves-back-as-a-chatbot-2000753906,https://gizmodo.com/app/uploads/2026/05/ask-com-dead-1200x675.jpg,,"Ask.com, which was called AskJeeves until twenty years ago, is no more.
You can tell someone didnt really use the internet in the 90s if they say AskJeeves was a big part of online life back then. I… [+2405 chars]",,"Ask.com ist tot und ich flehe seine Besitzer an, AskJeeves nicht wieder als Chatbot einzuführen. Lassen Sie AskJeeves in den Nebel der tausendjährigen Nostalgie eintauchen. Permanent.","Ask.com Is Dead, and I’m Begging Its Owners Not to Bring AskJeeves Back as a Chatbot. Let AskJeeves recede into the fog of millennial nostalgia. Permanently.","Ask.com Mortuus est, et dominis eius Rogo Non ut Chatbotum AskJeeves adducere. Fiat AskJeeves in millennialem nebulam peractorum. Constantius.",2026-05-05 07:14:01+00:00
b4da9e3097d3626b0a106145e6c79797,2026-05-03T16:27:32Z,+fog weather,www.news24.com,en,0.8,News24 | Monday’s weather: Severe thunderstorms in Eastern Cape; isolated showers elsewhere,"Severe thunderstorms with heavy rain, hail and damaging winds are forecast for the Eastern Cape, while morning fog and isolated showers are expected in most parts of the country, according to the South African Weather Service.",https://www.news24.com/southafrica/weather/mondays-weather-severe-thunderstorms-in-eastern-cape-isolated-showers-elsewhere-20260503-0981,https://news24cobalt.24.co.za/resources/02a0-1f65f5496fbe-95a98b7d14d3-1000/format/inline/gettyimages-2164629051.jpeg,,"Severe thunderstorms with heavy rain, hail and damaging winds are forecast for the Eastern Cape, while morning fog and isolated showers are expected in most parts of the country, according to the Sou… [+3927 chars]",,"News24 | Wetter am Montag: Schwere Gewitter im Ostkap; vereinzelte Schauer anderswo. Nach Angaben des südafrikanischen Wetterdienstes werden für das Ostkap schwere Gewitter mit starkem Regen, Hagel und schädlichen Winden vorhergesagt, während in den meisten Teilen des Landes Morgennebel und vereinzelte Schauer zu erwarten sind.","News24 | Monday’s weather: Severe thunderstorms in Eastern Cape; isolated showers elsewhere. Severe thunderstorms with heavy rain, hail and damaging winds are forecast for the Eastern Cape, while morning fog and isolated showers are expected in most parts of the country, according to the South African Weather Service.","News24 | Tempestas Lunae: Gravia tonitrua in Promontorio Orientali; separatim imbres alibi. Promontorium Orientis cum gravibus procellis gravibus pluviis, grandinibus et perniciosis ventis praesagiunt, cum mane nebula et imbres solitarii in plurimis patriae partibus exspectantur, secundum servitii Tempestatis Africae Australis.",2026-05-05 07:14:01+00:00
a5f3c868dec10bf564e95d59df779410,2026-05-06T23:02:51Z,+fog light,bringatrailer.com,en,0.8,2015 Porsche Cayenne Diesel,"This black-over-black 2015 Porsche Cayenne Diesel features a Eurowise suspension lift kit and 17"" Black Rhino wheels along with a Eurowise bull bar, Hella auxiliary lights, and amber fog lights. Power comes from a turbocharged 3.0-liter diesel V6 linked to an…",https://bringatrailer.com/listing/2015-porsche-cayenne-diesel-173/,https://bringatrailer.com/wp-content/uploads/2026/04/2015_porsche_cayenne_025_850_9915_aaronfanselowphoto_w-98448.jpg,,"This black-over-black 2015 Porsche Cayenne Diesel features a Eurowise suspension lift kit and 17″ Black Rhino wheels along with a Eurowise bull bar, Hella auxiliary lights, and amber fog lights. Powe… [+1927 chars]",,"2015 Porsche Cayenne Diesel. Dieser in Schwarz gehaltene Porsche Cayenne Diesel aus dem Jahr 2015 ist mit einem Eurowise-Höherlegungssatz und 17-Zoll-Black-Rhino-Rädern sowie einem Eurowise-Frontschutzbügel, Hella-Zusatzscheinwerfern und bernsteinfarbenen Nebelscheinwerfern ausgestattet. Die Kraft kommt von einem turbogeladenen 3,0-Liter-V6-Diesel, der mit einem…","2015 Porsche Cayenne Diesel. This black-over-black 2015 Porsche Cayenne Diesel features a Eurowise suspension lift kit and 17"" Black Rhino wheels along with a Eurowise bull bar, Hella auxiliary lights, and amber fog lights. Power comes from a turbocharged 3.0-liter diesel V6 linked to an…","2015 Porsche Cayenne Diesel. Haec nigra-super-nigrica 2015 Porsche Cayenne Diesel lineamenta Eurowise suspensio tollunt ornamentum et 17 ""Rotae nigrae Rhinoceros cum vecte tauro Eurowise, Hella lumina auxilia, et lumina nebule electri. Potestas venit ex turbocharged 3.0-liter Diesel V6 coniunctum cum…",2026-05-09 07:04:57+00:00
79a283538912035c60b4d70732213be7,2026-05-12T21:21:29Z,+fog light,bringatrailer.com,en,0.8,2004 Toyota Sequoia SR5 4×4 at No Reserve,"This 2004 Toyota Sequoia SR5 is finished in silver over gray leather and is powered by a 4.7-liter V8 linked with a four-speed automatic transmission, a dual-range transfer case, and a locking center differential. Equipment includes a sunroof, fog lights, 17""…",https://bringatrailer.com/listing/2004-toyota-sequoia-15/,https://bringatrailer.com/wp-content/uploads/2026/05/2004_toyota_sequoia_7387-52969.jpg,,"This 2004 Toyota Sequoia SR5 is finished in silver over gray leather and is powered by a 4.7-liter V8 linked with a four-speed automatic transmission, a dual-range transfer case, and a locking center… [+1752 chars]",,"2004 Toyota Sequoia SR5 4×4 ohne Reserve. Dieser Toyota Sequoia SR5 aus dem Jahr 2004 ist in Silber über grauem Leder gehalten und wird von einem 4,7-Liter-V8 angetrieben, der mit einem Viergang-Automatikgetriebe, einem Zweibereichs-Verteilergetriebe und einem Sperrdifferenzial in der Mitte verbunden ist. Zur Ausstattung gehören ein Schiebedach, Nebelscheinwerfer, 17""…","2004 Toyota Sequoia SR5 4×4 at No Reserve. This 2004 Toyota Sequoia SR5 is finished in silver over gray leather and is powered by a 4.7-liter V8 linked with a four-speed automatic transmission, a dual-range transfer case, and a locking center differential. Equipment includes a sunroof, fog lights, 17""…","2004 Toyota Sequoia SR5 4×4 ad Subsidium No. Hoc 2004 Toyota Sequoia SR5 argento super corium griseum finitur et per 4.7 sextarium V8 coniungitur cum velocitate latae transmissionis quattuor, causa translationis dualis, et centrum differentialis densis. Apparatu sunroof includit, lumina nebula, 17""…",2026-05-14 11:47:27+00:00
3d8f28f04c63a71f351d76aa029af0b2,2026-05-13T04:22:03Z,+fog light,timesofindia.indiatimes.com,en,0.8,"Tata Altroz CNG AMT launched: Price, efficiency & more","In terms of features, the Altroz CNG AMT gets six airbags, and an electronic stability program, 16-inch machine-cut alloys, LED fog lights, a connecting LED light bar at the rear, a 7-inch digital instrument cluster, a sunroof with voice commands, a fast-char…",https://timesofindia.indiatimes.com/auto/cars/tata-altroz-cng-amt-launched-price-efficiency-more/articleshow/131036146.cms,"https://static.toiimg.com/thumb/msid-131036124,width-1280,height-720,imgsize-917976,resizemode-6,overlay-toi_sw,pt-32,y_pad-600/photo.jpg",http://web.archive.org/web/20260514012244/https://timesofindia.indiatimes.com/auto/cars/tata-altroz-cng-amt-launched-price-efficiency-more/articleshow/131036146.cms,"Follow Us On Social Media
Copyright © 2026 Bennett, Coleman &amp; Co. Ltd. All rights reserved. For reprint rights: Times Syndication Service",,"Tata Altroz ​​CNG AMT eingeführt: Preis, Effizienz und mehr. Was die Ausstattung angeht, verfügt der Altroz ​​CNG AMT über sechs Airbags und ein elektronisches Stabilitätsprogramm, maschinengeschnittene 16-Zoll-Leichtmetallfelgen, LED-Nebelscheinwerfer, eine verbindende LED-Lichtleiste am Heck, ein 7-Zoll-Digitalinstrumentenkombi, ein Schiebedach mit Sprachbefehlen, ein Schnellladegerät …","Tata Altroz CNG AMT launched: Price, efficiency & more. In terms of features, the Altroz CNG AMT gets six airbags, and an electronic stability program, 16-inch machine-cut alloys, LED fog lights, a connecting LED light bar at the rear, a 7-inch digital instrument cluster, a sunroof with voice commands, a fast-char…","Tata Altroz ​​CNG AMT deductae: Pretium, efficientia & plus. In terms of features, the Altroz CNG AMT gets six airbags, and an electronic stability program, 16-inch machine-cut alloys, LED fog lights, a connecting LED light bar at the rear, a 7-inch digital instrument cluster, a sunroof with voice commands, a fast-char…",2026-05-14 16:58:23+00:00
d53f965581d93836cd74afba3b5c5d49,2026-05-13T16:30:04Z,+fog light,www.news24.com,en,0.8,News24 | Thursday’s weather: Cool and warm in most parts; damaging waves in KZN,"Damaging waves, which may disrupt ports, are expected in KwaZulu-Natal, while cool and warm conditions are forecast for most parts of the country, with morning fog in at least three provinces, according to the South African Weather Service.",https://www.news24.com/southafrica/weather/thursdays-weather-cool-and-warm-in-most-parts-damaging-waves-in-kzn-20260513-0846,https://news24cobalt.24.co.za/resources/02a5-209dc192add2-75ab778dc763-1000/format/inline/gi_0584200.jpeg,http://web.archive.org/web/20260514001801/https://www.news24.com/southafrica/weather/thursdays-weather-cool-and-warm-in-most-parts-damaging-waves-in-kzn-20260513-0846,"Damaging waves, which may disrupt ports, are expected in KwaZulu-Natal, while cool and warm conditions are forecast for most parts of the country, with morning fog in at least three provinces, accord… [+3271 chars]",,"News24 | Wetter am Donnerstag: Überwiegend kühl und warm; schädliche Wellen im KZN. In KwaZulu-Natal werden schädliche Wellen erwartet, die Häfen stören könnten, während für die meisten Teile des Landes kühle und warme Bedingungen vorhergesagt werden, mit Morgennebel in mindestens drei Provinzen, so der südafrikanische Wetterdienst.","News24 | Thursday’s weather: Cool and warm in most parts; damaging waves in KZN. Damaging waves, which may disrupt ports, are expected in KwaZulu-Natal, while cool and warm conditions are forecast for most parts of the country, with morning fog in at least three provinces, according to the South African Weather Service.","News24 | Tempestas Iovis: in pluribus partibus frigus et calidus; damnosa unda in KZN. Fluctus damnosi, qui portus perturbare possunt, in KwaZulu-Natal expectantur, dum condiciones frigidae et calidae in plerisque patriae partibus praesagiunt, cum nebula matutina in tribus saltem provinciis, secundum servicium Tempestatis Africae Australis.",2026-05-14 16:58:23+00:00
678f3c65d9521ce57a4590e25e58e218,2026-05-07T03:11:24Z,+fog alert,www.boredpanda.com,en,0.3,58 Unbelievable Photos Taken On Earth That Feel Like Glimpses Into Another Universe,"There are so many places, things, creatures and plants on Earth that sometimes look like they come from a galaxy far, far away. For example, the painted dunes in California, which take on a sculpted, almost surreal form when the sun is low in the sky. Or macr…",https://www.boredpanda.com/photos-look-like-alien-planet/,https://static.boredpanda.com/blog/wp-content/uploads/2026/05/photos-look-like-alien-planet-fb-69fb321af104e.png,,"A lot of photographers believe that nature is one of the best inspirations for ethereal photography. Sunlight, storms, rain, snow, and even fog can produce stunning images.
Fog, for example, strips … [+698 chars]",,"58 unglaubliche Fotos, die auf der Erde aufgenommen wurden und sich wie Einblicke in ein anderes Universum anfühlen. Es gibt so viele Orte, Dinge, Lebewesen und Pflanzen auf der Erde, die manchmal aussehen, als kämen sie aus einer weit, weit entfernten Galaxie. Zum Beispiel die bemalten Dünen in Kalifornien, die bei tief stehender Sonne eine skulpturale, fast surreale Form annehmen. Oder macr…","58 Unbelievable Photos Taken On Earth That Feel Like Glimpses Into Another Universe. There are so many places, things, creatures and plants on Earth that sometimes look like they come from a galaxy far, far away. For example, the painted dunes in California, which take on a sculpted, almost surreal form when the sun is low in the sky. Or macr…","LVIII Incredibiles imagines sumptae in terra quae sentiant prospicit in alium mundum. Tot sunt loca, res, creaturae et plantae in Terra quae interdum apparent sicut ex galaxia longe, procul. Exempli gratia, dunes pictae in California, quae sculptam induunt, formam paene surrealem cum sol in caelo est humilis. Vel macr...",2026-05-16 15:53:33+00:00
02689a59279a796cf4c8c2702c1f0049,2026-05-08T09:14:03Z,+fog alert,www.boredpanda.com,en,0.3,58 Photos That Look Like They Couldn’t Have Been Taken On Earth,"There are so many places, things, creatures and plants on Earth that sometimes look like they come from a galaxy far, far away. For example, the painted dunes in California, which take on a sculpted, almost surreal form when the sun is low in the sky. Or macr…",https://www.boredpanda.com/photos-look-like-alien-planet-msn/,https://static.boredpanda.com/blog/wp-content/uploads/2026/05/photos-look-like-alien-planet-fb-69fcaea6eaefd.png,http://web.archive.org/web/20260509062911/https://www.boredpanda.com/photos-look-like-alien-planet-msn/,"A lot of photographers believe that nature is one of the best inspirations for ethereal photography. Sunlight, storms, rain, snow, and even fog can produce stunning images.
Fog, for example, strips … [+698 chars]",,"58 Fotos, die aussehen, als wären sie nicht auf der Erde aufgenommen worden. Es gibt so viele Orte, Dinge, Lebewesen und Pflanzen auf der Erde, die manchmal aussehen, als kämen sie aus einer weit, weit entfernten Galaxie. Zum Beispiel die bemalten Dünen in Kalifornien, die bei tief stehender Sonne eine skulpturale, fast surreale Form annehmen. Oder macr…","58 Photos That Look Like They Couldn’t Have Been Taken On Earth. There are so many places, things, creatures and plants on Earth that sometimes look like they come from a galaxy far, far away. For example, the painted dunes in California, which take on a sculpted, almost surreal form when the sun is low in the sky. Or macr…","58 Imagines apparentes quae in Tellure sumptae non sunt. Tot sunt loca, res, creaturae et plantae in Terra quae interdum apparent sicut ex galaxia longe, procul. Exempli gratia, dunes pictae in California, quae sculptam induunt, formam paene surrealem cum sol in caelo est humilis. Vel macr...",2026-05-16 15:53:33+00:00
fa11858f25d23a97e12124aa7c3979f9,2026-05-15T16:23:00Z,+fog light,bringatrailer.com,en,0.8,1998 Mercedes-Benz SL500 at No Reserve,"This 1998 Mercedes-Benz SL500 is finished in Glacier White over Ash leather and is powered by a 5.0-liter V8 paired with a five-speed automatic transmission. Features include a removable hardtop, a black soft top, 18"" AMG Monoblock wheels, fog lights, heated …",https://bringatrailer.com/listing/1998-mercedes-benz-sl500-225/,https://bringatrailer.com/wp-content/uploads/2026/05/1998_mercedes-benz_sl500_img_3080-97162.jpg,,"This 1998 Mercedes-Benz SL500 is finished in Glacier White over Ash leather and is powered by a 5.0-liter V8 paired with a five-speed automatic transmission. Features include a removable hardtop, a b… [+2134 chars]",,"1998 Mercedes-Benz SL500 ohne Reserve. Dieser Mercedes-Benz SL500 von 1998 ist in Glacier White über Ash-Leder lackiert und wird von einem 5,0-Liter-V8 gepaart mit einem Fünfgang-Automatikgetriebe angetrieben. Zur Ausstattung gehören ein abnehmbares Hardtop, ein schwarzes Verdeck, 18-Zoll-AMG-Monoblock-Räder, Nebelscheinwerfer, beheizte …","1998 Mercedes-Benz SL500 at No Reserve. This 1998 Mercedes-Benz SL500 is finished in Glacier White over Ash leather and is powered by a 5.0-liter V8 paired with a five-speed automatic transmission. Features include a removable hardtop, a black soft top, 18"" AMG Monoblock wheels, fog lights, heated …","1998 Mercedes-Benz SL500 ad Subsidium No. Hoc 1998 Mercedes-Benz SL500 in Glacier Alba super corium Fraxinum finitur et per 5.0-sextarius V8 paratur cum quinque-celeritate transmissione latae sententiae. Lineamenta includunt hardtop amovibilem, mollem verticem nigrum, 18"" AMG Monoblock rotae, lumina nebula, calefacta ...",2026-05-17 11:00:25+00:00
78a08fc431ab42fb55abfc5ceb02dd9f,2026-05-11T10:30:52Z,+fog weather,economictimes.indiatimes.com,en,0.8,"The dashboard setting that clears windshield fog faster, and why warm air plus A/C works better than people expect","Windshield fogging, a common driver frustration, can be quickly resolved by using the air conditioning, even in cold weather. Automakers explain that the A/C dehumidifies the air, preventing condensation on cold surfaces. Combining warm air with the A/C and d…",https://economictimes.indiatimes.com/news/international/us/the-dashboard-setting-that-clears-windshield-fog-faster-and-why-warm-air-plus-a/c-works-better-than-people-expect/articleshow/131011146.cms,"https://img.etimg.com/thumb/msid-131011146,width-1200,height-630,imgsize-1304356,overlay-economictimes/articleshow.jpg",,"Not many things irritate motorists more quickly than when their windshields fog up. It's one thing if you can clearly see the road ahead, but suddenly your windshield gets all foggy and begins rainin… [+5012 chars]",,"Die Armaturenbretteinstellung, die den Beschlag von der Windschutzscheibe schneller beseitigt, und warum Warmluft plus Klimaanlage besser funktionieren, als man erwartet. Das Beschlagen der Windschutzscheibe, ein häufiges Frustrationsproblem bei Autofahrern, kann durch die Nutzung der Klimaanlage auch bei kaltem Wetter schnell behoben werden. Autohersteller erklären, dass die Klimaanlage die Luft entfeuchtet und so Kondensation auf kalten Oberflächen verhindert. Durch die Kombination von warmer Luft mit der Klimaanlage und d…","The dashboard setting that clears windshield fog faster, and why warm air plus A/C works better than people expect. Windshield fogging, a common driver frustration, can be quickly resolved by using the air conditioning, even in cold weather. Automakers explain that the A/C dehumidifies the air, preventing condensation on cold surfaces. Combining warm air with the A/C and d…","In ashboardday occasus qui citius nebulam windshield purgat, et quare calidum aerem plus A/C melius operatur quam homines exspectant. Windshield fogging, agitator communis vanitati, cito resolvi potest utendo condiciones aeris, etiam frigoribus. Automakers explicant A/C aerem dehumidificare, praeveniens condensationem in superficiebus frigidis. Compositum calidum aerem cum A/C et d…",2026-05-17 15:54:38+00:00
d65ca1615787a5bebd7593c14c2065ac,2026-05-16T22:59:59Z,+foggy conditions,cnalifestyle.channelnewsasia.com,en,0.3,Feeling foggy and tired? Your gut health may be affecting your brain,<![CDATA[ Scientists keep learning more about the connection between the brain and the gastrointestinal system. ]]>,https://cnalifestyle.channelnewsasia.com/wellness/gut-brain-fog-health-582921,"https://dam.mediacorp.sg/image/upload/s--UW1qBXqQ--/c_crop,h_900,w_1600,x_0,y_288/c_fill,g_auto,h_676,w_1200/f_auto,q_auto/v1/mediacorp/cna/image/2026/05/11/well_gut_brain-0.jpg?itok=q2eRHkBh",,"Dr Kyle Staller is a gastroenterologist, so it may be surprising that many of his patients come to him complaining not only about stomach trouble but about their brains, too.
Irritable bowel syndrom… [+6011 chars]",,Fühlen Sie sich neblig und müde? Ihre Darmgesundheit kann Auswirkungen auf Ihr Gehirn haben. <![CDATA[ Wissenschaftler erfahren immer mehr über die Verbindung zwischen dem Gehirn und dem Magen-Darm-System. ]]>,Feeling foggy and tired? Your gut health may be affecting your brain. <![CDATA[ Scientists keep learning more about the connection between the brain and the gastrointestinal system. ]]>,Sententia nebulosus et defessus? Ventrem tuum sanum esse potest circa cerebrum tuum. <![ CDATA[ Scientistae plus discunt de connexione inter cerebrum et systema gastrointestina. ]]>,2026-05-18 08:42:26+00:00
1e2d82a801bf6cb385a901e6c76a5d8a,2026-05-14T16:30:11Z,+fog light,www.news24.com,en,0.8,"News24 | Friday’s weather: Foggy morning, cool to warm in most parts; light rain in Eastern Cape, KZN","Morning fog is forecast for most parts, with the day expected to be cool and warm, while there is a chance of light rain in the Eastern Cape and KwaZulu-Natal, according to the South African Weather Service.",https://www.news24.com/southafrica/weather/fridays-weather-foggy-morning-cool-to-warm-in-most-parts-light-rain-in-eastern-cape-kzn-20260514-0918,https://news24cobalt.24.co.za/resources/02a5-209fc53d5c2a-9ff4552284a6-1000/format/inline/whatsapp_image_2025-08-09_at_13.57.32.jpeg,http://web.archive.org/web/20260515045356/https://www.news24.com/southafrica/weather/fridays-weather-foggy-morning-cool-to-warm-in-most-parts-light-rain-in-eastern-cape-kzn-20260514-0918,"Morning fog is forecast for most parts, with the day expected to be cool and warm, while there is a chance of light rain in the Eastern Cape and KwaZulu-Natal, according to the South African Weather … [+3101 chars]",,"News24 | Wetter am Freitag: Nebeliger Morgen, größtenteils kühl bis warm; leichter Regen in Eastern Cape, KZN. Für die meisten Teile wird Morgennebel vorhergesagt, wobei der Tag voraussichtlich kühl und warm sein wird, während im Ostkap und in KwaZulu-Natal leichte Regenfälle möglich sind, so der südafrikanische Wetterdienst.","News24 | Friday’s weather: Foggy morning, cool to warm in most parts; light rain in Eastern Cape, KZN. Morning fog is forecast for most parts, with the day expected to be cool and warm, while there is a chance of light rain in the Eastern Cape and KwaZulu-Natal, according to the South African Weather Service.","News24 | Tempestas Veneris: mane Foggy, in pluribus partibus calefieri; pluviae levis in orientali Promontorio KZN. Nebula matutina pluribus partibus praecognoscet, cum dies expectatur ut frigus et calidum sit, cum facultas pluviae lucis in Promontorio Orientali et KwaZulu-Natal, secundum servitii Tempestatis Africae Australis.",2026-05-19 08:22:18+00:00
