index,published,keyword,domain,language,valid,title,description,url,image,archive,content,quote,de,en,la,added
fa4a1f2fbf2b9adf4e3e17ca0f38c10e,2026-05-20T18:37:53Z,+fog light,bringatrailer.com,en,0.8,426 Hemi–Powered 1970 Plymouth ’Cuda 4-Speed,"This 1970 Plymouth ’Cuda coupe has been modified with the installation of a 426ci Hemi V8 and a four-speed manual transmission. The car was repainted in Lime Light in the mid-2000s and has a Shaker hood, “hockey-stick” graphics, a rear wing, fog lights, Rally…",https://bringatrailer.com/listing/1970-plymouth-cuda-89/,https://bringatrailer.com/wp-content/uploads/2026/03/1970_plymouth_cuda_img_9986-22693.jpeg,,This 1970 Plymouth Cuda coupe has been modified with the installation of a 426ci Hemi V8 and a four-speed manual transmission. The car was repainted in Lime Light in the mid-2000s and has a Shaker ho… [+3608 chars],,"426 Hemi-Powered 1970 Plymouth ’Cuda 4-Gang. Dieses Plymouth Cuda Coupé von 1970 wurde durch den Einbau eines 426ci Hemi V8 und eines Viergang-Schaltgetriebes modifiziert. Das Auto wurde Mitte der 2000er Jahre in Lime Light neu lackiert und verfügt über eine Shaker-Motorhaube, „Hockeyschläger“-Grafiken, einen Heckflügel, Nebelscheinwerfer, Rally …","426 Hemi–Powered 1970 Plymouth ’Cuda 4-Speed. This 1970 Plymouth ’Cuda coupe has been modified with the installation of a 426ci Hemi V8 and a four-speed manual transmission. The car was repainted in Lime Light in the mid-2000s and has a Shaker hood, “hockey-stick” graphics, a rear wing, fog lights, Rally…","426 Hemi-Powered 1970 Plymouth 'Cuda 4-Speed. Hoc 1970 Plymouth 'Cuda coupe mutata est cum institutione 426ci Hemi V8 et quattuor celeritas manualis transmissionis. Raeda in luce media 2000s in calce repatata est et cucullo Shaker ""hockey-baculum"" graphics, alae postremae, lumina nebulae, concurrite...",2026-05-24 15:58:04+00:00
dc304b30cd2f64ce7729c8902e25526c,2026-05-21T22:50:25Z,+fog light,bringatrailer.com,en,0.8,2011 Jeep Wrangler Unlimited Sport 6-Speed at No Reserve,"This 2011 Jeep Wrangler Unlimited Sport is finished in Bright Silver Metallic over black cloth. The truck is powered by a 3.8-liter V6 linked to a six-speed manual transmission and a dual-range transfer case, and features include a black hardtop, fog lights, …",https://bringatrailer.com/listing/2011-jeep-wrangler-unlimited-19/,https://bringatrailer.com/wp-content/uploads/2026/05/2011_jeep_wrangler-unlimited_img_0617-03666.jpg,,This 2011 Jeep Wrangler Unlimited Sport is finished in Bright Silver Metallic over black cloth. The truck is powered by a 3.8-liter V6 linked to a six-speed manual transmission and a dual-range trans… [+1628 chars],,"2011 Jeep Wrangler Unlimited Sport 6-Gang ohne Reserve. Dieser Jeep Wrangler Unlimited Sport aus dem Jahr 2011 ist in Bright Silver Metallic über schwarzem Stoff lackiert. Der Lkw wird von einem 3,8-Liter-V6 angetrieben, der mit einem Sechsgang-Schaltgetriebe und einem Zweibereichs-Verteilergetriebe verbunden ist. Zur Ausstattung gehören ein schwarzes Hardtop, Nebelscheinwerfer, …","2011 Jeep Wrangler Unlimited Sport 6-Speed at No Reserve. This 2011 Jeep Wrangler Unlimited Sport is finished in Bright Silver Metallic over black cloth. The truck is powered by a 3.8-liter V6 linked to a six-speed manual transmission and a dual-range transfer case, and features include a black hardtop, fog lights, …","MMXI Jeep Wrangler Infinitus Summum VI-speed at nulla Subsidium. This 2011 Jeep Wrangler Unlimited Sport is finished in Bright Silver Metallic over black cloth. Salsissimus vir vivens 3.8-sextarius V6 coniungitur cum sex velocitate transmissionis manualis et casu translationis duali-range, et notae includunt hardtop nigra, lumina nebula ...",2026-05-25 02:48:20+00:00
d54cfb24a131762100eb2296f1b9118c,2026-05-21T11:09:00Z,+fog slow down,www.mindbodygreen.com,en,0.3,This One Sleep Habit Might Matter More Than Hours Slept For Cognitive Health,"Plus, 5 ways to catch more Zzz's",https://www.mindbodygreen.com/articles/common-sleep-deficiency-may-be-affecting-your-brain-health,"https://mindbodygreen-res.cloudinary.com/image/upload/c_fill,w_2000,h_1200,g_auto,fl_lossy,f_jpg/org/9twq5dmsdk7w364wx.jpg",http://web.archive.org/web/20260522102249/https://www.mindbodygreen.com/articles/common-sleep-deficiency-may-be-affecting-your-brain-health,"Weve all felt the brain fog after a poor nights sleep. But beyond the grogginess, research is now showing that consistently missing out on certain sleep stages, particularly deep and REM sleep, could… [+3296 chars]",,"Diese eine Schlafgewohnheit könnte für die kognitive Gesundheit wichtiger sein als stundenlang geschlafen. Plus, 5 Möglichkeiten, mehr Zzz's zu fangen","This One Sleep Habit Might Matter More Than Hours Slept For Cognitive Health. Plus, 5 ways to catch more Zzz's","Hic unus somnus Consuetudo plus quam horas dormivit For Cognitive Health. Plus, 5 modi plus Zzz's capere",2026-05-25 12:59:24+00:00
ac71e5ae2ad689179c67f1534e7327c4,2026-05-24T16:32:35Z,+fog weather,www.news24.com,en,0.8,News24 | Monday’s weather: Foggy and cloudy start to the week with cool temperatures,"Monday’s weather brings a mix of conditions across the provinces, with some areas experiencing fog, rain and varying temperatures, according to the South African Weather Service.",https://www.news24.com/southafrica/weather/mondays-weather-foggy-and-cloudy-start-to-the-week-with-cool-temperatures-20260524-0992,https://news24cobalt.24.co.za/resources/0299-1dbd7d9384b4-7ff481a37350-1000/format/inline/fog.jpeg,http://web.archive.org/web/20260525024254/https://www.news24.com/southafrica/weather/mondays-weather-foggy-and-cloudy-start-to-the-week-with-cool-temperatures-20260524-0992,"Mondays weather brings a mix of conditions across the provinces, with some areas experiencing fog, rain and varying temperatures, according to the South African Weather Service.
The weather in your … [+2251 chars]",,"News24 | Wetter am Montag: Nebeliger und bewölkter Start in die Woche mit kühlen Temperaturen. Nach Angaben des südafrikanischen Wetterdienstes bringt das Wetter am Montag in den Provinzen gemischte Bedingungen mit sich, wobei in einigen Gebieten Nebel, Regen und schwankende Temperaturen herrschen.","News24 | Monday’s weather: Foggy and cloudy start to the week with cool temperatures. Monday’s weather brings a mix of conditions across the provinces, with some areas experiencing fog, rain and varying temperatures, according to the South African Weather Service.","News24 | Lunae tempestatum: Foggy et nubilum incipiant hebdomade cum temperaturis frigidis. Tempestas Lunae per provincias condiciones mixtas affert, quibusdam locis nebulam, pluviam et temperaturas varias, secundum Servitium Tempestatis Africae Australis.",2026-05-25 17:03:33+00:00
7e22731a7abcf0e66f27b2db4f28d35e,2026-05-22T16:29:54Z,+fog weather,www.news24.com,en,0.8,"News24 | Saturday’s weather: Severe thunderstorms in KZN; foggy morning, cloudy and cold elsewhere","Severe thunderstorms with heavy rain, damaging winds, and hail are expected in KwaZulu-Natal, while the rest of the country will start Saturday foggy, then cloudy and cold for the rest of the day, according to the South African Weather Service.",https://www.news24.com/southafrica/weather/saturdays-weather-severe-thunderstorms-in-kzn-foggy-morning-cloudy-and-cold-elsewhere-20260522-0989,https://news24cobalt.24.co.za/resources/02a0-1f65f5496fbe-95a98b7d14d3-1000/format/inline/gettyimages-2164629051.jpeg,,"Severe thunderstorms with heavy rain, damaging winds, and hail are expected in KwaZulu-Natal, while the rest of the country will start Saturday foggy, then cloudy and cold for the rest of the day, ac… [+4098 chars]",,"News24 | Wetter am Samstag: Schwere Gewitter im KZN; nebliger Morgen, anderswo bewölkt und kalt. Nach Angaben des südafrikanischen Wetterdienstes werden in KwaZulu-Natal schwere Gewitter mit starkem Regen, schädlichen Winden und Hagel erwartet, während der Rest des Landes am Samstag zunächst neblig und dann für den Rest des Tages bewölkt und kalt sein wird.","News24 | Saturday’s weather: Severe thunderstorms in KZN; foggy morning, cloudy and cold elsewhere. Severe thunderstorms with heavy rain, damaging winds, and hail are expected in KwaZulu-Natal, while the rest of the country will start Saturday foggy, then cloudy and cold for the rest of the day, according to the South African Weather Service.","News24 | Tempestas Saturni: Tonitrua Gravia in KZN; mane nebulosus, alibi nubilus et frigidus. Tempestates graves cum pluviae, ventis destillationibus, et grando in KwaZulu-Natal expectantur, dum reliquae terrae Saturni nebulosus incipiet, deinde nebulosus et frigidus propter reliquum diei, secundum Servitium Tempestatis Africae Australis.",2026-05-25 21:00:07+00:00
319625f39704dd4e2e3cd18435e96408,2026-05-25T16:30:34Z,+fog light,www.news24.com,en,0.8,"News24 | Tuesday’s weather: Foggy morning, cloudy, cool and warm across SA","Morning fog is forecast for most parts, but the rest of the day will be cloudy, cool and warm, according to the South African Weather Service.",https://www.news24.com/southafrica/weather/tuesdays-weather-foggy-morning-cloudy-cool-and-warm-across-sa-20260525-0834,https://news24cobalt.24.co.za/resources/02a3-20453f825cff-625827c305b4-1000/format/inline/weather_fog.jpeg,http://web.archive.org/web/20260526041020/https://www.news24.com/southafrica/weather/tuesdays-weather-foggy-morning-cloudy-cool-and-warm-across-sa-20260525-0834,"Morning fog is forecast for most parts, but the rest of the day will be cloudy, cool and warm, according to the South African Weather Service (SAWS).
The weather in your area
Gauteng: Fine and cool… [+2703 chars]",,"News24 | Wetter am Dienstag: Nebliger Morgen, bewölkt, kühl und warm in ganz Südafrika. Nach Angaben des südafrikanischen Wetterdienstes wird es für den Rest des Tages bewölkt, kühl und warm sein.","News24 | Tuesday’s weather: Foggy morning, cloudy, cool and warm across SA. Morning fog is forecast for most parts, but the rest of the day will be cloudy, cool and warm, according to the South African Weather Service.","News24 | Tempestas Martis: Foggy mane, nubilum, frigus et calidum trans SA. Nebula matutina pluribus partibus praecognoscet, sed reliquum diei nubilum, frigus et calidum erit, secundum servitii Tempestatis Africae Australis.",2026-05-26 17:54:35+00:00
111dcdb7a676678e79881a3f3013efb6,2026-05-14T22:10:08Z,+fog alert,bringatrailer.com,en,0.8,2018 Genesis G80 3.8 RWD,"This 2018 Genesis G80 is powered by a 3.8-liter V6 that drives the rear wheels through an eight-speed automatic transmission. The car is equipped with the Premium Package, which added LED fog lights, a panoramic sunroof, a Lexicon 14-speaker audio system, a c…",https://bringatrailer.com/listing/2018-genesis-g80/,https://bringatrailer.com/wp-content/uploads/2026/04/2018_genesis_g80_DSC06085-48674-scaled.jpg,,"This 2018 Genesis G80 is powered by a 3.8-liter V6 that drives the rear wheels through an eight-speed automatic transmission. The car is equipped with the Premium Package, which added LED fog lights,… [+2660 chars]",,"2018 Genesis G80 3.8 RWD. Dieser Genesis G80 aus dem Jahr 2018 wird von einem 3,8-Liter-V6 angetrieben, der die Hinterräder über ein Achtgang-Automatikgetriebe antreibt. Das Auto ist mit dem Premium-Paket ausgestattet, das LED-Nebelscheinwerfer, ein Panorama-Schiebedach, ein Lexicon-Audiosystem mit 14 Lautsprechern, ein …","2018 Genesis G80 3.8 RWD. This 2018 Genesis G80 is powered by a 3.8-liter V6 that drives the rear wheels through an eight-speed automatic transmission. The car is equipped with the Premium Package, which added LED fog lights, a panoramic sunroof, a Lexicon 14-speaker audio system, a c…","2018 Genesis G80 3.8 RWD. Hoc 2018 Genesis G80 potens est per 3.8-sextarius V6 qui rotas posteriores agit per transmissionem octo velocitatis latae. Raeda instructa cum Sarcina Premium, quae lumina nebulae DUXERIT, sunroof panoramicum, Lexicon systematis audio 14-oratoris, a c...",2026-05-27 02:47:16+00:00
59e9a46cdfe1c5443ea4ce083496ae1c,2026-05-26T07:49:00Z,+fog light,www.prnewswire.com,en,0.8,"Global Times: Chinese, Bangladeshi, Pakistani researchers gather in Shanghai to breed better fish and closer ties","SHANGHAI, May 26, 2026 /PRNewswire/ -- At five o'clock on a misty morning in Xinchang Town of suburban Shanghai, the fog has yet to lift, and the fish pond's surface shimmers with a clear, silvery light. There, at the base of an experimental station for aquat…",https://www.prnewswire.com/news-releases/global-times-chinese-bangladeshi-pakistani-researchers-gather-in-shanghai-to-breed-better-fish-and-closer-ties-302781595.html,,,"SHANGHAI, May 26, 2026 /PRNewswire/ -- At five o'clock on a misty morning in Xinchang Town of suburban Shanghai, the fog has yet to lift, and the fish pond's surface shimmers with a clear, silvery li… [+10067 chars]",,"Global Times: Chinesische, bangladeschische und pakistanische Forscher treffen sich in Shanghai, um bessere Fische zu züchten und engere Beziehungen zu pflegen. SHANGHAI, 26. Mai 2026 /PRNewswire/ -- Um fünf Uhr an einem nebligen Morgen in der Stadt Xinchang in einem Vorort von Shanghai muss sich der Nebel noch lichten, und die Oberfläche des Fischteichs schimmert in einem klaren, silbernen Licht. Dort, am Fuße einer Versuchsstation für Aqua…","Global Times: Chinese, Bangladeshi, Pakistani researchers gather in Shanghai to breed better fish and closer ties. SHANGHAI, May 26, 2026 /PRNewswire/ -- At five o'clock on a misty morning in Xinchang Town of suburban Shanghai, the fog has yet to lift, and the fish pond's surface shimmers with a clear, silvery light. There, at the base of an experimental station for aquat…","Global tempora: Seres, Bangladeshi, Pakistani investigatores in Shanghai colligent ut pisces meliores et arctiores necessitudines gignant. SHANGHAI, die 26 Maii 2026 / PRNewswire/ -- Ad horam quintam in nebuloso mane in oppido Shanghai Xinchang suburbana, nebula adhuc se levat, et superficies vivaria vivaria luce clara, luce argenteo. Ibi, ad basin stationem experimentalem pro aquat...",2026-05-27 08:35:50+00:00
d61190b0b4667ccf528bb574bc5863b5,2026-05-21T10:00:28Z,+foggy conditions,www.kqed.org,en,0.3,The Wetsuit Changed Surfing — We’ve Got a Berkeley Physicist to Thank for It,"Despite its cold ocean water, the Bay Area played a big role in the invention of the wetsuit. Ocean Beach surfers and a UC Berkeley physicist had a part to play.",https://www.kqed.org/news/12084476/the-wetsuit-changed-surfing-weve-got-a-berkeley-physicist-to-thank-for-it,https://cdn.kqed.org/wp-content/uploads/sites/10/2026/04/HistoryofWetsuit.jpg,,"Olivia Allen-Price: It’s a foggy day at San Francisco’s Ocean Beach … just like so many before it.
Everything’s gray … cold and windy … but familiar landmarks stick out in the fog … seal rock … the … [+17039 chars]",,Der Neoprenanzug hat das Surfen verändert – Wir haben es einem Berkeley-Physiker zu verdanken. Trotz des kalten Meerwassers spielte die Bay Area eine große Rolle bei der Erfindung des Neoprenanzugs. Ocean Beach-Surfer und ein Physiker der UC Berkeley spielten eine Rolle.,"The Wetsuit Changed Surfing — We’ve Got a Berkeley Physicist to Thank for It. Despite its cold ocean water, the Bay Area played a big role in the invention of the wetsuit. Ocean Beach surfers and a UC Berkeley physicist had a part to play.","Wetsuit Surfing Mutata - Berkeley Physicis gratias egimus pro It. Quamvis aqua frigida oceani, Sinus Area magnum munus in humidis inventione egit. Oceani Beach superficies et UC Berkeley physicus partem fabulae habuit.",2026-05-27 21:47:54+00:00
3bc0f49d98977e82bec4d83cab240451,2026-05-04T16:50:11Z,+fog warning system,bringatrailer.com,en,0.3,2021 Alfa Romeo Giulia Quadrifoglio,This 2021 Alfa Romeo Giulia Quadrifoglio was ordered new by the seller through Alfa Romeo and Fiat of Burlingame in California. It was specified in Trofeo White Tri-Coat over black leather and Alcantara with contrasting stitching and was factory optioned with…,https://bringatrailer.com/listing/2021-alfa-romeo-giulia-quadrifoglio-2/,https://bringatrailer.com/wp-content/uploads/2026/04/2021_alfa-romeo_giulia-quadrifoglio_img_1689-06117.jpg,http://web.archive.org/web/20260511161754/https://bringatrailer.com/listing/2021-alfa-romeo-giulia-quadrifoglio-2/,This 2021 Alfa Romeo Giulia Quadrifoglio was ordered new by the seller through Alfa Romeo and Fiat of Burlingame in California. It was specified in Trofeo White Tri-Coat over black leather and Alcant… [+2423 chars],,2021 Alfa Romeo Giulia Quadrifoglio. Dieser Alfa Romeo Giulia Quadrifoglio aus dem Jahr 2021 wurde vom Verkäufer neu über Alfa Romeo und Fiat aus Burlingame in Kalifornien bestellt. Es wurde in Trofeo White Tri-Coat über schwarzem Leder und Alcantara mit kontrastierenden Nähten spezifiziert und war ab Werk mit … ausgestattet.,2021 Alfa Romeo Giulia Quadrifoglio. This 2021 Alfa Romeo Giulia Quadrifoglio was ordered new by the seller through Alfa Romeo and Fiat of Burlingame in California. It was specified in Trofeo White Tri-Coat over black leather and Alcantara with contrasting stitching and was factory optioned with…,2021 Alfa Romeo Giulia Quadrifoglio. Hoc 2021 Alfa Romeo Giulia Quadrifoglio novus a venditore per Alfa Romeo et Fiat de Burlingame in California iussus est. Certatum est in Trofeo Alba Tri-Coat super corium nigrum et Alcantara cum diversa sutura et officina optionis cum…,2026-05-28 13:43:33+00:00
e3580b95dd47093678a98be9a0175d04,2026-05-21T18:46:06Z,+fog accident,bringatrailer.com,en,0.3,1999 Mercedes-Benz SL500,"This black-on-black 1999 Mercedes-Benz SL500 has 66k miles and is powered by a 5.0-liter V8 paired with a five-speed automatic transmission. Features include a removable hardtop with a panoramic glass roof, a black soft top, 18"" AMG Monoblock wheels, fog ligh…",https://bringatrailer.com/listing/1999-mercedes-benz-sl500-328/,https://bringatrailer.com/wp-content/uploads/2026/05/1999_mercedes-benz_sl500_dsc9400-77126.jpg,,This black-on-black 1999 Mercedes-Benz SL500 has 66k miles and is powered by a 5.0-liter V8 paired with a five-speed automatic transmission. Features include a removable hardtop with a panoramic glas… [+2488 chars],,"1999 Mercedes-Benz SL500. Dieser schwarz-auf-schwarze Mercedes-Benz SL500 von 1999 hat eine Laufleistung von 66.000 Meilen und wird von einem 5,0-Liter-V8 gepaart mit einem Fünfgang-Automatikgetriebe angetrieben. Zur Ausstattung gehören ein abnehmbares Hardtop mit Panorama-Glasdach, ein schwarzes Verdeck, 18-Zoll-AMG-Monoblock-Räder, Nebelscheinwerfer …","1999 Mercedes-Benz SL500. This black-on-black 1999 Mercedes-Benz SL500 has 66k miles and is powered by a 5.0-liter V8 paired with a five-speed automatic transmission. Features include a removable hardtop with a panoramic glass roof, a black soft top, 18"" AMG Monoblock wheels, fog ligh…","1999 Mercedes-Benz SL500. Hic niger-in-nigrum 1999 Mercedes-Benz SL500 milia 66k habet et 5.0-sextarius V8 par cum quinque-celeritate transmissionis automatice potens est. Lineamenta includunt hardtop amovibilem cum tecto vitreo panoramico, vertice molli nigro, 18"" AMG Monoblock rotae, nebula ligh…",2026-05-30 16:01:21+00:00
9a2c4b4db9cd1e4a4c0cb903d6d1503f,2026-05-29T16:30:03Z,+foggy conditions,www.news24.com,en,0.8,"News24 | Saturday’s weather: Foggy morning, cloudy and warm with isolated showers in 3 provinces","The South African Weather Service has forecast fog in the morning but cloudy and warm conditions across the country, with isolated showers in Mpumalanga, Eastern Cape and KwaZulu-Natal.",https://www.news24.com/southafrica/weather/saturdays-weather-foggy-morning-cloudy-and-warm-with-isolated-showers-in-3-provinces-20260529-0979,https://news24cobalt.24.co.za/resources/029a-1df9dad09aaf-2f17394271fd-1000/format/inline/fog.jpeg,,"The South African Weather Service has forecast fog in the morning but cloudy and warm conditions across the country, with isolated showers in Mpumalanga, Eastern Cape and KwaZulu-Natal.
The weather … [+2964 chars]",,"News24 | Wetter am Samstag: Nebliger Morgen, bewölkt und warm mit vereinzelten Schauern in 3 Provinzen. Der südafrikanische Wetterdienst hat für den Morgen Nebel, aber im ganzen Land bewölkte und warme Bedingungen vorhergesagt, mit vereinzelten Schauern in Mpumalanga, Ostkap und KwaZulu-Natal.","News24 | Saturday’s weather: Foggy morning, cloudy and warm with isolated showers in 3 provinces. The South African Weather Service has forecast fog in the morning but cloudy and warm conditions across the country, with isolated showers in Mpumalanga, Eastern Cape and KwaZulu-Natal.","News24 | Tempestas Saturni: mane Foggy, nubilum et calidum cum imbribus solitariis in 3 provinciis. Ministerium Tempestatis Africanae Australis nebulam mane praenuntiat, sed condiciones nubilosas et calidas per patriam, cum imbres solitarii in Mpumalanga, Promontorium Orientale et KwaZulu-Natal.",2026-05-30 20:49:49+00:00
